[Peptides-struct] task=regression  metric=mae (higher_is_better=False)
  Loading cached distance masks from ./data/Peptides-struct/dist_masks/train.pkl
  Loading cached distance masks from ./data/Peptides-struct/dist_masks/val.pkl
  Loading cached distance masks from ./data/Peptides-struct/dist_masks/test.pkl
[I 2026-05-13 01:05:57,701] A new study created in RDB with name: hop_masked_hparam_search
Subsampled train: 10873 → 5436 (50%)
Train batches: 170  Val batches: 73
Max epochs/trial: 20  Patience: 10
Optuna trials: 50  Pruning: True
========================================================================
Will run 50 new trials (target total: 50, existing: 0).
  0%|          | 0/50 [00:00<?, ?it/s]  [trial 0] epoch 00 43.5s (bs=32) | train MAE 0.4961 loss 0.4960 | val MAE 0.3526 | best 0.3526
  [trial 0] epoch 01 44.3s (bs=32) | train MAE 0.3685 loss 0.3684 | val MAE 0.3435 | best 0.3435
  [trial 0] epoch 02 43.8s (bs=32) | train MAE 0.3345 loss 0.3345 | val MAE 0.3172 | best 0.3172
  [trial 0] epoch 03 45.0s (bs=32) | train MAE 0.3271 loss 0.3272 | val MAE 0.3103 | best 0.3103
  [trial 0] epoch 04 44.7s (bs=32) | train MAE 0.3248 loss 0.3248 | val MAE 0.3133 | best 0.3103
  [trial 0] epoch 05 45.4s (bs=32) | train MAE 0.3186 loss 0.3186 | val MAE 0.3017 | best 0.3017
  [trial 0] epoch 06 45.3s (bs=32) | train MAE 0.3111 loss 0.3111 | val MAE 0.2980 | best 0.2980
  [trial 0] epoch 07 45.6s (bs=32) | train MAE 0.3105 loss 0.3105 | val MAE 0.2985 | best 0.2980
  [trial 0] epoch 08 45.2s (bs=32) | train MAE 0.3047 loss 0.3047 | val MAE 0.2983 | best 0.2980
  [trial 0] epoch 09 45.4s (bs=32) | train MAE 0.2994 loss 0.2994 | val MAE 0.2954 | best 0.2954
  [trial 0] epoch 10 45.4s (bs=32) | train MAE 0.3003 loss 0.3002 | val MAE 0.2991 | best 0.2954
  [trial 0] epoch 11 46.5s (bs=32) | train MAE 0.2962 loss 0.2961 | val MAE 0.2932 | best 0.2932
  [trial 0] epoch 12 45.6s (bs=32) | train MAE 0.2929 loss 0.2929 | val MAE 0.2915 | best 0.2915
  [trial 0] epoch 13 46.7s (bs=32) | train MAE 0.2894 loss 0.2893 | val MAE 0.2892 | best 0.2892
  [trial 0] epoch 14 46.6s (bs=32) | train MAE 0.2866 loss 0.2866 | val MAE 0.2879 | best 0.2879
  [trial 0] epoch 15 46.7s (bs=32) | train MAE 0.2841 loss 0.2840 | val MAE 0.2849 | best 0.2849
  [trial 0] epoch 16 46.0s (bs=32) | train MAE 0.2819 loss 0.2820 | val MAE 0.2845 | best 0.2845
  [trial 0] epoch 17 46.1s (bs=32) | train MAE 0.2795 loss 0.2795 | val MAE 0.2822 | best 0.2822
  [trial 0] epoch 18 47.3s (bs=32) | train MAE 0.2781 loss 0.2781 | val MAE 0.2828 | best 0.2822
  [trial 0] epoch 19 45.4s (bs=32) | train MAE 0.2776 loss 0.2776 | val MAE 0.2828 | best 0.2822
                                        0%|          | 0/50 [15:15<?, ?it/s]Best trial: 0. Best value: 0.282206:   0%|          | 0/50 [15:15<?, ?it/s]Best trial: 0. Best value: 0.282206:   2%|▏         | 1/50 [15:15<12:27:41, 915.55s/it][I 2026-05-13 01:21:13,251] Trial 0 finished with value: 0.28220569037605786 and parameters: {'hidden_dim': 256, 'num_heads': 16, 'ffn_ratio': 4, 'num_layers': 1, 'dropout': 0.05, 'hop_mode': 'window', 'hop_window': 4, 'num_global_heads': 4, 'graph_pool': 'sum', 'lr': 0.0008681616889493065, 'weight_decay': 0.0021957734465394567}. Best is trial 0 with value: 0.28220569037605786.
  [trial 1] epoch 00 50.3s (bs=32) | train MAE 0.4949 loss 0.4948 | val MAE 0.5557 | best 0.5557
  [trial 1] epoch 01 50.1s (bs=32) | train MAE 0.3692 loss 0.3692 | val MAE 0.4918 | best 0.4918
  [trial 1] epoch 02 49.9s (bs=32) | train MAE 0.3427 loss 0.3426 | val MAE 0.4295 | best 0.4295
  [trial 1] epoch 03 51.2s (bs=32) | train MAE 0.3370 loss 0.3370 | val MAE 0.6073 | best 0.4295
  [trial 1] epoch 04 49.7s (bs=32) | train MAE 0.3305 loss 0.3305 | val MAE 0.5100 | best 0.4295
  [trial 1] epoch 05 50.3s (bs=32) | train MAE 0.3235 loss 0.3235 | val MAE 0.4542 | best 0.4295
  [trial 1] epoch 06 50.9s (bs=32) | train MAE 0.3204 loss 0.3203 | val MAE 0.3748 | best 0.3748
  [trial 1] epoch 07 50.1s (bs=32) | train MAE 0.3153 loss 0.3153 | val MAE 0.4460 | best 0.3748
  [trial 1] epoch 08 50.1s (bs=32) | train MAE 0.3117 loss 0.3117 | val MAE 0.3932 | best 0.3748
  [trial 1] epoch 09 50.4s (bs=32) | train MAE 0.3085 loss 0.3085 | val MAE 0.4089 | best 0.3748
  [trial 1] epoch 10 49.7s (bs=32) | train MAE 0.3055 loss 0.3055 | val MAE 0.3547 | best 0.3547
  [trial 1] epoch 11 50.2s (bs=32) | train MAE 0.3035 loss 0.3035 | val MAE 0.4100 | best 0.3547
  [trial 1] epoch 12 51.0s (bs=32) | train MAE 0.3017 loss 0.3017 | val MAE 0.3710 | best 0.3547
  [trial 1] epoch 13 50.2s (bs=32) | train MAE 0.2991 loss 0.2991 | val MAE 0.3636 | best 0.3547
  [trial 1] epoch 14 50.8s (bs=32) | train MAE 0.2988 loss 0.2988 | val MAE 0.3643 | best 0.3547
  [trial 1] epoch 15 50.0s (bs=32) | train MAE 0.2952 loss 0.2952 | val MAE 0.3821 | best 0.3547
  [trial 1] epoch 16 49.6s (bs=32) | train MAE 0.2936 loss 0.2936 | val MAE 0.3560 | best 0.3547
  [trial 1] epoch 17 50.5s (bs=32) | train MAE 0.2906 loss 0.2908 | val MAE 0.3642 | best 0.3547
  [trial 1] epoch 18 50.7s (bs=32) | train MAE 0.2900 loss 0.2901 | val MAE 0.3506 | best 0.3506
  [trial 1] epoch 19 51.1s (bs=32) | train MAE 0.2898 loss 0.2898 | val MAE 0.3512 | best 0.3506
                                                                                       Best trial: 0. Best value: 0.282206:   2%|▏         | 1/50 [32:06<12:27:41, 915.55s/it]Best trial: 0. Best value: 0.282206:   2%|▏         | 1/50 [32:06<12:27:41, 915.55s/it]Best trial: 0. Best value: 0.282206:   4%|▍         | 2/50 [32:06<12:57:33, 971.95s/it][I 2026-05-13 01:38:04,693] Trial 1 finished with value: 0.350570672427913 and parameters: {'hidden_dim': 384, 'num_heads': 8, 'ffn_ratio': 4, 'num_layers': 6, 'dropout': 0.3, 'hop_mode': 'window', 'hop_window': 4, 'num_global_heads': 0, 'graph_pool': 'mean', 'lr': 0.00048697180377348874, 'weight_decay': 2.436570001464197e-05}. Best is trial 0 with value: 0.28220569037605786.
  [trial 2] epoch 00 53.4s (bs=32) | train MAE 0.4904 loss 0.4903 | val MAE 0.3706 | best 0.3706
  [trial 2] epoch 01 52.4s (bs=32) | train MAE 0.3931 loss 0.3930 | val MAE 0.3483 | best 0.3483
  [trial 2] epoch 02 52.2s (bs=32) | train MAE 0.3690 loss 0.3690 | val MAE 0.3350 | best 0.3350
  [trial 2] epoch 03 53.4s (bs=32) | train MAE 0.4074 loss 0.4076 | val MAE 0.4267 | best 0.3350
  [trial 2] epoch 04 54.2s (bs=32) | train MAE 0.4089 loss 0.4088 | val MAE 0.3490 | best 0.3350
  [trial 2] epoch 05 51.8s (bs=32) | train MAE 0.4106 loss 0.4106 | val MAE 0.4157 | best 0.3350
  [trial 2] epoch 06 52.1s (bs=32) | train MAE 0.3789 loss 0.3789 | val MAE 0.3665 | best 0.3350
  [trial 2] epoch 07 52.9s (bs=32) | train MAE 0.3632 loss 0.3633 | val MAE 0.3429 | best 0.3350
  [trial 2] epoch 08 53.0s (bs=32) | train MAE 0.3877 loss 0.3879 | val MAE 0.3604 | best 0.3350
  [trial 2] epoch 09 52.7s (bs=32) | train MAE 0.3628 loss 0.3629 | val MAE 0.3650 | best 0.3350
  [trial 2] epoch 10 53.0s (bs=32) | train MAE 0.3665 loss 0.3664 | val MAE 0.3668 | best 0.3350
  [trial 2] epoch 11 53.3s (bs=32) | train MAE 0.3571 loss 0.3570 | val MAE 0.3289 | best 0.3289
  [trial 2] epoch 12 53.0s (bs=32) | train MAE 0.3520 loss 0.3519 | val MAE 0.3315 | best 0.3289
  [trial 2] epoch 13 52.5s (bs=32) | train MAE 0.3449 loss 0.3450 | val MAE 0.3250 | best 0.3250
  [trial 2] epoch 14 53.3s (bs=32) | train MAE 0.3400 loss 0.3400 | val MAE 0.3203 | best 0.3203
  [trial 2] epoch 15 53.0s (bs=32) | train MAE 0.3363 loss 0.3362 | val MAE 0.3251 | best 0.3203
  [trial 2] epoch 16 52.4s (bs=32) | train MAE 0.3353 loss 0.3353 | val MAE 0.3242 | best 0.3203
  [trial 2] epoch 17 52.3s (bs=32) | train MAE 0.3347 loss 0.3346 | val MAE 0.3198 | best 0.3198
  [trial 2] epoch 18 51.7s (bs=32) | train MAE 0.3320 loss 0.3320 | val MAE 0.3180 | best 0.3180
  [trial 2] epoch 19 52.2s (bs=32) | train MAE 0.3320 loss 0.3319 | val MAE 0.3183 | best 0.3180
                                                                                       Best trial: 0. Best value: 0.282206:   4%|▍         | 2/50 [49:46<12:57:33, 971.95s/it]Best trial: 0. Best value: 0.282206:   4%|▍         | 2/50 [49:46<12:57:33, 971.95s/it]Best trial: 0. Best value: 0.282206:   6%|▌         | 3/50 [49:46<13:12:30, 1011.72s/it]                                                                                        Best trial: 0. Best value: 0.282206:   6%|▌         | 3/50 [49:47<13:12:30, 1011.72s/it]Best trial: 0. Best value: 0.282206:   6%|▌         | 3/50 [49:47<13:12:30, 1011.72s/it]Best trial: 0. Best value: 0.282206:   8%|▊         | 4/50 [49:47<7:49:50, 612.84s/it]  [I 2026-05-13 01:55:43,730] Trial 2 finished with value: 0.3180366084462162 and parameters: {'hidden_dim': 512, 'num_heads': 16, 'ffn_ratio': 2, 'num_layers': 4, 'dropout': 0.1, 'hop_mode': 'window', 'hop_window': 5, 'num_global_heads': 0, 'graph_pool': 'sum', 'lr': 0.002841716308815722, 'weight_decay': 0.00025465581928924377}. Best is trial 0 with value: 0.28220569037605786.
  [trial 3] Model build failed: hidden_dim=128 must be divisible by num_heads=40
  [trial 3] params: {'hidden_dim': 128, 'num_heads': 40, 'ffn_ratio': 2, 'num_layers': 4, 'dropout': 0.05, 'hop_mode': 'window', 'hop_window': 2, 'num_global_heads': 3, 'graph_pool': 'mean', 'lr': 0.0005841539903042611, 'weight_decay': 3.544655931853289e-05}
[I 2026-05-13 01:55:45,087] Trial 3 pruned. 
  [trial 4] epoch 00 46.1s (bs=32) | train MAE 0.4902 loss 0.4902 | val MAE 0.3684 | best 0.3684
  [trial 4] epoch 01 45.5s (bs=32) | train MAE 0.4160 loss 0.4160 | val MAE 0.3788 | best 0.3684
  [trial 4] epoch 02 43.8s (bs=32) | train MAE 0.4044 loss 0.4044 | val MAE 0.3549 | best 0.3549
  [trial 4] epoch 03 44.0s (bs=32) | train MAE 0.3812 loss 0.3811 | val MAE 0.4020 | best 0.3549
  [trial 4] epoch 04 44.8s (bs=32) | train MAE 0.3776 loss 0.3777 | val MAE 0.3755 | best 0.3549
  [trial 4] epoch 05 44.1s (bs=32) | train MAE 0.3819 loss 0.3819 | val MAE 0.3548 | best 0.3548
  [trial 4] epoch 06 44.8s (bs=32) | train MAE 0.3752 loss 0.3752 | val MAE 0.3962 | best 0.3548
  [trial 4] epoch 07 45.4s (bs=32) | train MAE 0.4574 loss 0.4573 | val MAE 0.7178 | best 0.3548
  [trial 4] epoch 08 45.8s (bs=32) | train MAE 0.3982 loss 0.3982 | val MAE 0.4886 | best 0.3548
  [trial 4] epoch 09 44.2s (bs=32) | train MAE 0.3857 loss 0.3856 | val MAE 0.5932 | best 0.3548
  [trial 4] epoch 10 43.2s (bs=32) | train MAE 0.3769 loss 0.3769 | val MAE 0.4519 | best 0.3548
  [trial 4] epoch 11 43.8s (bs=32) | train MAE 0.3725 loss 0.3725 | val MAE 0.4563 | best 0.3548
  [trial 4] epoch 12 45.4s (bs=32) | train MAE 0.3630 loss 0.3630 | val MAE 0.4035 | best 0.3548
  [trial 4] epoch 13 44.0s (bs=32) | train MAE 0.3589 loss 0.3588 | val MAE 0.4058 | best 0.3548
  [trial 4] epoch 14 47.9s (bs=32) | train MAE 0.3550 loss 0.3551 | val MAE 0.3867 | best 0.3548
  [trial 4] epoch 15 50.5s (bs=32) | train MAE 0.3512 loss 0.3512 | val MAE 0.3960 | best 0.3548
                                                                                      Best trial: 0. Best value: 0.282206:   8%|▊         | 4/50 [1:01:55<7:49:50, 612.84s/it]Best trial: 0. Best value: 0.282206:   8%|▊         | 4/50 [1:01:55<7:49:50, 612.84s/it]Best trial: 0. Best value: 0.282206:  10%|█         | 5/50 [1:01:55<8:10:46, 654.36s/it]  [trial 4] early stop at epoch 15
[I 2026-05-13 02:07:53,060] Trial 4 finished with value: 0.3547693387102822 and parameters: {'hidden_dim': 320, 'num_heads': 8, 'ffn_ratio': 4, 'num_layers': 3, 'dropout': 0.35000000000000003, 'hop_mode': 'contiguous', 'hop_window': 5, 'num_global_heads': 1, 'graph_pool': 'sum', 'lr': 0.002284844331681635, 'weight_decay': 0.001195624402212888}. Best is trial 0 with value: 0.28220569037605786.
  [trial 5] epoch 00 59.8s (bs=32) | train MAE 0.5073 loss 0.5072 | val MAE 0.4110 | best 0.4110
  [trial 5] epoch 01 58.5s (bs=32) | train MAE 0.3875 loss 0.3876 | val MAE 0.3406 | best 0.3406
  [trial 5] epoch 02 59.7s (bs=32) | train MAE 0.3572 loss 0.3572 | val MAE 0.4069 | best 0.3406
  [trial 5] epoch 03 59.3s (bs=32) | train MAE 0.3556 loss 0.3556 | val MAE 0.3281 | best 0.3281
  [trial 5] epoch 04 57.9s (bs=32) | train MAE 0.3423 loss 0.3422 | val MAE 0.3416 | best 0.3281
  [trial 5] epoch 05 57.1s (bs=32) | train MAE 0.3375 loss 0.3376 | val MAE 0.3443 | best 0.3281
  [trial 5] epoch 06 59.7s (bs=32) | train MAE 0.3301 loss 0.3302 | val MAE 0.3192 | best 0.3192
  [trial 5] epoch 07 57.3s (bs=32) | train MAE 0.3279 loss 0.3279 | val MAE 0.3750 | best 0.3192
  [trial 5] epoch 08 57.0s (bs=32) | train MAE 0.3259 loss 0.3259 | val MAE 0.3845 | best 0.3192
  [trial 5] epoch 09 57.8s (bs=32) | train MAE 0.3210 loss 0.3210 | val MAE 0.3886 | best 0.3192
  [trial 5] epoch 10 59.2s (bs=32) | train MAE 0.3175 loss 0.3174 | val MAE 0.3557 | best 0.3192
  [trial 5] epoch 11 58.7s (bs=32) | train MAE 0.3131 loss 0.3132 | val MAE 0.3818 | best 0.3192
  [trial 5] epoch 12 59.6s (bs=32) | train MAE 0.3106 loss 0.3106 | val MAE 0.3486 | best 0.3192
  [trial 5] epoch 13 58.5s (bs=32) | train MAE 0.3048 loss 0.3048 | val MAE 0.3758 | best 0.3192
  [trial 5] epoch 14 57.1s (bs=32) | train MAE 0.3030 loss 0.3030 | val MAE 0.3425 | best 0.3192
  [trial 5] epoch 15 57.6s (bs=32) | train MAE 0.2991 loss 0.2992 | val MAE 0.3635 | best 0.3192
  [trial 5] epoch 16 60.0s (bs=32) | train MAE 0.2956 loss 0.2957 | val MAE 0.3728 | best 0.3192
                                                                                        Best trial: 0. Best value: 0.282206:  10%|█         | 5/50 [1:18:34<8:10:46, 654.36s/it]Best trial: 0. Best value: 0.282206:  10%|█         | 5/50 [1:18:34<8:10:46, 654.36s/it]Best trial: 0. Best value: 0.282206:  12%|█▏        | 6/50 [1:18:34<9:25:44, 771.46s/it]  [trial 5] early stop at epoch 16
[I 2026-05-13 02:24:31,847] Trial 5 finished with value: 0.3192449427722721 and parameters: {'hidden_dim': 320, 'num_heads': 16, 'ffn_ratio': 4, 'num_layers': 4, 'dropout': 0.25, 'hop_mode': 'window', 'hop_window': 4, 'num_global_heads': 2, 'graph_pool': 'sum', 'lr': 0.0008184387435592441, 'weight_decay': 0.00473990966765613}. Best is trial 0 with value: 0.28220569037605786.
  [trial 6] epoch 00 51.8s (bs=32) | train MAE 0.4841 loss 0.4841 | val MAE 0.3994 | best 0.3994
  [trial 6] epoch 01 50.7s (bs=32) | train MAE 0.3772 loss 0.3772 | val MAE 0.3343 | best 0.3343
  [trial 6] epoch 02 49.1s (bs=32) | train MAE 0.3513 loss 0.3513 | val MAE 0.3377 | best 0.3343
  [trial 6] epoch 03 49.5s (bs=32) | train MAE 0.3429 loss 0.3429 | val MAE 0.3197 | best 0.3197
  [trial 6] epoch 04 49.3s (bs=32) | train MAE 0.3353 loss 0.3353 | val MAE 0.3325 | best 0.3197
  [trial 6] epoch 05 51.9s (bs=32) | train MAE 0.3303 loss 0.3303 | val MAE 0.3153 | best 0.3153
  [trial 6] epoch 06 49.8s (bs=32) | train MAE 0.3308 loss 0.3307 | val MAE 0.3359 | best 0.3153
  [trial 6] epoch 07 51.2s (bs=32) | train MAE 0.3237 loss 0.3237 | val MAE 0.3113 | best 0.3113
  [trial 6] epoch 08 51.5s (bs=32) | train MAE 0.3213 loss 0.3212 | val MAE 0.3080 | best 0.3080
  [trial 6] epoch 09 50.5s (bs=32) | train MAE 0.3114 loss 0.3114 | val MAE 0.3090 | best 0.3080
  [trial 6] epoch 10 54.3s (bs=32) | train MAE 0.3127 loss 0.3127 | val MAE 0.2925 | best 0.2925
  [trial 6] epoch 11 54.3s (bs=32) | train MAE 0.3057 loss 0.3057 | val MAE 0.2942 | best 0.2925
  [trial 6] epoch 12 51.2s (bs=32) | train MAE 0.3012 loss 0.3012 | val MAE 0.2970 | best 0.2925
  [trial 6] epoch 13 51.3s (bs=32) | train MAE 0.2976 loss 0.2977 | val MAE 0.2969 | best 0.2925
  [trial 6] epoch 14 52.5s (bs=32) | train MAE 0.2909 loss 0.2909 | val MAE 0.2888 | best 0.2888
  [trial 6] epoch 15 50.2s (bs=32) | train MAE 0.2889 loss 0.2889 | val MAE 0.2871 | best 0.2871
  [trial 6] epoch 16 50.1s (bs=32) | train MAE 0.2851 loss 0.2851 | val MAE 0.2846 | best 0.2846
  [trial 6] epoch 17 49.1s (bs=32) | train MAE 0.2823 loss 0.2823 | val MAE 0.2845 | best 0.2845
  [trial 6] epoch 18 49.2s (bs=32) | train MAE 0.2812 loss 0.2812 | val MAE 0.2846 | best 0.2845
  [trial 6] epoch 19 49.7s (bs=32) | train MAE 0.2793 loss 0.2793 | val MAE 0.2840 | best 0.2840
                                                                                        Best trial: 0. Best value: 0.282206:  12%|█▏        | 6/50 [1:35:35<9:25:44, 771.46s/it]Best trial: 0. Best value: 0.282206:  12%|█▏        | 6/50 [1:35:35<9:25:44, 771.46s/it]Best trial: 0. Best value: 0.282206:  14%|█▍        | 7/50 [1:35:35<10:11:23, 853.11s/it]                                                                                         Best trial: 0. Best value: 0.282206:  14%|█▍        | 7/50 [1:35:36<10:11:23, 853.11s/it]Best trial: 0. Best value: 0.282206:  14%|█▍        | 7/50 [1:35:36<10:11:23, 853.11s/it]Best trial: 0. Best value: 0.282206:  16%|█▌        | 8/50 [1:35:36<6:47:22, 581.96s/it]                                                                                         Best trial: 0. Best value: 0.282206:  16%|█▌        | 8/50 [1:35:38<6:47:22, 581.96s/it]Best trial: 0. Best value: 0.282206:  16%|█▌        | 8/50 [1:35:38<6:47:22, 581.96s/it]Best trial: 0. Best value: 0.282206:  18%|█▊        | 9/50 [1:35:38<4:33:38, 400.44s/it][I 2026-05-13 02:41:33,051] Trial 6 finished with value: 0.28397505745253465 and parameters: {'hidden_dim': 640, 'num_heads': 8, 'ffn_ratio': 2, 'num_layers': 3, 'dropout': 0.05, 'hop_mode': 'contiguous', 'hop_window': 4, 'num_global_heads': 4, 'graph_pool': 'sum', 'lr': 0.00030820191928839066, 'weight_decay': 0.00012020822750412476}. Best is trial 0 with value: 0.28220569037605786.
  [trial 7] Model build failed: hidden_dim=128 must be divisible by num_heads=20
  [trial 7] params: {'hidden_dim': 128, 'num_heads': 20, 'ffn_ratio': 4, 'num_layers': 4, 'dropout': 0.1, 'hop_mode': 'contiguous', 'hop_window': 3, 'num_global_heads': 2, 'graph_pool': 'sum', 'lr': 0.0007504855193605641, 'weight_decay': 4.2611934121447093e-05}
[I 2026-05-13 02:41:34,438] Trial 7 pruned. 
  [trial 8] Model build failed: hidden_dim=256 must be divisible by num_heads=20
  [trial 8] params: {'hidden_dim': 256, 'num_heads': 20, 'ffn_ratio': 4, 'num_layers': 5, 'dropout': 0.2, 'hop_mode': 'window', 'hop_window': 5, 'num_global_heads': 1, 'graph_pool': 'sum', 'lr': 0.0003146098054663126, 'weight_decay': 0.0018842388825327857}
[I 2026-05-13 02:41:35,740] Trial 8 pruned. 
  [trial 9] epoch 00 53.3s (bs=32) | train MAE 0.4740 loss 0.4740 | val MAE 0.3690 | best 0.3690
  [trial 9] epoch 01 52.6s (bs=32) | train MAE 0.3703 loss 0.3703 | val MAE 0.3294 | best 0.3294
  [trial 9] epoch 02 53.8s (bs=32) | train MAE 0.3343 loss 0.3343 | val MAE 0.3215 | best 0.3215
  [trial 9] epoch 03 52.4s (bs=32) | train MAE 0.3347 loss 0.3347 | val MAE 0.3320 | best 0.3215
  [trial 9] epoch 04 52.3s (bs=32) | train MAE 0.3277 loss 0.3276 | val MAE 0.3108 | best 0.3108
  [trial 9] epoch 05 53.8s (bs=32) | train MAE 0.3243 loss 0.3242 | val MAE 0.3106 | best 0.3106
  [trial 9] epoch 06 53.9s (bs=32) | train MAE 0.3157 loss 0.3156 | val MAE 0.3063 | best 0.3063
  [trial 9] epoch 07 54.0s (bs=32) | train MAE 0.3096 loss 0.3096 | val MAE 0.2854 | best 0.2854
  [trial 9] epoch 08 54.6s (bs=32) | train MAE 0.3058 loss 0.3058 | val MAE 0.2996 | best 0.2854
  [trial 9] epoch 09 52.7s (bs=32) | train MAE 0.3019 loss 0.3019 | val MAE 0.3066 | best 0.2854
  [trial 9] epoch 10 53.3s (bs=32) | train MAE 0.3076 loss 0.3076 | val MAE 0.3039 | best 0.2854
  [trial 9] epoch 11 54.4s (bs=32) | train MAE 0.2980 loss 0.2983 | val MAE 0.2812 | best 0.2812
  [trial 9] epoch 12 53.3s (bs=32) | train MAE 0.2932 loss 0.2932 | val MAE 0.2866 | best 0.2812
  [trial 9] epoch 13 53.6s (bs=32) | train MAE 0.2856 loss 0.2855 | val MAE 0.2800 | best 0.2800
  [trial 9] epoch 14 53.5s (bs=32) | train MAE 0.2822 loss 0.2822 | val MAE 0.2731 | best 0.2731
  [trial 9] epoch 15 57.5s (bs=32) | train MAE 0.2778 loss 0.2777 | val MAE 0.2769 | best 0.2731
  [trial 9] epoch 16 55.7s (bs=32) | train MAE 0.2737 loss 0.2737 | val MAE 0.2689 | best 0.2689
  [trial 9] epoch 17 53.9s (bs=32) | train MAE 0.2732 loss 0.2732 | val MAE 0.2710 | best 0.2689
  [trial 9] epoch 18 54.5s (bs=32) | train MAE 0.2705 loss 0.2705 | val MAE 0.2701 | best 0.2689
  [trial 9] epoch 19 54.7s (bs=32) | train MAE 0.2693 loss 0.2693 | val MAE 0.2695 | best 0.2689
