[I 2026-05-12 21:04:39,751] Trial 19 pruned. 
  [trial 20] epoch 00 139.6s (bs=32) | train AP 0.2021 loss 0.3880 | val AP 0.2706 | best 0.2706
  [trial 20] epoch 01 139.5s (bs=32) | train AP 0.2272 loss 0.3420 | val AP 0.2796 | best 0.2796
  [trial 20] epoch 02 140.6s (bs=32) | train AP 0.2573 loss 0.3304 | val AP 0.2799 | best 0.2799
  [trial 20] epoch 03 140.0s (bs=32) | train AP 0.2575 loss 0.3286 | val AP 0.2873 | best 0.2873
  [trial 20] epoch 04 140.3s (bs=32) | train AP 0.2624 loss 0.3266 | val AP 0.2839 | best 0.2873
  [trial 20] epoch 05 139.4s (bs=32) | train AP 0.2632 loss 0.3257 | val AP 0.2871 | best 0.2873
  [trial 20] PRUNED at epoch 5
[I 2026-05-12 21:18:41,497] Trial 20 pruned. 
  [trial 21] epoch 00 97.6s (bs=32) | train AP 0.2206 loss 0.3588 | val AP 0.2723 | best 0.2723
  [trial 21] epoch 01 93.8s (bs=32) | train AP 0.2542 loss 0.3331 | val AP 0.2702 | best 0.2723
  [trial 21] epoch 02 92.9s (bs=32) | train AP 0.2554 loss 0.3312 | val AP 0.2718 | best 0.2723
  [trial 21] epoch 03 94.0s (bs=32) | train AP 0.2538 loss 0.3295 | val AP 0.2773 | best 0.2773
  [trial 21] epoch 04 93.4s (bs=32) | train AP 0.2650 loss 0.3270 | val AP 0.2804 | best 0.2804
  [trial 21] epoch 05 94.9s (bs=32) | train AP 0.2665 loss 0.3250 | val AP 0.2819 | best 0.2819
  [trial 21] PRUNED at epoch 5
[I 2026-05-12 21:28:10,677] Trial 21 pruned. 
  [trial 22] epoch 00 84.3s (bs=32) | train AP 0.2171 loss 0.3680 | val AP 0.2902 | best 0.2902
  [trial 22] epoch 01 79.2s (bs=32) | train AP 0.2619 loss 0.3287 | val AP 0.2877 | best 0.2902
  [trial 22] epoch 02 79.2s (bs=32) | train AP 0.2631 loss 0.3282 | val AP 0.2927 | best 0.2927
  [trial 22] epoch 03 79.7s (bs=32) | train AP 0.2675 loss 0.3250 | val AP 0.2980 | best 0.2980
  [trial 22] epoch 04 79.2s (bs=32) | train AP 0.2713 loss 0.3241 | val AP 0.2937 | best 0.2980
  [trial 22] epoch 05 80.6s (bs=32) | train AP 0.2753 loss 0.3216 | val AP 0.2880 | best 0.2980
  [trial 22] epoch 06 79.8s (bs=32) | train AP 0.2734 loss 0.3214 | val AP 0.2965 | best 0.2980
  [trial 22] PRUNED at epoch 6
[I 2026-05-12 21:37:36,473] Trial 22 pruned. 
  [trial 23] epoch 00 80.3s (bs=32) | train AP 0.2253 loss 0.3636 | val AP 0.2781 | best 0.2781
  [trial 23] epoch 01 79.3s (bs=32) | train AP 0.2595 loss 0.3278 | val AP 0.2874 | best 0.2874
  [trial 23] epoch 02 79.9s (bs=32) | train AP 0.2651 loss 0.3259 | val AP 0.2865 | best 0.2874
  [trial 23] epoch 03 79.7s (bs=32) | train AP 0.2729 loss 0.3233 | val AP 0.2927 | best 0.2927
  [trial 23] epoch 04 80.7s (bs=32) | train AP 0.2763 loss 0.3215 | val AP 0.3058 | best 0.3058
  [trial 23] epoch 05 80.5s (bs=32) | train AP 0.2888 loss 0.3159 | val AP 0.3137 | best 0.3137
  [trial 23] epoch 06 80.1s (bs=32) | train AP 0.3013 loss 0.3108 | val AP 0.3215 | best 0.3215
  [trial 23] epoch 07 80.9s (bs=32) | train AP 0.3155 loss 0.3059 | val AP 0.3198 | best 0.3215
  [trial 23] epoch 08 80.9s (bs=32) | train AP 0.3249 loss 0.3020 | val AP 0.3237 | best 0.3237
  [trial 23] epoch 09 82.5s (bs=32) | train AP 0.3307 loss 0.2999 | val AP 0.3247 | best 0.3247
[I 2026-05-12 21:51:04,045] Trial 23 finished with value: 0.3246716383629743 and parameters: {'hidden_dim': 192, 'num_layers': 2, 'num_heads': 4, 'num_cross_layers': 3, 'generator': 'score_based', 'num_proxies': 64, 'score_layers': 2, 'score_heads': 8, 'gnn_layers': 12, 'decode_hidden': 128, 'decode_layers': 2, 'coarsen_reg_weight': 0.35000000000000003, 'hop_dim': 16, 'fuse_mode': 'concat_proj', 'khop_per_block': False, 'khop_num_heads': 2, 'share_blocks': False, 'use_proxy_self_attn': True, 'final_sa_layers': 1, 'dropout': 0.1, 'aux_loss_weight': 0.5, 'lr': 0.0004537821514918095, 'weight_decay': 0.00023552387308541905}. Best is trial 15 with value: 0.36207288276635347.
  [trial 24] epoch 00 229.3s (bs=32) | train AP 0.2214 loss 0.3755 | val AP 0.2829 | best 0.2829
  [trial 24] epoch 01 228.4s (bs=32) | train AP 0.2572 loss 0.3313 | val AP 0.2852 | best 0.2852
  [trial 24] epoch 02 235.2s (bs=32) | train AP 0.2667 loss 0.3264 | val AP 0.2876 | best 0.2876
  [trial 24] epoch 03 230.9s (bs=32) | train AP 0.2711 loss 0.3254 | val AP 0.2905 | best 0.2905
  [trial 24] epoch 04 228.8s (bs=32) | train AP 0.2725 loss 0.3243 | val AP 0.2868 | best 0.2905
  [trial 24] epoch 05 233.9s (bs=32) | train AP 0.2745 loss 0.3226 | val AP 0.2977 | best 0.2977
  [trial 24] PRUNED at epoch 5
[I 2026-05-12 22:14:13,224] Trial 24 pruned. 
  [trial 25] epoch 00 105.3s (bs=32) | train AP 0.2315 loss 0.3605 | val AP 0.2891 | best 0.2891
  [trial 25] epoch 01 98.8s (bs=32) | train AP 0.2616 loss 0.3291 | val AP 0.2934 | best 0.2934
  [trial 25] epoch 02 98.0s (bs=32) | train AP 0.2664 loss 0.3274 | val AP 0.2859 | best 0.2934
  [trial 25] epoch 03 98.4s (bs=32) | train AP 0.2698 loss 0.3245 | val AP 0.2912 | best 0.2934
  [trial 25] epoch 04 97.3s (bs=32) | train AP 0.2745 loss 0.3225 | val AP 0.2984 | best 0.2984
  [trial 25] epoch 05 96.4s (bs=32) | train AP 0.2822 loss 0.3191 | val AP 0.3063 | best 0.3063
  [trial 25] epoch 06 97.0s (bs=32) | train AP 0.3037 loss 0.3109 | val AP 0.3172 | best 0.3172
  [trial 25] epoch 07 96.2s (bs=32) | train AP 0.3108 loss 0.3079 | val AP 0.3242 | best 0.3242
  [trial 25] epoch 08 98.3s (bs=32) | train AP 0.3177 loss 0.3046 | val AP 0.3341 | best 0.3341
  [trial 25] epoch 09 95.9s (bs=32) | train AP 0.3240 loss 0.3034 | val AP 0.3319 | best 0.3341
[I 2026-05-12 22:30:38,375] Trial 25 finished with value: 0.3340504590615706 and parameters: {'hidden_dim': 192, 'num_layers': 1, 'num_heads': 4, 'num_cross_layers': 3, 'generator': 'graph_coarsening', 'num_proxies': 256, 'score_layers': 2, 'score_heads': 8, 'gnn_layers': 12, 'decode_hidden': 64, 'decode_layers': 1, 'coarsen_reg_weight': 0.35000000000000003, 'hop_dim': 16, 'fuse_mode': 'concat_proj', 'khop_per_block': False, 'khop_num_heads': 4, 'share_blocks': False, 'use_proxy_self_attn': False, 'final_sa_layers': 1, 'dropout': 0.2, 'aux_loss_weight': 0.25, 'lr': 0.0006843130741777493, 'weight_decay': 0.00047506611329729186}. Best is trial 15 with value: 0.36207288276635347.
  [trial 26] epoch 00 96.4s (bs=32) | train AP 0.2309 loss 0.3551 | val AP 0.2734 | best 0.2734
  [trial 26] epoch 01 95.6s (bs=32) | train AP 0.2633 loss 0.3296 | val AP 0.2921 | best 0.2921
  [trial 26] epoch 02 97.5s (bs=32) | train AP 0.2671 loss 0.3260 | val AP 0.2880 | best 0.2921
  [trial 26] epoch 03 97.1s (bs=32) | train AP 0.2650 loss 0.3254 | val AP 0.2939 | best 0.2939
  [trial 26] epoch 04 95.9s (bs=32) | train AP 0.2735 loss 0.3230 | val AP 0.3019 | best 0.3019
  [trial 26] epoch 05 96.3s (bs=32) | train AP 0.2715 loss 0.3233 | val AP 0.2976 | best 0.3019
  [trial 26] epoch 06 96.4s (bs=32) | train AP 0.2809 loss 0.3194 | val AP 0.3072 | best 0.3072
  [trial 26] epoch 07 97.3s (bs=32) | train AP 0.2941 loss 0.3151 | val AP 0.3085 | best 0.3085
  [trial 26] PRUNED at epoch 7
[I 2026-05-12 22:43:32,920] Trial 26 pruned. 
  [trial 27] epoch 00 97.0s (bs=32) | train AP 0.2209 loss 0.3774 | val AP 0.2753 | best 0.2753
  [trial 27] epoch 01 97.7s (bs=32) | train AP 0.2593 loss 0.3293 | val AP 0.2890 | best 0.2890
  [trial 27] epoch 02 98.3s (bs=32) | train AP 0.2634 loss 0.3267 | val AP 0.2937 | best 0.2937
  [trial 27] epoch 03 98.6s (bs=32) | train AP 0.2673 loss 0.3240 | val AP 0.2859 | best 0.2937
  [trial 27] epoch 04 97.8s (bs=32) | train AP 0.2755 loss 0.3220 | val AP 0.2878 | best 0.2937
  [trial 27] epoch 05 97.7s (bs=32) | train AP 0.2784 loss 0.3201 | val AP 0.3140 | best 0.3140
  [trial 27] epoch 06 97.4s (bs=32) | train AP 0.3046 loss 0.3109 | val AP 0.3331 | best 0.3331
  [trial 27] epoch 07 98.0s (bs=32) | train AP 0.3211 loss 0.3031 | val AP 0.3392 | best 0.3392
  [trial 27] epoch 08 95.9s (bs=32) | train AP 0.3351 loss 0.2967 | val AP 0.3467 | best 0.3467
  [trial 27] epoch 09 97.0s (bs=32) | train AP 0.3442 loss 0.2931 | val AP 0.3489 | best 0.3489
[I 2026-05-12 22:59:51,181] Trial 27 finished with value: 0.3489113055364609 and parameters: {'hidden_dim': 96, 'num_layers': 1, 'num_heads': 8, 'num_cross_layers': 2, 'generator': 'graph_coarsening', 'num_proxies': 256, 'score_layers': 3, 'score_heads': 8, 'gnn_layers': 12, 'decode_hidden': 64, 'decode_layers': 3, 'coarsen_reg_weight': 0.35000000000000003, 'hop_dim': 16, 'fuse_mode': 'concat_proj', 'khop_per_block': False, 'khop_num_heads': 4, 'share_blocks': True, 'use_proxy_self_attn': False, 'final_sa_layers': 2, 'dropout': 0.15000000000000002, 'aux_loss_weight': 1.5, 'lr': 0.0010529622967746012, 'weight_decay': 6.386108838783999e-05}. Best is trial 15 with value: 0.36207288276635347.
  [trial 28] epoch 00 95.2s (bs=32) | train AP 0.2113 loss 0.4143 | val AP 0.2876 | best 0.2876
  [trial 28] epoch 01 95.1s (bs=32) | train AP 0.2577 loss 0.3299 | val AP 0.2960 | best 0.2960
  [trial 28] epoch 02 95.9s (bs=32) | train AP 0.2633 loss 0.3262 | val AP 0.2972 | best 0.2972
  [trial 28] epoch 03 95.5s (bs=32) | train AP 0.2759 loss 0.3226 | val AP 0.3041 | best 0.3041
  [trial 28] epoch 04 95.6s (bs=32) | train AP 0.2865 loss 0.3170 | val AP 0.3177 | best 0.3177
  [trial 28] epoch 05 93.9s (bs=32) | train AP 0.3103 loss 0.3090 | val AP 0.3355 | best 0.3355
  [trial 28] epoch 06 95.7s (bs=32) | train AP 0.3276 loss 0.3012 | val AP 0.3584 | best 0.3584
  [trial 28] epoch 07 95.0s (bs=32) | train AP 0.3641 loss 0.2899 | val AP 0.3796 | best 0.3796
  [trial 28] epoch 08 94.9s (bs=32) | train AP 0.3753 loss 0.2836 | val AP 0.3897 | best 0.3897
  [trial 28] epoch 09 95.2s (bs=32) | train AP 0.3826 loss 0.2808 | val AP 0.3926 | best 0.3926
[I 2026-05-12 23:15:46,315] Trial 28 finished with value: 0.3926341547056777 and parameters: {'hidden_dim': 96, 'num_layers': 1, 'num_heads': 4, 'num_cross_layers': 2, 'generator': 'graph_coarsening', 'num_proxies': 256, 'score_layers': 3, 'score_heads': 8, 'gnn_layers': 12, 'decode_hidden': 64, 'decode_layers': 3, 'coarsen_reg_weight': 0.35000000000000003, 'hop_dim': 16, 'fuse_mode': 'concat_proj', 'khop_per_block': False, 'khop_num_heads': 4, 'share_blocks': True, 'use_proxy_self_attn': False, 'final_sa_layers': 1, 'dropout': 0.1, 'aux_loss_weight': 1.0, 'lr': 0.0003000726460231544, 'weight_decay': 6.0617153069397285e-05}. Best is trial 28 with value: 0.3926341547056777.
  [trial 29] epoch 00 94.2s (bs=32) | train AP 0.1967 loss 0.4374 | val AP 0.2752 | best 0.2752
  [trial 29] epoch 01 96.5s (bs=32) | train AP 0.2548 loss 0.3290 | val AP 0.2886 | best 0.2886
  [trial 29] epoch 02 96.1s (bs=32) | train AP 0.2644 loss 0.3252 | val AP 0.3041 | best 0.3041
  [trial 29] epoch 03 96.5s (bs=32) | train AP 0.2874 loss 0.3181 | val AP 0.3116 | best 0.3116
  [trial 29] epoch 04 97.0s (bs=32) | train AP 0.3017 loss 0.3136 | val AP 0.3273 | best 0.3273
  [trial 29] epoch 05 97.0s (bs=32) | train AP 0.3121 loss 0.3099 | val AP 0.3337 | best 0.3337
  [trial 29] epoch 06 97.6s (bs=32) | train AP 0.3247 loss 0.3050 | val AP 0.3476 | best 0.3476
  [trial 29] epoch 07 98.6s (bs=32) | train AP 0.3392 loss 0.3001 | val AP 0.3588 | best 0.3588
  [trial 29] epoch 08 98.4s (bs=32) | train AP 0.3521 loss 0.2964 | val AP 0.3612 | best 0.3612
  [trial 29] epoch 09 100.1s (bs=32) | train AP 0.3574 loss 0.2945 | val AP 0.3643 | best 0.3643
[I 2026-05-12 23:32:01,465] Trial 29 finished with value: 0.36425773836059355 and parameters: {'hidden_dim': 96, 'num_layers': 1, 'num_heads': 8, 'num_cross_layers': 2, 'generator': 'graph_coarsening', 'num_proxies': 256, 'score_layers': 3, 'score_heads': 8, 'gnn_layers': 9, 'decode_hidden': 64, 'decode_layers': 3, 'coarsen_reg_weight': 0.25, 'hop_dim': 8, 'fuse_mode': 'sum_proj', 'khop_per_block': False, 'khop_num_heads': 4, 'share_blocks': True, 'use_proxy_self_attn': False, 'final_sa_layers': 2, 'dropout': 0.05, 'aux_loss_weight': 1.0, 'lr': 0.00036195539532591216, 'weight_decay': 4.523972469693041e-05}. Best is trial 28 with value: 0.3926341547056777.
  [trial 30] epoch 00 129.6s (bs=32) | train AP 0.1824 loss 0.4342 | val AP 0.2808 | best 0.2808
  [trial 30] epoch 01 121.5s (bs=32) | train AP 0.2562 loss 0.3299 | val AP 0.2943 | best 0.2943
  [trial 30] epoch 02 122.2s (bs=32) | train AP 0.2680 loss 0.3255 | val AP 0.3066 | best 0.3066
  [trial 30] epoch 03 127.9s (bs=32) | train AP 0.2742 loss 0.3229 | val AP 0.3077 | best 0.3077
  [trial 30] epoch 04 130.5s (bs=32) | train AP 0.3018 loss 0.3143 | val AP 0.3221 | best 0.3221
  [trial 30] epoch 05 128.3s (bs=32) | train AP 0.3142 loss 0.3099 | val AP 0.3309 | best 0.3309
  [trial 30] epoch 06 127.0s (bs=32) | train AP 0.3208 loss 0.3077 | val AP 0.3339 | best 0.3339
  [trial 30] epoch 07 129.5s (bs=32) | train AP 0.3256 loss 0.3055 | val AP 0.3339 | best 0.3339
  [trial 30] epoch 08 128.3s (bs=32) | train AP 0.3281 loss 0.3043 | val AP 0.3337 | best 0.3339
  [trial 30] epoch 09 127.6s (bs=32) | train AP 0.3292 loss 0.3034 | val AP 0.3363 | best 0.3363
[I 2026-05-12 23:53:16,854] Trial 30 finished with value: 0.33632702686191546 and parameters: {'hidden_dim': 96, 'num_layers': 1, 'num_heads': 8, 'num_cross_layers': 2, 'generator': 'graph_coarsening', 'num_proxies': 256, 'score_layers': 3, 'score_heads': 8, 'gnn_layers': 6, 'decode_hidden': 64, 'decode_layers': 3, 'coarsen_reg_weight': 0.2, 'hop_dim': 8, 'fuse_mode': 'sum_proj', 'khop_per_block': True, 'khop_num_heads': 8, 'share_blocks': True, 'use_proxy_self_attn': False, 'final_sa_layers': 1, 'dropout': 0.05, 'aux_loss_weight': 1.0, 'lr': 0.00030426484955622317, 'weight_decay': 2.25032510510805e-05}. Best is trial 28 with value: 0.3926341547056777.
  [trial 31] epoch 00 111.9s (bs=32) | train AP 0.2003 loss 0.4082 | val AP 0.2656 | best 0.2656
  [trial 31] epoch 01 110.5s (bs=32) | train AP 0.2548 loss 0.3305 | val AP 0.2944 | best 0.2944
  [trial 31] epoch 02 110.9s (bs=32) | train AP 0.2683 loss 0.3258 | val AP 0.2982 | best 0.2982
  [trial 31] epoch 03 110.7s (bs=32) | train AP 0.2773 loss 0.3223 | val AP 0.3032 | best 0.3032
  [trial 31] epoch 04 110.0s (bs=32) | train AP 0.2979 loss 0.3155 | val AP 0.3267 | best 0.3267
  [trial 31] epoch 05 110.5s (bs=32) | train AP 0.3084 loss 0.3119 | val AP 0.3349 | best 0.3349
  [trial 31] epoch 06 111.4s (bs=32) | train AP 0.3161 loss 0.3092 | val AP 0.3389 | best 0.3389
  [trial 31] epoch 07 111.2s (bs=32) | train AP 0.3209 loss 0.3068 | val AP 0.3414 | best 0.3414
  [trial 31] epoch 08 111.5s (bs=32) | train AP 0.3284 loss 0.3042 | val AP 0.3439 | best 0.3439
  [trial 31] epoch 09 110.7s (bs=32) | train AP 0.3327 loss 0.3031 | val AP 0.3445 | best 0.3445
[I 2026-05-13 00:11:49,030] Trial 31 finished with value: 0.34446577647959453 and parameters: {'hidden_dim': 96, 'num_layers': 2, 'num_heads': 4, 'num_cross_layers': 2, 'generator': 'graph_coarsening', 'num_proxies': 32, 'score_layers': 3, 'score_heads': 8, 'gnn_layers': 9, 'decode_hidden': 64, 'decode_layers': 3, 'coarsen_reg_weight': 0.25, 'hop_dim': 8, 'fuse_mode': 'sum_proj', 'khop_per_block': False, 'khop_num_heads': 4, 'share_blocks': True, 'use_proxy_self_attn': False, 'final_sa_layers': 2, 'dropout': 0.1, 'aux_loss_weight': 0.75, 'lr': 0.00036978882374238704, 'weight_decay': 7.079792483976256e-05}. Best is trial 28 with value: 0.3926341547056777.
  [trial 32] epoch 00 107.8s (bs=32) | train AP 0.2058 loss 0.4217 | val AP 0.2750 | best 0.2750
  [trial 32] epoch 01 104.6s (bs=32) | train AP 0.2618 loss 0.3279 | val AP 0.2916 | best 0.2916
  [trial 32] epoch 02 107.3s (bs=32) | train AP 0.2663 loss 0.3251 | val AP 0.2976 | best 0.2976
  [trial 32] epoch 03 107.8s (bs=32) | train AP 0.2695 loss 0.3235 | val AP 0.3025 | best 0.3025
  [trial 32] epoch 04 107.6s (bs=32) | train AP 0.2761 loss 0.3215 | val AP 0.3031 | best 0.3031
  [trial 32] epoch 05 106.6s (bs=32) | train AP 0.2868 loss 0.3191 | val AP 0.3202 | best 0.3202
  [trial 32] epoch 06 107.8s (bs=32) | train AP 0.3052 loss 0.3121 | val AP 0.3295 | best 0.3295
  [trial 32] epoch 07 105.7s (bs=32) | train AP 0.3169 loss 0.3070 | val AP 0.3403 | best 0.3403
  [trial 32] epoch 08 105.9s (bs=32) | train AP 0.3285 loss 0.3025 | val AP 0.3469 | best 0.3469
  [trial 32] epoch 09 104.8s (bs=32) | train AP 0.3332 loss 0.3008 | val AP 0.3481 | best 0.3481
[I 2026-05-13 00:29:38,085] Trial 32 finished with value: 0.34806028914821335 and parameters: {'hidden_dim': 96, 'num_layers': 1, 'num_heads': 8, 'num_cross_layers': 2, 'generator': 'graph_coarsening', 'num_proxies': 256, 'score_layers': 3, 'score_heads': 8, 'gnn_layers': 9, 'decode_hidden': 64, 'decode_layers': 3, 'coarsen_reg_weight': 0.30000000000000004, 'hop_dim': 8, 'fuse_mode': 'sum_proj', 'khop_per_block': False, 'khop_num_heads': 4, 'share_blocks': True, 'use_proxy_self_attn': False, 'final_sa_layers': 2, 'dropout': 0.05, 'aux_loss_weight': 1.0, 'lr': 0.000379354114238942, 'weight_decay': 5.012047010290528e-05}. Best is trial 28 with value: 0.3926341547056777.
  [trial 33] epoch 00 116.0s (bs=32) | train AP 0.2029 loss 0.4091 | val AP 0.2683 | best 0.2683
  [trial 33] epoch 01 107.3s (bs=32) | train AP 0.2600 loss 0.3289 | val AP 0.2935 | best 0.2935
  [trial 33] epoch 02 106.4s (bs=32) | train AP 0.2691 loss 0.3255 | val AP 0.3041 | best 0.3041
  [trial 33] epoch 03 107.2s (bs=32) | train AP 0.2775 loss 0.3231 | val AP 0.3109 | best 0.3109
  [trial 33] epoch 04 106.4s (bs=32) | train AP 0.2935 loss 0.3168 | val AP 0.3234 | best 0.3234
  [trial 33] epoch 05 106.9s (bs=32) | train AP 0.3105 loss 0.3121 | val AP 0.3280 | best 0.3280
  [trial 33] epoch 06 102.7s (bs=32) | train AP 0.3183 loss 0.3082 | val AP 0.3406 | best 0.3406
  [trial 33] epoch 07 103.2s (bs=32) | train AP 0.3267 loss 0.3052 | val AP 0.3391 | best 0.3406
  [trial 33] epoch 08 101.8s (bs=32) | train AP 0.3303 loss 0.3034 | val AP 0.3425 | best 0.3425
  [trial 33] epoch 09 102.5s (bs=32) | train AP 0.3348 loss 0.3023 | val AP 0.3435 | best 0.3435
[I 2026-05-13 00:47:21,628] Trial 33 finished with value: 0.34350078306199006 and parameters: {'hidden_dim': 96, 'num_layers': 1, 'num_heads': 8, 'num_cross_layers': 2, 'generator': 'graph_coarsening', 'num_proxies': 256, 'score_layers': 3, 'score_heads': 8, 'gnn_layers': 12, 'decode_hidden': 64, 'decode_layers': 3, 'coarsen_reg_weight': 0.35000000000000003, 'hop_dim': 8, 'fuse_mode': 'sum_proj', 'khop_per_block': False, 'khop_num_heads': 4, 'share_blocks': True, 'use_proxy_self_attn': False, 'final_sa_layers': 2, 'dropout': 0.1, 'aux_loss_weight': 1.5, 'lr': 0.00046089157508434197, 'weight_decay': 0.00014578844665860517}. Best is trial 28 with value: 0.3926341547056777.
  [trial 34] epoch 00 103.0s (bs=32) | train AP 0.2058 loss 0.4193 | val AP 0.2780 | best 0.2780
  [trial 34] epoch 01 101.7s (bs=32) | train AP 0.2561 loss 0.3311 | val AP 0.2866 | best 0.2866
  [trial 34] epoch 02 102.1s (bs=32) | train AP 0.2624 loss 0.3285 | val AP 0.3004 | best 0.3004
  [trial 34] epoch 03 104.8s (bs=32) | train AP 0.2743 loss 0.3239 | val AP 0.3103 | best 0.3103
  [trial 34] epoch 04 105.2s (bs=32) | train AP 0.2877 loss 0.3196 | val AP 0.3191 | best 0.3191
  [trial 34] epoch 05 105.0s (bs=32) | train AP 0.3049 loss 0.3137 | val AP 0.3275 | best 0.3275
  [trial 34] epoch 06 104.6s (bs=32) | train AP 0.3131 loss 0.3092 | val AP 0.3419 | best 0.3419
  [trial 34] epoch 07 105.8s (bs=32) | train AP 0.3203 loss 0.3070 | val AP 0.3401 | best 0.3419
  [trial 34] epoch 08 105.7s (bs=32) | train AP 0.3272 loss 0.3049 | val AP 0.3446 | best 0.3446
  [trial 34] epoch 09 105.8s (bs=32) | train AP 0.3303 loss 0.3037 | val AP 0.3450 | best 0.3450
[I 2026-05-13 01:04:48,597] Trial 34 finished with value: 0.345005367081259 and parameters: {'hidden_dim': 96, 'num_layers': 1, 'num_heads': 8, 'num_cross_layers': 2, 'generator': 'graph_coarsening', 'num_proxies': 256, 'score_layers': 3, 'score_heads': 8, 'gnn_layers': 9, 'decode_hidden': 64, 'decode_layers': 3, 'coarsen_reg_weight': 0.45, 'hop_dim': 32, 'fuse_mode': 'sum_proj', 'khop_per_block': False, 'khop_num_heads': 4, 'share_blocks': True, 'use_proxy_self_attn': False, 'final_sa_layers': 2, 'dropout': 0.15000000000000002, 'aux_loss_weight': 1.25, 'lr': 0.00030100588028934155, 'weight_decay': 2.750241794665673e-05}. Best is trial 28 with value: 0.3926341547056777.
  [trial 35] epoch 00 198.2s (bs=32) | train AP 0.2178 loss 0.4124 | val AP 0.2833 | best 0.2833
  [trial 35] epoch 01 194.7s (bs=32) | train AP 0.2614 loss 0.3286 | val AP 0.2872 | best 0.2872
  [trial 35] epoch 02 194.1s (bs=32) | train AP 0.2637 loss 0.3263 | val AP 0.2910 | best 0.2910
  [trial 35] epoch 03 188.2s (bs=32) | train AP 0.2675 loss 0.3243 | val AP 0.2861 | best 0.2910
  [trial 35] epoch 04 192.3s (bs=32) | train AP 0.2713 loss 0.3231 | val AP 0.2884 | best 0.2910
  [trial 35] epoch 05 187.9s (bs=32) | train AP 0.2736 loss 0.3226 | val AP 0.2866 | best 0.2910
  [trial 35] PRUNED at epoch 5
[I 2026-05-13 01:24:06,359] Trial 35 pruned. 
  [trial 36] epoch 00 106.4s (bs=32) | train AP 0.2016 loss 0.4157 | val AP 0.2650 | best 0.2650
  [trial 36] epoch 01 102.9s (bs=32) | train AP 0.2516 loss 0.3331 | val AP 0.2751 | best 0.2751
  [trial 36] epoch 02 102.4s (bs=32) | train AP 0.2611 loss 0.3292 | val AP 0.2821 | best 0.2821
  [trial 36] epoch 03 102.3s (bs=32) | train AP 0.2637 loss 0.3277 | val AP 0.2942 | best 0.2942
  [trial 36] epoch 04 102.7s (bs=32) | train AP 0.2687 loss 0.3251 | val AP 0.2920 | best 0.2942
  [trial 36] epoch 05 102.7s (bs=32) | train AP 0.2658 loss 0.3246 | val AP 0.2909 | best 0.2942
  [trial 36] PRUNED at epoch 5
