[Peptides-func] task=multi_label  metric=macro_ap (higher_is_better=True)
  Loading cached distance masks from ./data/Peptides-func/dist_masks/train.pkl
  Loading cached distance masks from ./data/Peptides-func/dist_masks/val.pkl
  Loading cached distance masks from ./data/Peptides-func/dist_masks/test.pkl
Subsampled train: 10873 → 5436 (50%)
Train batches: 170  Val batches: 73
Max epochs/trial: 10  Patience: 10
Optuna trials: 100  Pruning: True
========================================================================
Resuming study 'khop_hparam_search' — 4 existing trials found.
Will run 96 new trials (target total: 100, existing: 4).
  [trial 4] epoch 00 179.6s (bs=32) | train AP 0.2165 loss 0.3838 | val AP 0.2801 | best 0.2801
  [trial 4] epoch 01 167.2s (bs=32) | train AP 0.2602 loss 0.3312 | val AP 0.2861 | best 0.2861
  [trial 4] epoch 02 167.5s (bs=32) | train AP 0.2612 loss 0.3296 | val AP 0.2805 | best 0.2861
  [trial 4] epoch 03 167.0s (bs=32) | train AP 0.2687 loss 0.3266 | val AP 0.2827 | best 0.2861
  [trial 4] epoch 04 166.5s (bs=32) | train AP 0.2690 loss 0.3251 | val AP 0.2845 | best 0.2861
  [trial 4] epoch 05 165.7s (bs=32) | train AP 0.2685 loss 0.3251 | val AP 0.2823 | best 0.2861
  [trial 4] epoch 06 167.2s (bs=32) | train AP 0.2713 loss 0.3232 | val AP 0.2886 | best 0.2886
  [trial 4] epoch 07 168.0s (bs=32) | train AP 0.2713 loss 0.3233 | val AP 0.2887 | best 0.2887
  [trial 4] epoch 08 167.9s (bs=32) | train AP 0.2756 loss 0.3230 | val AP 0.2884 | best 0.2887
  [trial 4] epoch 09 167.1s (bs=32) | train AP 0.2779 loss 0.3220 | val AP 0.2893 | best 0.2893
[I 2026-05-12 14:12:48,014] Trial 4 finished with value: 0.28933003618002423 and parameters: {'hidden_dim': 128, 'num_layers': 2, 'num_heads': 4, 'num_cross_layers': 1, 'generator': 'score_based', 'num_proxies': 64, 'score_layers': 1, 'score_heads': 4, 'gnn_layers': 15, 'decode_hidden': 128, 'decode_layers': 3, 'coarsen_reg_weight': 0.05, 'hop_dim': 16, 'fuse_mode': 'concat_proj', 'khop_per_block': True, 'khop_num_heads': 8, 'share_blocks': False, 'use_proxy_self_attn': False, 'final_sa_layers': 1, 'dropout': 0.25, 'aux_loss_weight': 1.5, 'lr': 0.000452996831941414, 'weight_decay': 0.00013388357662108641}. Best is trial 2 with value: 0.3290995120739183.
  [trial 5] epoch 00 174.2s (bs=32) | train AP 0.2188 loss 0.3810 | val AP 0.2805 | best 0.2805
  [trial 5] epoch 01 162.0s (bs=32) | train AP 0.2586 loss 0.3305 | val AP 0.2905 | best 0.2905
  [trial 5] epoch 02 159.5s (bs=32) | train AP 0.2651 loss 0.3266 | val AP 0.2879 | best 0.2905
  [trial 5] epoch 03 160.2s (bs=32) | train AP 0.2680 loss 0.3254 | val AP 0.2894 | best 0.2905
  [trial 5] epoch 04 160.0s (bs=32) | train AP 0.2715 loss 0.3241 | val AP 0.2942 | best 0.2942
  [trial 5] epoch 05 161.6s (bs=32) | train AP 0.2741 loss 0.3220 | val AP 0.3112 | best 0.3112
  [trial 5] epoch 06 161.4s (bs=32) | train AP 0.2987 loss 0.3152 | val AP 0.3194 | best 0.3194
  [trial 5] epoch 07 176.5s (bs=32) | train AP 0.3093 loss 0.3089 | val AP 0.3298 | best 0.3298
  [trial 5] epoch 08 159.8s (bs=32) | train AP 0.3210 loss 0.3043 | val AP 0.3308 | best 0.3308
  [trial 5] epoch 09 159.8s (bs=32) | train AP 0.3255 loss 0.3025 | val AP 0.3317 | best 0.3317
[I 2026-05-12 14:40:06,150] Trial 5 finished with value: 0.3316641418886808 and parameters: {'hidden_dim': 96, 'num_layers': 6, 'num_heads': 8, 'num_cross_layers': 1, 'generator': 'graph_coarsening', 'num_proxies': 256, 'score_layers': 2, 'score_heads': 8, 'gnn_layers': 15, 'decode_hidden': 64, 'decode_layers': 2, 'coarsen_reg_weight': 0.1, 'hop_dim': 16, 'fuse_mode': 'concat_proj', 'khop_per_block': False, 'khop_num_heads': 4, 'share_blocks': False, 'use_proxy_self_attn': False, 'final_sa_layers': 2, 'dropout': 0.2, 'aux_loss_weight': 1.75, 'lr': 0.0009713257095416607, 'weight_decay': 0.006027845046946914}. Best is trial 5 with value: 0.3316641418886808.
  [trial 6] epoch 00 310.5s (bs=32) | train AP 0.2240 loss 0.3893 | val AP 0.2872 | best 0.2872
  [trial 6] epoch 01 314.1s (bs=32) | train AP 0.2577 loss 0.3312 | val AP 0.2877 | best 0.2877
  [trial 6] epoch 02 305.7s (bs=32) | train AP 0.2617 loss 0.3281 | val AP 0.2846 | best 0.2877
  [trial 6] epoch 03 304.4s (bs=32) | train AP 0.2645 loss 0.3262 | val AP 0.2816 | best 0.2877
  [trial 6] epoch 04 305.9s (bs=32) | train AP 0.2658 loss 0.3256 | val AP 0.2868 | best 0.2877
  [trial 6] epoch 05 303.1s (bs=32) | train AP 0.2708 loss 0.3238 | val AP 0.2903 | best 0.2903
  [trial 6] epoch 06 303.3s (bs=32) | train AP 0.2717 loss 0.3229 | val AP 0.2916 | best 0.2916
  [trial 6] epoch 07 310.4s (bs=32) | train AP 0.2744 loss 0.3224 | val AP 0.2948 | best 0.2948
  [trial 6] epoch 08 305.7s (bs=32) | train AP 0.2763 loss 0.3215 | val AP 0.2943 | best 0.2948
  [trial 6] epoch 09 307.5s (bs=32) | train AP 0.2775 loss 0.3208 | val AP 0.2947 | best 0.2948
[I 2026-05-12 15:31:19,807] Trial 6 finished with value: 0.29475829067707227 and parameters: {'hidden_dim': 192, 'num_layers': 2, 'num_heads': 4, 'num_cross_layers': 2, 'generator': 'pma', 'num_proxies': 128, 'score_layers': 1, 'score_heads': 4, 'gnn_layers': 15, 'decode_hidden': 256, 'decode_layers': 1, 'coarsen_reg_weight': 0.4, 'hop_dim': 32, 'fuse_mode': 'sum_proj', 'khop_per_block': True, 'khop_num_heads': 2, 'share_blocks': False, 'use_proxy_self_attn': False, 'final_sa_layers': 1, 'dropout': 0.3, 'aux_loss_weight': 0.75, 'lr': 0.0005618142019833217, 'weight_decay': 0.007063286458453469}. Best is trial 5 with value: 0.3316641418886808.
  [trial 7] OOM at bs=32 → retrying with bs=16
  [trial 7] epoch 00 515.1s (bs=16) | train AP 0.2133 loss 0.3949 | val AP 0.2790 | best 0.2790
  [trial 7] epoch 01 533.8s (bs=16) | train AP 0.2611 loss 0.3286 | val AP 0.2850 | best 0.2850
  [trial 7] epoch 02 513.5s (bs=16) | train AP 0.2624 loss 0.3268 | val AP 0.2897 | best 0.2897
  [trial 7] epoch 03 520.4s (bs=16) | train AP 0.2681 loss 0.3251 | val AP 0.2826 | best 0.2897
  [trial 7] epoch 04 533.8s (bs=16) | train AP 0.2664 loss 0.3247 | val AP 0.2914 | best 0.2914
  [trial 7] epoch 05 558.9s (bs=16) | train AP 0.2672 loss 0.3238 | val AP 0.2853 | best 0.2914
  [trial 7] epoch 06 512.1s (bs=16) | train AP 0.2704 loss 0.3225 | val AP 0.2917 | best 0.2917
  [trial 7] epoch 07 520.3s (bs=16) | train AP 0.2731 loss 0.3222 | val AP 0.2927 | best 0.2927
  [trial 7] PRUNED at epoch 7
[I 2026-05-12 16:43:04,400] Trial 7 pruned. 
  [trial 8] epoch 00 109.9s (bs=32) | train AP 0.2342 loss 0.3561 | val AP 0.2918 | best 0.2918
  [trial 8] epoch 01 109.6s (bs=32) | train AP 0.2599 loss 0.3318 | val AP 0.2815 | best 0.2918
  [trial 8] epoch 02 108.5s (bs=32) | train AP 0.2589 loss 0.3290 | val AP 0.2800 | best 0.2918
  [trial 8] epoch 03 108.6s (bs=32) | train AP 0.2596 loss 0.3297 | val AP 0.2845 | best 0.2918
  [trial 8] epoch 04 110.4s (bs=32) | train AP 0.2620 loss 0.3267 | val AP 0.2915 | best 0.2918
  [trial 8] epoch 05 108.1s (bs=32) | train AP 0.2638 loss 0.3266 | val AP 0.2862 | best 0.2918
  [trial 8] epoch 06 108.3s (bs=32) | train AP 0.2700 loss 0.3236 | val AP 0.2952 | best 0.2952
  [trial 8] epoch 07 109.4s (bs=32) | train AP 0.2750 loss 0.3223 | val AP 0.2823 | best 0.2952
  [trial 8] epoch 08 110.1s (bs=32) | train AP 0.2777 loss 0.3201 | val AP 0.2853 | best 0.2952
  [trial 8] epoch 09 108.9s (bs=32) | train AP 0.2795 loss 0.3204 | val AP 0.2870 | best 0.2952
[I 2026-05-12 17:01:18,772] Trial 8 finished with value: 0.29515910510238375 and parameters: {'hidden_dim': 256, 'num_layers': 3, 'num_heads': 4, 'num_cross_layers': 3, 'generator': 'score_based', 'num_proxies': 32, 'score_layers': 2, 'score_heads': 4, 'gnn_layers': 3, 'decode_hidden': 256, 'decode_layers': 2, 'coarsen_reg_weight': 0.2, 'hop_dim': 32, 'fuse_mode': 'sum_proj', 'khop_per_block': False, 'khop_num_heads': 4, 'share_blocks': False, 'use_proxy_self_attn': True, 'final_sa_layers': 1, 'dropout': 0.35000000000000003, 'aux_loss_weight': 2.0, 'lr': 0.0016353906810534322, 'weight_decay': 0.007275585049585748}. Best is trial 5 with value: 0.3316641418886808.
  [trial 9] epoch 00 215.0s (bs=32) | train AP 0.2050 loss 0.4040 | val AP 0.2786 | best 0.2786
  [trial 9] epoch 01 221.1s (bs=32) | train AP 0.2562 loss 0.3346 | val AP 0.2802 | best 0.2802
  [trial 9] epoch 02 238.6s (bs=32) | train AP 0.2622 loss 0.3305 | val AP 0.2833 | best 0.2833
  [trial 9] epoch 03 229.3s (bs=32) | train AP 0.2602 loss 0.3299 | val AP 0.2820 | best 0.2833
  [trial 9] epoch 04 228.3s (bs=32) | train AP 0.2671 loss 0.3279 | val AP 0.2823 | best 0.2833
  [trial 9] epoch 05 215.2s (bs=32) | train AP 0.2648 loss 0.3276 | val AP 0.2875 | best 0.2875
  [trial 9] PRUNED at epoch 5
[I 2026-05-12 17:23:48,624] Trial 9 pruned. 
  [trial 10] epoch 00 307.9s (bs=32) | train AP 0.2199 loss 0.3678 | val AP 0.2778 | best 0.2778
  [trial 10] epoch 01 309.8s (bs=32) | train AP 0.2542 loss 0.3287 | val AP 0.2891 | best 0.2891
  [trial 10] epoch 02 304.3s (bs=32) | train AP 0.2650 loss 0.3253 | val AP 0.2830 | best 0.2891
  [trial 10] epoch 03 307.4s (bs=32) | train AP 0.2714 loss 0.3233 | val AP 0.2923 | best 0.2923
  [trial 10] epoch 04 303.7s (bs=32) | train AP 0.2721 loss 0.3224 | val AP 0.2999 | best 0.2999
  [trial 10] epoch 05 303.8s (bs=32) | train AP 0.2751 loss 0.3207 | val AP 0.2953 | best 0.2999
  [trial 10] epoch 06 305.3s (bs=32) | train AP 0.2725 loss 0.3208 | val AP 0.2980 | best 0.2999
  [trial 10] epoch 07 305.6s (bs=32) | train AP 0.2833 loss 0.3179 | val AP 0.3020 | best 0.3020
  [trial 10] epoch 08 311.0s (bs=32) | train AP 0.2864 loss 0.3165 | val AP 0.3013 | best 0.3020
  [trial 10] epoch 09 313.1s (bs=32) | train AP 0.2927 loss 0.3158 | val AP 0.3007 | best 0.3020
[I 2026-05-12 18:15:03,926] Trial 10 finished with value: 0.30203996139265443 and parameters: {'hidden_dim': 128, 'num_layers': 4, 'num_heads': 8, 'num_cross_layers': 3, 'generator': 'pma', 'num_proxies': 256, 'score_layers': 3, 'score_heads': 4, 'gnn_layers': 15, 'decode_hidden': 256, 'decode_layers': 2, 'coarsen_reg_weight': 0.30000000000000004, 'hop_dim': 8, 'fuse_mode': 'mean_proj', 'khop_per_block': False, 'khop_num_heads': 2, 'share_blocks': False, 'use_proxy_self_attn': False, 'final_sa_layers': 0, 'dropout': 0.05, 'aux_loss_weight': 1.5, 'lr': 0.0009818146154842193, 'weight_decay': 1.2058719772229762e-05}. Best is trial 5 with value: 0.3316641418886808.
  [trial 11] epoch 00 168.8s (bs=32) | train AP 0.1686 loss 0.3891 | val AP 0.2539 | best 0.2539
  [trial 11] epoch 01 169.6s (bs=32) | train AP 0.1652 loss 0.3634 | val AP 0.2100 | best 0.2539
  [trial 11] epoch 02 170.7s (bs=32) | train AP 0.1716 loss 0.3616 | val AP 0.2767 | best 0.2767
  [trial 11] epoch 03 173.8s (bs=32) | train AP 0.1654 loss 0.3612 | val AP 0.2775 | best 0.2775
  [trial 11] epoch 04 170.8s (bs=32) | train AP 0.1786 loss 0.3593 | val AP 0.2216 | best 0.2775
  [trial 11] epoch 05 170.0s (bs=32) | train AP 0.2284 loss 0.3376 | val AP 0.2659 | best 0.2775
  [trial 11] PRUNED at epoch 5
[I 2026-05-12 18:32:10,159] Trial 11 pruned. 
  [trial 12] epoch 00 109.3s (bs=32) | train AP 0.2294 loss 0.3627 | val AP 0.2777 | best 0.2777
  [trial 12] epoch 01 104.6s (bs=32) | train AP 0.2638 loss 0.3280 | val AP 0.2870 | best 0.2870
  [trial 12] epoch 02 102.8s (bs=32) | train AP 0.2698 loss 0.3256 | val AP 0.2906 | best 0.2906
  [trial 12] epoch 03 105.0s (bs=32) | train AP 0.2699 loss 0.3242 | val AP 0.2867 | best 0.2906
  [trial 12] epoch 04 103.4s (bs=32) | train AP 0.2741 loss 0.3222 | val AP 0.2957 | best 0.2957
  [trial 12] epoch 05 103.5s (bs=32) | train AP 0.2772 loss 0.3211 | val AP 0.2968 | best 0.2968
  [trial 12] epoch 06 104.5s (bs=32) | train AP 0.2817 loss 0.3198 | val AP 0.2924 | best 0.2968
  [trial 12] epoch 07 104.0s (bs=32) | train AP 0.2934 loss 0.3158 | val AP 0.3072 | best 0.3072
  [trial 12] epoch 08 104.1s (bs=32) | train AP 0.3033 loss 0.3116 | val AP 0.3087 | best 0.3087
  [trial 12] epoch 09 103.7s (bs=32) | train AP 0.3062 loss 0.3092 | val AP 0.3107 | best 0.3107
[I 2026-05-12 18:49:38,862] Trial 12 finished with value: 0.31069850957833756 and parameters: {'hidden_dim': 192, 'num_layers': 1, 'num_heads': 8, 'num_cross_layers': 2, 'generator': 'score_based', 'num_proxies': 256, 'score_layers': 2, 'score_heads': 8, 'gnn_layers': 12, 'decode_hidden': 128, 'decode_layers': 1, 'coarsen_reg_weight': 0.35000000000000003, 'hop_dim': 16, 'fuse_mode': 'concat_proj', 'khop_per_block': False, 'khop_num_heads': 4, 'share_blocks': False, 'use_proxy_self_attn': True, 'final_sa_layers': 2, 'dropout': 0.15000000000000002, 'aux_loss_weight': 1.0, 'lr': 0.0007729012002700056, 'weight_decay': 0.000254923797200433}. Best is trial 5 with value: 0.3316641418886808.
  [trial 13] epoch 00 149.3s (bs=32) | train AP 0.2170 loss 0.3700 | val AP 0.2762 | best 0.2762
  [trial 13] epoch 01 134.9s (bs=32) | train AP 0.2557 loss 0.3311 | val AP 0.2809 | best 0.2809
  [trial 13] epoch 02 137.9s (bs=32) | train AP 0.2648 loss 0.3272 | val AP 0.2937 | best 0.2937
  [trial 13] epoch 03 136.9s (bs=32) | train AP 0.2678 loss 0.3241 | val AP 0.2969 | best 0.2969
  [trial 13] epoch 04 137.3s (bs=32) | train AP 0.2749 loss 0.3211 | val AP 0.3017 | best 0.3017
  [trial 13] epoch 05 136.6s (bs=32) | train AP 0.2796 loss 0.3198 | val AP 0.3037 | best 0.3037
  [trial 13] epoch 06 135.6s (bs=32) | train AP 0.2789 loss 0.3186 | val AP 0.3058 | best 0.3058
  [trial 13] epoch 07 137.1s (bs=32) | train AP 0.2897 loss 0.3161 | val AP 0.3099 | best 0.3099
  [trial 13] epoch 08 136.6s (bs=32) | train AP 0.2946 loss 0.3145 | val AP 0.3117 | best 0.3117
  [trial 13] epoch 09 137.5s (bs=32) | train AP 0.2973 loss 0.3132 | val AP 0.3121 | best 0.3121
[I 2026-05-12 19:12:41,964] Trial 13 finished with value: 0.31213422581790856 and parameters: {'hidden_dim': 96, 'num_layers': 5, 'num_heads': 4, 'num_cross_layers': 2, 'generator': 'graph_coarsening', 'num_proxies': 32, 'score_layers': 2, 'score_heads': 8, 'gnn_layers': 12, 'decode_hidden': 64, 'decode_layers': 1, 'coarsen_reg_weight': 0.5, 'hop_dim': 16, 'fuse_mode': 'concat_proj', 'khop_per_block': False, 'khop_num_heads': 2, 'share_blocks': False, 'use_proxy_self_attn': True, 'final_sa_layers': 2, 'dropout': 0.2, 'aux_loss_weight': 1.0, 'lr': 0.0014613778664468123, 'weight_decay': 3.264634336769891e-05}. Best is trial 5 with value: 0.3316641418886808.
  [trial 14] epoch 00 105.1s (bs=32) | train AP 0.2269 loss 0.3663 | val AP 0.2890 | best 0.2890
  [trial 14] epoch 01 99.6s (bs=32) | train AP 0.2573 loss 0.3298 | val AP 0.2937 | best 0.2937
  [trial 14] epoch 02 100.5s (bs=32) | train AP 0.2664 loss 0.3253 | val AP 0.2821 | best 0.2937
  [trial 14] epoch 03 100.0s (bs=32) | train AP 0.2707 loss 0.3245 | val AP 0.2939 | best 0.2939
  [trial 14] epoch 04 99.9s (bs=32) | train AP 0.2697 loss 0.3232 | val AP 0.2927 | best 0.2939
  [trial 14] epoch 05 99.9s (bs=32) | train AP 0.2760 loss 0.3209 | val AP 0.3024 | best 0.3024
  [trial 14] epoch 06 99.7s (bs=32) | train AP 0.2847 loss 0.3182 | val AP 0.3074 | best 0.3074
  [trial 14] epoch 07 99.0s (bs=32) | train AP 0.2952 loss 0.3145 | val AP 0.3168 | best 0.3168
  [trial 14] epoch 08 99.8s (bs=32) | train AP 0.3088 loss 0.3099 | val AP 0.3241 | best 0.3241
  [trial 14] epoch 09 99.2s (bs=32) | train AP 0.3185 loss 0.3070 | val AP 0.3250 | best 0.3250
[I 2026-05-12 19:29:27,906] Trial 14 finished with value: 0.3250022994808607 and parameters: {'hidden_dim': 192, 'num_layers': 1, 'num_heads': 8, 'num_cross_layers': 1, 'generator': 'score_based', 'num_proxies': 64, 'score_layers': 2, 'score_heads': 8, 'gnn_layers': 12, 'decode_hidden': 128, 'decode_layers': 1, 'coarsen_reg_weight': 0.15000000000000002, 'hop_dim': 16, 'fuse_mode': 'concat_proj', 'khop_per_block': False, 'khop_num_heads': 4, 'share_blocks': False, 'use_proxy_self_attn': True, 'final_sa_layers': 2, 'dropout': 0.15000000000000002, 'aux_loss_weight': 0.0, 'lr': 0.0006721434537464837, 'weight_decay': 0.0007177203655670608}. Best is trial 5 with value: 0.3316641418886808.
  [trial 15] epoch 00 128.1s (bs=32) | train AP 0.2252 loss 0.3664 | val AP 0.2893 | best 0.2893
  [trial 15] epoch 01 124.2s (bs=32) | train AP 0.2569 loss 0.3315 | val AP 0.2892 | best 0.2893
  [trial 15] epoch 02 124.5s (bs=32) | train AP 0.2654 loss 0.3273 | val AP 0.2918 | best 0.2918
  [trial 15] epoch 03 125.6s (bs=32) | train AP 0.2715 loss 0.3244 | val AP 0.3072 | best 0.3072
  [trial 15] epoch 04 125.6s (bs=32) | train AP 0.2723 loss 0.3229 | val AP 0.3094 | best 0.3094
  [trial 15] epoch 05 123.8s (bs=32) | train AP 0.2828 loss 0.3185 | val AP 0.3237 | best 0.3237
  [trial 15] epoch 06 123.5s (bs=32) | train AP 0.3007 loss 0.3130 | val AP 0.3364 | best 0.3364
  [trial 15] epoch 07 125.0s (bs=32) | train AP 0.3194 loss 0.3049 | val AP 0.3472 | best 0.3472
  [trial 15] epoch 08 123.4s (bs=32) | train AP 0.3293 loss 0.2998 | val AP 0.3584 | best 0.3584
  [trial 15] epoch 09 124.0s (bs=32) | train AP 0.3425 loss 0.2966 | val AP 0.3621 | best 0.3621
[I 2026-05-12 19:50:19,028] Trial 15 finished with value: 0.36207288276635347 and parameters: {'hidden_dim': 256, 'num_layers': 2, 'num_heads': 4, 'num_cross_layers': 2, 'generator': 'graph_coarsening', 'num_proxies': 256, 'score_layers': 3, 'score_heads': 8, 'gnn_layers': 9, 'decode_hidden': 64, 'decode_layers': 2, 'coarsen_reg_weight': 0.30000000000000004, 'hop_dim': 16, 'fuse_mode': 'concat_proj', 'khop_per_block': False, 'khop_num_heads': 4, 'share_blocks': True, 'use_proxy_self_attn': False, 'final_sa_layers': 2, 'dropout': 0.3, 'aux_loss_weight': 1.25, 'lr': 0.00033376400602340336, 'weight_decay': 0.0024982018911381756}. Best is trial 15 with value: 0.36207288276635347.
  [trial 16] epoch 00 165.1s (bs=32) | train AP 0.2183 loss 0.3758 | val AP 0.2807 | best 0.2807
  [trial 16] epoch 01 155.7s (bs=32) | train AP 0.2566 loss 0.3340 | val AP 0.2813 | best 0.2813
  [trial 16] epoch 02 154.3s (bs=32) | train AP 0.2579 loss 0.3308 | val AP 0.2880 | best 0.2880
  [trial 16] epoch 03 152.8s (bs=32) | train AP 0.2624 loss 0.3277 | val AP 0.2907 | best 0.2907
  [trial 16] epoch 04 155.0s (bs=32) | train AP 0.2699 loss 0.3246 | val AP 0.2991 | best 0.2991
  [trial 16] epoch 05 154.5s (bs=32) | train AP 0.2768 loss 0.3227 | val AP 0.3002 | best 0.3002
  [trial 16] epoch 06 155.2s (bs=32) | train AP 0.2855 loss 0.3185 | val AP 0.3048 | best 0.3048
  [trial 16] epoch 07 154.9s (bs=32) | train AP 0.2911 loss 0.3150 | val AP 0.3123 | best 0.3123
  [trial 16] epoch 08 155.2s (bs=32) | train AP 0.2988 loss 0.3117 | val AP 0.3133 | best 0.3133
  [trial 16] epoch 09 155.5s (bs=32) | train AP 0.3055 loss 0.3098 | val AP 0.3147 | best 0.3147
[I 2026-05-12 20:16:20,484] Trial 16 finished with value: 0.31467430865532153 and parameters: {'hidden_dim': 256, 'num_layers': 5, 'num_heads': 8, 'num_cross_layers': 1, 'generator': 'graph_coarsening', 'num_proxies': 256, 'score_layers': 3, 'score_heads': 8, 'gnn_layers': 6, 'decode_hidden': 64, 'decode_layers': 2, 'coarsen_reg_weight': 0.25, 'hop_dim': 16, 'fuse_mode': 'concat_proj', 'khop_per_block': False, 'khop_num_heads': 4, 'share_blocks': True, 'use_proxy_self_attn': False, 'final_sa_layers': 2, 'dropout': 0.4, 'aux_loss_weight': 1.75, 'lr': 0.000323068551502676, 'weight_decay': 0.0026512759150576727}. Best is trial 15 with value: 0.36207288276635347.
  [trial 17] epoch 00 155.1s (bs=32) | train AP 0.2115 loss 0.3656 | val AP 0.2696 | best 0.2696
  [trial 17] epoch 01 145.5s (bs=32) | train AP 0.2348 loss 0.3403 | val AP 0.2455 | best 0.2696
  [trial 17] epoch 02 146.1s (bs=32) | train AP 0.2323 loss 0.3388 | val AP 0.2859 | best 0.2859
  [trial 17] epoch 03 156.7s (bs=32) | train AP 0.2445 loss 0.3326 | val AP 0.2216 | best 0.2859
  [trial 17] epoch 04 145.7s (bs=32) | train AP 0.2325 loss 0.3337 | val AP 0.2616 | best 0.2859
  [trial 17] epoch 05 145.8s (bs=32) | train AP 0.2560 loss 0.3279 | val AP 0.2809 | best 0.2859
  [trial 17] PRUNED at epoch 5
[I 2026-05-12 20:31:17,684] Trial 17 pruned. 
  [trial 18] epoch 00 118.1s (bs=32) | train AP 0.2092 loss 0.3797 | val AP 0.2724 | best 0.2724
  [trial 18] epoch 01 112.7s (bs=32) | train AP 0.2580 loss 0.3321 | val AP 0.2887 | best 0.2887
  [trial 18] epoch 02 113.0s (bs=32) | train AP 0.2655 loss 0.3277 | val AP 0.2980 | best 0.2980
  [trial 18] epoch 03 109.3s (bs=32) | train AP 0.2647 loss 0.3270 | val AP 0.2889 | best 0.2980
  [trial 18] epoch 04 109.7s (bs=32) | train AP 0.2680 loss 0.3253 | val AP 0.2956 | best 0.2980
  [trial 18] epoch 05 110.9s (bs=32) | train AP 0.2731 loss 0.3241 | val AP 0.2935 | best 0.2980
  [trial 18] epoch 06 110.3s (bs=32) | train AP 0.2763 loss 0.3232 | val AP 0.2979 | best 0.2980
  [trial 18] epoch 07 111.3s (bs=32) | train AP 0.2775 loss 0.3219 | val AP 0.2983 | best 0.2983
  [trial 18] PRUNED at epoch 7
[I 2026-05-12 20:46:15,527] Trial 18 pruned. 
  [trial 19] epoch 00 113.4s (bs=32) | train AP 0.2304 loss 0.3650 | val AP 0.2861 | best 0.2861
  [trial 19] epoch 01 110.2s (bs=32) | train AP 0.2580 loss 0.3321 | val AP 0.2840 | best 0.2861
  [trial 19] epoch 02 109.2s (bs=32) | train AP 0.2660 loss 0.3293 | val AP 0.2819 | best 0.2861
  [trial 19] epoch 03 111.0s (bs=32) | train AP 0.2678 loss 0.3265 | val AP 0.2859 | best 0.2861
  [trial 19] epoch 04 110.1s (bs=32) | train AP 0.2681 loss 0.3258 | val AP 0.2935 | best 0.2935
  [trial 19] epoch 05 109.7s (bs=32) | train AP 0.2759 loss 0.3230 | val AP 0.2976 | best 0.2976
  [trial 19] epoch 06 109.6s (bs=32) | train AP 0.2829 loss 0.3210 | val AP 0.3020 | best 0.3020
  [trial 19] epoch 07 109.4s (bs=32) | train AP 0.2875 loss 0.3177 | val AP 0.3081 | best 0.3081
  [trial 19] epoch 08 109.6s (bs=32) | train AP 0.2921 loss 0.3156 | val AP 0.3098 | best 0.3098
  [trial 19] epoch 09 109.6s (bs=32) | train AP 0.2991 loss 0.3133 | val AP 0.3085 | best 0.3098
  [trial 19] PRUNED at epoch 9
