[I 2026-05-12 23:44:05,805] Trial 13 pruned. 
  [trial 14] epoch 00 93.7s (bs=32) | train AP 0.2095 loss 0.3720 | val AP 0.3526 | best 0.3526
  [trial 14] epoch 01 92.9s (bs=32) | train AP 0.3423 loss 0.3021 | val AP 0.3824 | best 0.3824
  [trial 14] epoch 02 93.4s (bs=32) | train AP 0.3824 loss 0.2857 | val AP 0.4133 | best 0.4133
  [trial 14] epoch 03 92.7s (bs=32) | train AP 0.3944 loss 0.2805 | val AP 0.4323 | best 0.4323
  [trial 14] epoch 04 92.7s (bs=32) | train AP 0.4196 loss 0.2709 | val AP 0.4559 | best 0.4559
  [trial 14] epoch 05 95.1s (bs=32) | train AP 0.4363 loss 0.2636 | val AP 0.4694 | best 0.4694
  [trial 14] epoch 06 94.1s (bs=32) | train AP 0.4490 loss 0.2592 | val AP 0.4811 | best 0.4811
  [trial 14] epoch 07 93.4s (bs=32) | train AP 0.4834 loss 0.2481 | val AP 0.4938 | best 0.4938
  [trial 14] epoch 08 94.4s (bs=32) | train AP 0.4999 loss 0.2405 | val AP 0.5232 | best 0.5232
  [trial 14] epoch 09 95.3s (bs=32) | train AP 0.5247 loss 0.2343 | val AP 0.5401 | best 0.5401
  [trial 14] epoch 10 94.2s (bs=32) | train AP 0.5500 loss 0.2238 | val AP 0.5387 | best 0.5401
  [trial 14] epoch 11 93.8s (bs=32) | train AP 0.5788 loss 0.2145 | val AP 0.5529 | best 0.5529
  [trial 14] epoch 12 93.7s (bs=32) | train AP 0.6065 loss 0.2046 | val AP 0.5715 | best 0.5715
  [trial 14] epoch 13 94.7s (bs=32) | train AP 0.6370 loss 0.1937 | val AP 0.5796 | best 0.5796
  [trial 14] epoch 14 94.3s (bs=32) | train AP 0.6706 loss 0.1799 | val AP 0.5900 | best 0.5900
  [trial 14] epoch 15 94.0s (bs=32) | train AP 0.6932 loss 0.1708 | val AP 0.5930 | best 0.5930
  [trial 14] epoch 16 94.3s (bs=32) | train AP 0.7232 loss 0.1612 | val AP 0.5963 | best 0.5963
  [trial 14] epoch 17 94.3s (bs=32) | train AP 0.7408 loss 0.1542 | val AP 0.5967 | best 0.5967
  [trial 14] epoch 18 94.3s (bs=32) | train AP 0.7505 loss 0.1499 | val AP 0.5982 | best 0.5982
  [trial 14] epoch 19 93.9s (bs=32) | train AP 0.7548 loss 0.1487 | val AP 0.5986 | best 0.5986
[I 2026-05-13 00:15:27,626] Trial 14 finished with value: 0.5985720260041724 and parameters: {'hidden_dim': 384, 'num_heads': 32, 'ffn_ratio': 4, 'num_layers': 3, 'dropout': 0.05, 'hop_mode': 'window', 'hop_window': 3, 'num_global_heads': 3, 'graph_pool': 'sum', 'lr': 0.00042084275653155826, 'weight_decay': 0.002612515352954185}. Best is trial 14 with value: 0.5985720260041724.
  [trial 15] epoch 00 75.0s (bs=32) | train AP 0.2274 loss 0.3621 | val AP 0.3607 | best 0.3607
  [trial 15] epoch 01 77.4s (bs=32) | train AP 0.3305 loss 0.3069 | val AP 0.3636 | best 0.3636
  [trial 15] epoch 02 76.9s (bs=32) | train AP 0.3599 loss 0.2953 | val AP 0.4005 | best 0.4005
  [trial 15] epoch 03 74.9s (bs=32) | train AP 0.3688 loss 0.2902 | val AP 0.4093 | best 0.4093
  [trial 15] epoch 04 75.9s (bs=32) | train AP 0.3875 loss 0.2831 | val AP 0.4316 | best 0.4316
  [trial 15] epoch 05 77.0s (bs=32) | train AP 0.4033 loss 0.2768 | val AP 0.4218 | best 0.4316
  [trial 15] epoch 06 77.2s (bs=32) | train AP 0.4109 loss 0.2741 | val AP 0.4498 | best 0.4498
  [trial 15] epoch 07 75.3s (bs=32) | train AP 0.4350 loss 0.2665 | val AP 0.4576 | best 0.4576
  [trial 15] epoch 08 76.3s (bs=32) | train AP 0.4417 loss 0.2627 | val AP 0.4759 | best 0.4759
  [trial 15] epoch 09 76.2s (bs=32) | train AP 0.4619 loss 0.2552 | val AP 0.4843 | best 0.4843
  [trial 15] epoch 10 75.6s (bs=32) | train AP 0.4796 loss 0.2506 | val AP 0.4974 | best 0.4974
  [trial 15] epoch 11 75.9s (bs=32) | train AP 0.4896 loss 0.2461 | val AP 0.4933 | best 0.4974
  [trial 15] epoch 12 77.3s (bs=32) | train AP 0.5113 loss 0.2394 | val AP 0.5216 | best 0.5216
  [trial 15] epoch 13 76.1s (bs=32) | train AP 0.5286 loss 0.2333 | val AP 0.5354 | best 0.5354
  [trial 15] epoch 14 75.4s (bs=32) | train AP 0.5417 loss 0.2289 | val AP 0.5451 | best 0.5451
  [trial 15] epoch 15 77.2s (bs=32) | train AP 0.5577 loss 0.2242 | val AP 0.5528 | best 0.5528
  [trial 15] epoch 16 76.9s (bs=32) | train AP 0.5663 loss 0.2202 | val AP 0.5573 | best 0.5573
  [trial 15] epoch 17 75.4s (bs=32) | train AP 0.5786 loss 0.2174 | val AP 0.5597 | best 0.5597
  [trial 15] epoch 18 76.4s (bs=32) | train AP 0.5828 loss 0.2159 | val AP 0.5595 | best 0.5597
  [trial 15] epoch 19 77.3s (bs=32) | train AP 0.5823 loss 0.2151 | val AP 0.5600 | best 0.5600
[I 2026-05-13 00:40:55,306] Trial 15 finished with value: 0.5599510731205505 and parameters: {'hidden_dim': 384, 'num_heads': 32, 'ffn_ratio': 4, 'num_layers': 1, 'dropout': 0.15000000000000002, 'hop_mode': 'window', 'hop_window': 3, 'num_global_heads': 3, 'graph_pool': 'sum', 'lr': 0.0010668626356736457, 'weight_decay': 0.002105484451170432}. Best is trial 14 with value: 0.5985720260041724.
  [trial 16] epoch 00 125.8s (bs=32) | train AP 0.1887 loss 0.3718 | val AP 0.2858 | best 0.2858
  [trial 16] epoch 01 122.2s (bs=32) | train AP 0.2601 loss 0.3298 | val AP 0.3036 | best 0.3036
  [trial 16] epoch 02 126.0s (bs=32) | train AP 0.2979 loss 0.3186 | val AP 0.3303 | best 0.3303
  [trial 16] epoch 03 126.9s (bs=32) | train AP 0.2922 loss 0.3198 | val AP 0.3290 | best 0.3303
  [trial 16] epoch 04 125.7s (bs=32) | train AP 0.3237 loss 0.3080 | val AP 0.3566 | best 0.3566
  [trial 16] epoch 05 121.0s (bs=32) | train AP 0.3264 loss 0.3069 | val AP 0.3542 | best 0.3566
  [trial 16] PRUNED at epoch 5
[I 2026-05-13 00:53:24,404] Trial 16 pruned. 
  [trial 17] epoch 00 94.0s (bs=32) | train AP 0.2142 loss 0.3670 | val AP 0.3079 | best 0.3079
  [trial 17] epoch 01 93.3s (bs=32) | train AP 0.3155 loss 0.3121 | val AP 0.3877 | best 0.3877
  [trial 17] epoch 02 93.0s (bs=32) | train AP 0.3646 loss 0.2918 | val AP 0.3996 | best 0.3996
  [trial 17] epoch 03 92.9s (bs=32) | train AP 0.3943 loss 0.2804 | val AP 0.4322 | best 0.4322
  [trial 17] epoch 04 94.2s (bs=32) | train AP 0.4144 loss 0.2718 | val AP 0.4494 | best 0.4494
  [trial 17] epoch 05 93.0s (bs=32) | train AP 0.4336 loss 0.2643 | val AP 0.4603 | best 0.4603
  [trial 17] epoch 06 94.3s (bs=32) | train AP 0.4530 loss 0.2575 | val AP 0.4807 | best 0.4807
  [trial 17] epoch 07 91.1s (bs=32) | train AP 0.4616 loss 0.2535 | val AP 0.4997 | best 0.4997
  [trial 17] epoch 08 89.7s (bs=32) | train AP 0.4776 loss 0.2481 | val AP 0.5118 | best 0.5118
  [trial 17] epoch 09 91.2s (bs=32) | train AP 0.5065 loss 0.2374 | val AP 0.5231 | best 0.5231
  [trial 17] epoch 10 89.6s (bs=32) | train AP 0.5233 loss 0.2321 | val AP 0.5296 | best 0.5296
  [trial 17] epoch 11 91.2s (bs=32) | train AP 0.5489 loss 0.2231 | val AP 0.5467 | best 0.5467
  [trial 17] epoch 12 90.4s (bs=32) | train AP 0.5788 loss 0.2115 | val AP 0.5637 | best 0.5637
[Peptides-func] task=multi_label  metric=macro_ap (higher_is_better=True)
  Loading cached distance masks from ./data/Peptides-func/dist_masks/train.pkl
  Loading cached distance masks from ./data/Peptides-func/dist_masks/val.pkl
  Loading cached distance masks from ./data/Peptides-func/dist_masks/test.pkl
Subsampled train: 10873 → 5436 (50%)
Train batches: 170  Val batches: 73
Max epochs/trial: 20  Patience: 10
Optuna trials: 50  Pruning: True
========================================================================
Resuming study 'hop_masked_hparam_search' — 18 existing trials found.
Will run 32 new trials (target total: 50, existing: 18).
  [trial 18] epoch 00 87.6s (bs=32) | train AP 0.2084 loss 0.3729 | val AP 0.3116 | best 0.3116
  [trial 18] epoch 01 88.6s (bs=32) | train AP 0.3228 loss 0.3098 | val AP 0.3763 | best 0.3763
  [trial 18] epoch 02 87.9s (bs=32) | train AP 0.3547 loss 0.2968 | val AP 0.3905 | best 0.3905
  [trial 18] epoch 03 86.7s (bs=32) | train AP 0.3782 loss 0.2862 | val AP 0.4152 | best 0.4152
  [trial 18] epoch 04 87.5s (bs=32) | train AP 0.4046 loss 0.2769 | val AP 0.4396 | best 0.4396
  [trial 18] epoch 05 87.4s (bs=32) | train AP 0.4150 loss 0.2718 | val AP 0.4290 | best 0.4396
  [trial 18] epoch 06 87.9s (bs=32) | train AP 0.4357 loss 0.2634 | val AP 0.4752 | best 0.4752
  [trial 18] epoch 07 87.3s (bs=32) | train AP 0.4620 loss 0.2539 | val AP 0.4765 | best 0.4765
  [trial 18] epoch 08 89.2s (bs=32) | train AP 0.4870 loss 0.2455 | val AP 0.4977 | best 0.4977
  [trial 18] epoch 09 88.5s (bs=32) | train AP 0.5210 loss 0.2322 | val AP 0.5045 | best 0.5045
  [trial 18] epoch 10 89.8s (bs=32) | train AP 0.5399 loss 0.2262 | val AP 0.5286 | best 0.5286
  [trial 18] epoch 11 88.4s (bs=32) | train AP 0.5683 loss 0.2134 | val AP 0.5357 | best 0.5357
  [trial 18] epoch 12 88.7s (bs=32) | train AP 0.6036 loss 0.2014 | val AP 0.5581 | best 0.5581
  [trial 18] epoch 13 88.9s (bs=32) | train AP 0.6278 loss 0.1907 | val AP 0.5589 | best 0.5589
  [trial 18] epoch 14 89.1s (bs=32) | train AP 0.6506 loss 0.1808 | val AP 0.5758 | best 0.5758
  [trial 18] epoch 15 92.2s (bs=32) | train AP 0.6784 loss 0.1708 | val AP 0.5755 | best 0.5758
  [trial 18] epoch 16 92.2s (bs=32) | train AP 0.6981 loss 0.1639 | val AP 0.5795 | best 0.5795
  [trial 18] epoch 17 93.6s (bs=32) | train AP 0.7157 loss 0.1574 | val AP 0.5800 | best 0.5800
  [trial 18] epoch 18 96.9s (bs=32) | train AP 0.7222 loss 0.1530 | val AP 0.5805 | best 0.5805
  [trial 18] epoch 19 93.2s (bs=32) | train AP 0.7262 loss 0.1526 | val AP 0.5812 | best 0.5812
[I 2026-05-13 08:43:24,315] Trial 18 finished with value: 0.5811616372825268 and parameters: {'hidden_dim': 384, 'num_heads': 32, 'ffn_ratio': 4, 'num_layers': 3, 'dropout': 0.15000000000000002, 'hop_mode': 'window', 'hop_window': 3, 'num_global_heads': 3, 'graph_pool': 'sum', 'lr': 0.0004066135941964346, 'weight_decay': 0.003333361498225621}. Best is trial 14 with value: 0.5985720260041724.
  [trial 19] epoch 00 94.7s (bs=32) | train AP 0.2030 loss 0.3741 | val AP 0.2978 | best 0.2978
  [trial 19] epoch 01 94.6s (bs=32) | train AP 0.3035 loss 0.3155 | val AP 0.3668 | best 0.3668
  [trial 19] epoch 02 94.3s (bs=32) | train AP 0.3542 loss 0.2961 | val AP 0.3961 | best 0.3961
  [trial 19] epoch 03 94.0s (bs=32) | train AP 0.3808 loss 0.2861 | val AP 0.4227 | best 0.4227
  [trial 19] epoch 04 92.4s (bs=32) | train AP 0.4035 loss 0.2766 | val AP 0.4404 | best 0.4404
  [trial 19] epoch 05 94.4s (bs=32) | train AP 0.4198 loss 0.2704 | val AP 0.4562 | best 0.4562
  [trial 19] epoch 06 92.6s (bs=32) | train AP 0.4408 loss 0.2618 | val AP 0.4831 | best 0.4831
  [trial 19] epoch 07 94.9s (bs=32) | train AP 0.4680 loss 0.2526 | val AP 0.4925 | best 0.4925
  [trial 19] epoch 08 94.4s (bs=32) | train AP 0.4806 loss 0.2473 | val AP 0.5128 | best 0.5128
  [trial 19] epoch 09 94.7s (bs=32) | train AP 0.5120 loss 0.2384 | val AP 0.5158 | best 0.5158
  [trial 19] epoch 10 93.1s (bs=32) | train AP 0.5269 loss 0.2312 | val AP 0.5315 | best 0.5315
  [trial 19] epoch 11 93.7s (bs=32) | train AP 0.5405 loss 0.2249 | val AP 0.5464 | best 0.5464
  [trial 19] epoch 12 95.1s (bs=32) | train AP 0.5690 loss 0.2156 | val AP 0.5586 | best 0.5586
  [trial 19] epoch 13 92.4s (bs=32) | train AP 0.5840 loss 0.2106 | val AP 0.5696 | best 0.5696
  [trial 19] epoch 14 94.0s (bs=32) | train AP 0.5999 loss 0.2034 | val AP 0.5697 | best 0.5697
  [trial 19] epoch 15 92.8s (bs=32) | train AP 0.6132 loss 0.1990 | val AP 0.5800 | best 0.5800
  [trial 19] epoch 16 93.8s (bs=32) | train AP 0.6286 loss 0.1945 | val AP 0.5755 | best 0.5800
  [trial 19] epoch 17 93.6s (bs=32) | train AP 0.6318 loss 0.1920 | val AP 0.5760 | best 0.5800
  [trial 19] epoch 18 91.5s (bs=32) | train AP 0.6393 loss 0.1893 | val AP 0.5764 | best 0.5800
  [trial 19] epoch 19 94.2s (bs=32) | train AP 0.6457 loss 0.1869 | val AP 0.5778 | best 0.5800
[I 2026-05-13 09:14:41,383] Trial 19 finished with value: 0.5800440030516101 and parameters: {'hidden_dim': 384, 'num_heads': 32, 'ffn_ratio': 4, 'num_layers': 3, 'dropout': 0.25, 'hop_mode': 'window', 'hop_window': 1, 'num_global_heads': 3, 'graph_pool': 'mean', 'lr': 0.00042342248525042595, 'weight_decay': 0.004845535518958415}. Best is trial 14 with value: 0.5985720260041724.
  [trial 20] epoch 00 113.6s (bs=32) | train AP 0.2078 loss 0.3736 | val AP 0.3253 | best 0.3253
  [trial 20] epoch 01 114.0s (bs=32) | train AP 0.3218 loss 0.3100 | val AP 0.3815 | best 0.3815
  [trial 20] epoch 02 113.8s (bs=32) | train AP 0.3669 loss 0.2913 | val AP 0.3973 | best 0.3973
  [trial 20] epoch 03 112.7s (bs=32) | train AP 0.3904 loss 0.2810 | val AP 0.4145 | best 0.4145
  [trial 20] epoch 04 114.2s (bs=32) | train AP 0.4159 loss 0.2718 | val AP 0.4354 | best 0.4354
  [trial 20] epoch 05 114.3s (bs=32) | train AP 0.4401 loss 0.2617 | val AP 0.4642 | best 0.4642
  [trial 20] epoch 06 113.9s (bs=32) | train AP 0.4662 loss 0.2540 | val AP 0.4587 | best 0.4642
  [trial 20] epoch 07 115.1s (bs=32) | train AP 0.4724 loss 0.2509 | val AP 0.4874 | best 0.4874
  [trial 20] epoch 08 115.0s (bs=32) | train AP 0.4985 loss 0.2396 | val AP 0.5113 | best 0.5113
  [trial 20] epoch 09 113.3s (bs=32) | train AP 0.5335 loss 0.2261 | val AP 0.5384 | best 0.5384
  [trial 20] epoch 10 113.2s (bs=32) | train AP 0.5604 loss 0.2166 | val AP 0.5555 | best 0.5555
  [trial 20] epoch 11 113.7s (bs=32) | train AP 0.5943 loss 0.2039 | val AP 0.5780 | best 0.5780
  [trial 20] epoch 12 112.3s (bs=32) | train AP 0.6292 loss 0.1908 | val AP 0.5906 | best 0.5906
  [trial 20] epoch 13 112.7s (bs=32) | train AP 0.6635 loss 0.1781 | val AP 0.5878 | best 0.5906
  [trial 20] epoch 14 115.5s (bs=32) | train AP 0.6996 loss 0.1662 | val AP 0.5957 | best 0.5957
  [trial 20] epoch 15 114.4s (bs=32) | train AP 0.7238 loss 0.1553 | val AP 0.6064 | best 0.6064
  [trial 20] epoch 16 115.7s (bs=32) | train AP 0.7480 loss 0.1463 | val AP 0.6093 | best 0.6093
  [trial 20] epoch 17 114.7s (bs=32) | train AP 0.7626 loss 0.1388 | val AP 0.6115 | best 0.6115
  [trial 20] epoch 18 113.4s (bs=32) | train AP 0.7760 loss 0.1348 | val AP 0.6120 | best 0.6120
  [trial 20] epoch 19 114.9s (bs=32) | train AP 0.7832 loss 0.1324 | val AP 0.6121 | best 0.6121
[I 2026-05-13 09:52:44,123] Trial 20 finished with value: 0.6121116060834857 and parameters: {'hidden_dim': 384, 'num_heads': 32, 'ffn_ratio': 4, 'num_layers': 5, 'dropout': 0.1, 'hop_mode': 'window', 'hop_window': 2, 'num_global_heads': 1, 'graph_pool': 'sum', 'lr': 0.0004107382016293528, 'weight_decay': 0.0007794438764598863}. Best is trial 20 with value: 0.6121116060834857.
  [trial 21] Model build failed: hidden_dim=512 must be divisible by num_heads=40
  [trial 21] params: {'hidden_dim': 512, 'num_heads': 40, 'ffn_ratio': 4, 'num_layers': 5, 'dropout': 0.1, 'hop_mode': 'window', 'hop_window': 2, 'num_global_heads': 1, 'graph_pool': 'sum', 'lr': 0.0006011662187236887, 'weight_decay': 0.000803786408116614}
[I 2026-05-13 09:52:45,165] Trial 21 pruned. 
  [trial 22] epoch 00 115.3s (bs=32) | train AP 0.1965 loss 0.3744 | val AP 0.3005 | best 0.3005
  [trial 22] epoch 01 113.9s (bs=32) | train AP 0.2932 loss 0.3202 | val AP 0.3723 | best 0.3723
  [trial 22] epoch 02 116.0s (bs=32) | train AP 0.3469 loss 0.2985 | val AP 0.3988 | best 0.3988
  [trial 22] epoch 03 119.6s (bs=32) | train AP 0.3799 loss 0.2849 | val AP 0.4298 | best 0.4298
  [trial 22] epoch 04 115.1s (bs=32) | train AP 0.4071 loss 0.2750 | val AP 0.4462 | best 0.4462
  [trial 22] epoch 05 114.2s (bs=32) | train AP 0.4221 loss 0.2693 | val AP 0.4510 | best 0.4510
  [trial 22] epoch 06 115.2s (bs=32) | train AP 0.4498 loss 0.2584 | val AP 0.4649 | best 0.4649
  [trial 22] epoch 07 116.1s (bs=32) | train AP 0.4694 loss 0.2512 | val AP 0.4808 | best 0.4808
  [trial 22] epoch 08 116.4s (bs=32) | train AP 0.4875 loss 0.2430 | val AP 0.4988 | best 0.4988
  [trial 22] epoch 09 118.4s (bs=32) | train AP 0.5185 loss 0.2335 | val AP 0.5182 | best 0.5182
  [trial 22] epoch 10 114.7s (bs=32) | train AP 0.5392 loss 0.2255 | val AP 0.5360 | best 0.5360
  [trial 22] epoch 11 114.5s (bs=32) | train AP 0.5692 loss 0.2155 | val AP 0.5324 | best 0.5360
  [trial 22] epoch 12 113.9s (bs=32) | train AP 0.5898 loss 0.2051 | val AP 0.5654 | best 0.5654
  [trial 22] epoch 13 115.9s (bs=32) | train AP 0.6265 loss 0.1944 | val AP 0.5632 | best 0.5654
  [trial 22] epoch 14 115.7s (bs=32) | train AP 0.6500 loss 0.1846 | val AP 0.5813 | best 0.5813
  [trial 22] epoch 15 115.0s (bs=32) | train AP 0.6801 loss 0.1734 | val AP 0.5801 | best 0.5813
  [trial 22] epoch 16 117.1s (bs=32) | train AP 0.7044 loss 0.1656 | val AP 0.5885 | best 0.5885
  [trial 22] epoch 17 116.4s (bs=32) | train AP 0.7163 loss 0.1601 | val AP 0.5917 | best 0.5917
  [trial 22] epoch 18 115.5s (bs=32) | train AP 0.7272 loss 0.1557 | val AP 0.5912 | best 0.5917
  [trial 22] epoch 19 115.5s (bs=32) | train AP 0.7306 loss 0.1539 | val AP 0.5917 | best 0.5917
[I 2026-05-13 10:31:21,827] Trial 22 finished with value: 0.5917346494421318 and parameters: {'hidden_dim': 384, 'num_heads': 32, 'ffn_ratio': 4, 'num_layers': 5, 'dropout': 0.15000000000000002, 'hop_mode': 'window', 'hop_window': 3, 'num_global_heads': 1, 'graph_pool': 'sum', 'lr': 0.00041329861643648957, 'weight_decay': 0.0030659149204407946}. Best is trial 20 with value: 0.6121116060834857.
  [trial 23] epoch 00 118.5s (bs=32) | train AP 0.2077 loss 0.3712 | val AP 0.3099 | best 0.3099
  [trial 23] epoch 01 115.3s (bs=32) | train AP 0.3146 loss 0.3111 | val AP 0.3673 | best 0.3673
  [trial 23] epoch 02 118.1s (bs=32) | train AP 0.3614 loss 0.2938 | val AP 0.3767 | best 0.3767
  [trial 23] epoch 03 115.6s (bs=32) | train AP 0.3775 loss 0.2873 | val AP 0.4082 | best 0.4082
  [trial 23] epoch 04 113.2s (bs=32) | train AP 0.4024 loss 0.2783 | val AP 0.4155 | best 0.4155
  [trial 23] epoch 05 115.1s (bs=32) | train AP 0.4143 loss 0.2728 | val AP 0.4445 | best 0.4445
  [trial 23] epoch 06 116.8s (bs=32) | train AP 0.4347 loss 0.2641 | val AP 0.4643 | best 0.4643
  [trial 23] epoch 07 116.4s (bs=32) | train AP 0.4547 loss 0.2574 | val AP 0.4654 | best 0.4654
  [trial 23] epoch 08 115.9s (bs=32) | train AP 0.4840 loss 0.2483 | val AP 0.4965 | best 0.4965
  [trial 23] epoch 09 115.3s (bs=32) | train AP 0.5167 loss 0.2355 | val AP 0.5173 | best 0.5173
  [trial 23] epoch 10 115.0s (bs=32) | train AP 0.5511 loss 0.2245 | val AP 0.5354 | best 0.5354
  [trial 23] epoch 11 115.4s (bs=32) | train AP 0.5881 loss 0.2101 | val AP 0.5414 | best 0.5414
  [trial 23] epoch 12 115.5s (bs=32) | train AP 0.6186 loss 0.1976 | val AP 0.5578 | best 0.5578
  [trial 23] epoch 13 115.4s (bs=32) | train AP 0.6565 loss 0.1835 | val AP 0.5621 | best 0.5621
  [trial 23] epoch 14 114.4s (bs=32) | train AP 0.6958 loss 0.1694 | val AP 0.5676 | best 0.5676
  [trial 23] epoch 15 114.7s (bs=32) | train AP 0.7342 loss 0.1551 | val AP 0.5809 | best 0.5809
  [trial 23] epoch 16 115.7s (bs=32) | train AP 0.7590 loss 0.1452 | val AP 0.5825 | best 0.5825
  [trial 23] epoch 17 116.7s (bs=32) | train AP 0.7752 loss 0.1378 | val AP 0.5826 | best 0.5826
  [trial 23] epoch 18 114.2s (bs=32) | train AP 0.7904 loss 0.1332 | val AP 0.5833 | best 0.5833
  [trial 23] epoch 19 117.9s (bs=32) | train AP 0.7911 loss 0.1308 | val AP 0.5833 | best 0.5833
[I 2026-05-13 11:09:59,340] Trial 23 finished with value: 0.58326741134009 and parameters: {'hidden_dim': 384, 'num_heads': 32, 'ffn_ratio': 4, 'num_layers': 5, 'dropout': 0.1, 'hop_mode': 'window', 'hop_window': 3, 'num_global_heads': 1, 'graph_pool': 'sum', 'lr': 0.0004344990503484184, 'weight_decay': 0.0012449844942935872}. Best is trial 20 with value: 0.6121116060834857.
  [trial 24] epoch 00 113.1s (bs=32) | train AP 0.2008 loss 0.3794 | val AP 0.2927 | best 0.2927
  [trial 24] epoch 01 115.5s (bs=32) | train AP 0.3030 loss 0.3153 | val AP 0.3742 | best 0.3742
  [trial 24] epoch 02 114.0s (bs=32) | train AP 0.3476 loss 0.2973 | val AP 0.4002 | best 0.4002
  [trial 24] epoch 03 114.2s (bs=32) | train AP 0.3771 loss 0.2854 | val AP 0.4065 | best 0.4065
  [trial 24] epoch 04 115.8s (bs=32) | train AP 0.4078 loss 0.2759 | val AP 0.4389 | best 0.4389
  [trial 24] epoch 05 114.9s (bs=32) | train AP 0.4184 loss 0.2693 | val AP 0.4471 | best 0.4471
  [trial 24] epoch 06 113.8s (bs=32) | train AP 0.4336 loss 0.2649 | val AP 0.4740 | best 0.4740
  [trial 24] epoch 07 116.5s (bs=32) | train AP 0.4613 loss 0.2538 | val AP 0.4890 | best 0.4890
  [trial 24] epoch 08 115.1s (bs=32) | train AP 0.4797 loss 0.2485 | val AP 0.5121 | best 0.5121
  [trial 24] epoch 09 115.3s (bs=32) | train AP 0.5062 loss 0.2383 | val AP 0.5113 | best 0.5121
  [trial 24] epoch 10 114.1s (bs=32) | train AP 0.5319 loss 0.2289 | val AP 0.5395 | best 0.5395
  [trial 24] epoch 11 114.6s (bs=32) | train AP 0.5565 loss 0.2215 | val AP 0.5470 | best 0.5470
  [trial 24] epoch 12 114.8s (bs=32) | train AP 0.5794 loss 0.2113 | val AP 0.5523 | best 0.5523
  [trial 24] epoch 13 115.2s (bs=32) | train AP 0.6058 loss 0.2034 | val AP 0.5584 | best 0.5584
  [trial 24] epoch 14 114.2s (bs=32) | train AP 0.6286 loss 0.1955 | val AP 0.5721 | best 0.5721
  [trial 24] epoch 15 114.2s (bs=32) | train AP 0.6471 loss 0.1877 | val AP 0.5794 | best 0.5794
  [trial 24] epoch 16 115.4s (bs=32) | train AP 0.6698 loss 0.1803 | val AP 0.5781 | best 0.5794
  [trial 24] epoch 17 115.0s (bs=32) | train AP 0.6830 loss 0.1748 | val AP 0.5790 | best 0.5794
  [trial 24] epoch 18 112.8s (bs=32) | train AP 0.6919 loss 0.1717 | val AP 0.5820 | best 0.5820
  [trial 24] epoch 19 113.3s (bs=32) | train AP 0.6976 loss 0.1700 | val AP 0.5824 | best 0.5824
