[I 2026-05-13 05:06:17,768] Trial 20 pruned. 
  [trial 21] epoch 00 56.8s (bs=32) | train MAE 0.4958 loss 0.4957 | val MAE 0.4002 | best 0.4002
  [trial 21] epoch 01 56.3s (bs=32) | train MAE 0.3740 loss 0.3739 | val MAE 0.3087 | best 0.3087
  [trial 21] epoch 02 56.5s (bs=32) | train MAE 0.3427 loss 0.3426 | val MAE 0.3308 | best 0.3087
  [trial 21] epoch 03 57.2s (bs=32) | train MAE 0.3283 loss 0.3282 | val MAE 0.3097 | best 0.3087
  [trial 21] epoch 04 56.5s (bs=32) | train MAE 0.3231 loss 0.3232 | val MAE 0.2966 | best 0.2966
  [trial 21] epoch 05 56.9s (bs=32) | train MAE 0.3179 loss 0.3178 | val MAE 0.2915 | best 0.2915
  [trial 21] epoch 06 57.2s (bs=32) | train MAE 0.3126 loss 0.3126 | val MAE 0.3001 | best 0.2915
  [trial 21] epoch 07 57.3s (bs=32) | train MAE 0.3086 loss 0.3086 | val MAE 0.3130 | best 0.2915
  [trial 21] epoch 08 56.5s (bs=32) | train MAE 0.3102 loss 0.3101 | val MAE 0.2981 | best 0.2915
  [trial 21] epoch 09 56.4s (bs=32) | train MAE 0.3023 loss 0.3023 | val MAE 0.3144 | best 0.2915
  [trial 21] epoch 10 57.3s (bs=32) | train MAE 0.3029 loss 0.3030 | val MAE 0.2961 | best 0.2915
  [trial 21] epoch 11 57.4s (bs=32) | train MAE 0.2966 loss 0.2966 | val MAE 0.2949 | best 0.2915
  [trial 21] epoch 12 57.9s (bs=32) | train MAE 0.2923 loss 0.2922 | val MAE 0.2976 | best 0.2915
  [trial 21] epoch 13 58.1s (bs=32) | train MAE 0.2928 loss 0.2928 | val MAE 0.2901 | best 0.2901
  [trial 21] epoch 14 56.7s (bs=32) | train MAE 0.2869 loss 0.2869 | val MAE 0.2849 | best 0.2849
  [trial 21] epoch 15 56.6s (bs=32) | train MAE 0.2862 loss 0.2861 | val MAE 0.2818 | best 0.2818
  [trial 21] epoch 16 55.7s (bs=32) | train MAE 0.2827 loss 0.2828 | val MAE 0.2753 | best 0.2753
  [trial 21] epoch 17 56.6s (bs=32) | train MAE 0.2813 loss 0.2813 | val MAE 0.2800 | best 0.2753
  [trial 21] epoch 18 56.8s (bs=32) | train MAE 0.2803 loss 0.2803 | val MAE 0.2801 | best 0.2753
  [trial 21] epoch 19 56.8s (bs=32) | train MAE 0.2790 loss 0.2791 | val MAE 0.2802 | best 0.2753
                                                                                         Best trial: 9. Best value: 0.268863:  42%|████▏     | 21/50 [4:19:21<4:58:13, 617.02s/it]Best trial: 9. Best value: 0.268863:  42%|████▏     | 21/50 [4:19:21<4:58:13, 617.02s/it]Best trial: 9. Best value: 0.268863:  44%|████▍     | 22/50 [4:19:21<6:01:26, 774.53s/it][I 2026-05-13 05:25:19,633] Trial 21 finished with value: 0.275347804991039 and parameters: {'hidden_dim': 640, 'num_heads': 40, 'ffn_ratio': 2, 'num_layers': 3, 'dropout': 0.4, 'hop_mode': 'contiguous', 'hop_window': 3, 'num_global_heads': 2, 'graph_pool': 'mean', 'lr': 0.000401116682107184, 'weight_decay': 0.0001295112642544953}. Best is trial 9 with value: 0.2688628450970329.
  [trial 22] epoch 00 56.1s (bs=32) | train MAE 0.4907 loss 0.4906 | val MAE 0.3973 | best 0.3973
  [trial 22] epoch 01 56.3s (bs=32) | train MAE 0.3583 loss 0.3583 | val MAE 0.3277 | best 0.3277
  [trial 22] epoch 02 56.6s (bs=32) | train MAE 0.3381 loss 0.3380 | val MAE 0.3182 | best 0.3182
  [trial 22] epoch 03 57.1s (bs=32) | train MAE 0.3291 loss 0.3290 | val MAE 0.3002 | best 0.3002
  [trial 22] epoch 04 57.0s (bs=32) | train MAE 0.3207 loss 0.3208 | val MAE 0.2946 | best 0.2946
  [trial 22] epoch 05 57.4s (bs=32) | train MAE 0.3216 loss 0.3218 | val MAE 0.3158 | best 0.2946
  [trial 22] epoch 06 57.0s (bs=32) | train MAE 0.3212 loss 0.3212 | val MAE 0.2980 | best 0.2946
  [trial 22] epoch 07 56.6s (bs=32) | train MAE 0.3083 loss 0.3084 | val MAE 0.2906 | best 0.2906
  [trial 22] epoch 08 57.0s (bs=32) | train MAE 0.3062 loss 0.3062 | val MAE 0.3072 | best 0.2906
  [trial 22] epoch 09 57.7s (bs=32) | train MAE 0.3014 loss 0.3014 | val MAE 0.2826 | best 0.2826
  [trial 22] epoch 10 57.1s (bs=32) | train MAE 0.2992 loss 0.2992 | val MAE 0.2889 | best 0.2826
  [trial 22] epoch 11 58.2s (bs=32) | train MAE 0.2958 loss 0.2958 | val MAE 0.2944 | best 0.2826
  [trial 22] epoch 12 55.7s (bs=32) | train MAE 0.2914 loss 0.2915 | val MAE 0.2901 | best 0.2826
  [trial 22] epoch 13 56.4s (bs=32) | train MAE 0.2874 loss 0.2874 | val MAE 0.2847 | best 0.2826
  [trial 22] epoch 14 55.5s (bs=32) | train MAE 0.2846 loss 0.2846 | val MAE 0.2768 | best 0.2768
  [trial 22] epoch 15 57.7s (bs=32) | train MAE 0.2834 loss 0.2834 | val MAE 0.2817 | best 0.2768
  [trial 22] epoch 16 56.7s (bs=32) | train MAE 0.2809 loss 0.2810 | val MAE 0.2768 | best 0.2768
  [trial 22] epoch 17 56.9s (bs=32) | train MAE 0.2788 loss 0.2788 | val MAE 0.2769 | best 0.2768
  [trial 22] epoch 18 57.5s (bs=32) | train MAE 0.2774 loss 0.2774 | val MAE 0.2754 | best 0.2754
  [trial 22] epoch 19 58.1s (bs=32) | train MAE 0.2766 loss 0.2766 | val MAE 0.2766 | best 0.2754
                                                                                         Best trial: 9. Best value: 0.268863:  44%|████▍     | 22/50 [4:38:25<6:01:26, 774.53s/it]Best trial: 9. Best value: 0.268863:  44%|████▍     | 22/50 [4:38:25<6:01:26, 774.53s/it]Best trial: 9. Best value: 0.268863:  46%|████▌     | 23/50 [4:38:25<6:38:20, 885.21s/it][I 2026-05-13 05:44:22,998] Trial 22 finished with value: 0.27543801483334923 and parameters: {'hidden_dim': 640, 'num_heads': 40, 'ffn_ratio': 2, 'num_layers': 3, 'dropout': 0.35000000000000003, 'hop_mode': 'contiguous', 'hop_window': 2, 'num_global_heads': 2, 'graph_pool': 'mean', 'lr': 0.0005582818403402675, 'weight_decay': 0.00022872437042124134}. Best is trial 9 with value: 0.2688628450970329.
  [trial 23] epoch 00 47.5s (bs=32) | train MAE 0.4813 loss 0.4813 | val MAE 0.3757 | best 0.3757
  [trial 23] epoch 01 46.3s (bs=32) | train MAE 0.3714 loss 0.3713 | val MAE 0.3274 | best 0.3274
  [trial 23] epoch 02 46.1s (bs=32) | train MAE 0.3535 loss 0.3535 | val MAE 0.3226 | best 0.3226
  [trial 23] epoch 03 46.2s (bs=32) | train MAE 0.3414 loss 0.3414 | val MAE 0.3571 | best 0.3226
  [trial 23] epoch 04 46.2s (bs=32) | train MAE 0.3466 loss 0.3466 | val MAE 0.3178 | best 0.3178
  [trial 23] epoch 05 46.6s (bs=32) | train MAE 0.3351 loss 0.3352 | val MAE 0.3170 | best 0.3170
  [trial 23] epoch 06 46.7s (bs=32) | train MAE 0.3343 loss 0.3343 | val MAE 0.3372 | best 0.3170
                                                                                         Best trial: 9. Best value: 0.268863:  46%|████▌     | 23/50 [4:43:53<6:38:20, 885.21s/it]Best trial: 9. Best value: 0.268863:  46%|████▌     | 23/50 [4:43:53<6:38:20, 885.21s/it]Best trial: 9. Best value: 0.268863:  48%|████▊     | 24/50 [4:43:53<5:11:08, 718.02s/it]  [trial 23] PRUNED at epoch 6
[I 2026-05-13 05:49:51,013] Trial 23 pruned. 
  [trial 24] epoch 00 56.8s (bs=32) | train MAE 0.4913 loss 0.4912 | val MAE 0.3944 | best 0.3944
  [trial 24] epoch 01 56.0s (bs=32) | train MAE 0.3765 loss 0.3765 | val MAE 0.3886 | best 0.3886
  [trial 24] epoch 02 58.5s (bs=32) | train MAE 0.3462 loss 0.3461 | val MAE 0.3500 | best 0.3500
  [trial 24] epoch 03 56.7s (bs=32) | train MAE 0.3355 loss 0.3355 | val MAE 0.3142 | best 0.3142
  [trial 24] epoch 04 56.9s (bs=32) | train MAE 0.3246 loss 0.3246 | val MAE 0.3083 | best 0.3083
  [trial 24] epoch 05 56.7s (bs=32) | train MAE 0.3189 loss 0.3190 | val MAE 0.3041 | best 0.3041
  [trial 24] epoch 06 56.8s (bs=32) | train MAE 0.3150 loss 0.3150 | val MAE 0.3070 | best 0.3041
  [trial 24] epoch 07 58.0s (bs=32) | train MAE 0.3131 loss 0.3130 | val MAE 0.3158 | best 0.3041
  [trial 24] epoch 08 56.3s (bs=32) | train MAE 0.3051 loss 0.3051 | val MAE 0.2939 | best 0.2939
  [trial 24] epoch 09 57.1s (bs=32) | train MAE 0.3011 loss 0.3011 | val MAE 0.2859 | best 0.2859
  [trial 24] epoch 10 56.6s (bs=32) | train MAE 0.3008 loss 0.3008 | val MAE 0.2828 | best 0.2828
  [trial 24] epoch 11 57.5s (bs=32) | train MAE 0.2976 loss 0.2975 | val MAE 0.2910 | best 0.2828
  [trial 24] epoch 12 57.6s (bs=32) | train MAE 0.2931 loss 0.2931 | val MAE 0.2813 | best 0.2813
  [trial 24] epoch 13 57.2s (bs=32) | train MAE 0.2892 loss 0.2892 | val MAE 0.2865 | best 0.2813
  [trial 24] epoch 14 57.3s (bs=32) | train MAE 0.2872 loss 0.2873 | val MAE 0.2760 | best 0.2760
  [trial 24] epoch 15 56.9s (bs=32) | train MAE 0.2852 loss 0.2852 | val MAE 0.2807 | best 0.2760
  [trial 24] epoch 16 56.5s (bs=32) | train MAE 0.2834 loss 0.2834 | val MAE 0.2790 | best 0.2760
  [trial 24] epoch 17 56.6s (bs=32) | train MAE 0.2810 loss 0.2809 | val MAE 0.2804 | best 0.2760
  [trial 24] epoch 18 57.5s (bs=32) | train MAE 0.2813 loss 0.2814 | val MAE 0.2781 | best 0.2760
  [trial 24] epoch 19 57.3s (bs=32) | train MAE 0.2791 loss 0.2791 | val MAE 0.2779 | best 0.2760
                                                                                         Best trial: 9. Best value: 0.268863:  48%|████▊     | 24/50 [5:02:58<5:11:08, 718.02s/it]Best trial: 9. Best value: 0.268863:  48%|████▊     | 24/50 [5:02:58<5:11:08, 718.02s/it]Best trial: 9. Best value: 0.268863:  50%|█████     | 25/50 [5:02:58<5:52:35, 846.24s/it]                                                                                         Best trial: 9. Best value: 0.268863:  50%|█████     | 25/50 [5:03:00<5:52:35, 846.24s/it]Best trial: 9. Best value: 0.268863:  50%|█████     | 25/50 [5:03:00<5:52:35, 846.24s/it]Best trial: 9. Best value: 0.268863:  52%|█████▏    | 26/50 [5:03:00<3:57:06, 592.77s/it]                                                                                         Best trial: 9. Best value: 0.268863:  52%|█████▏    | 26/50 [5:03:01<3:57:06, 592.77s/it]Best trial: 9. Best value: 0.268863:  52%|█████▏    | 26/50 [5:03:01<3:57:06, 592.77s/it]Best trial: 9. Best value: 0.268863:  54%|█████▍    | 27/50 [5:03:01<2:39:12, 415.32s/it]                                                                                         Best trial: 9. Best value: 0.268863:  54%|█████▍    | 27/50 [5:03:02<2:39:12, 415.32s/it]Best trial: 9. Best value: 0.268863:  54%|█████▍    | 27/50 [5:03:02<2:39:12, 415.32s/it]Best trial: 9. Best value: 0.268863:  56%|█████▌    | 28/50 [5:03:02<1:46:44, 291.13s/it][I 2026-05-13 06:08:56,370] Trial 24 finished with value: 0.27596097764765454 and parameters: {'hidden_dim': 640, 'num_heads': 40, 'ffn_ratio': 2, 'num_layers': 3, 'dropout': 0.4, 'hop_mode': 'contiguous', 'hop_window': 3, 'num_global_heads': 2, 'graph_pool': 'mean', 'lr': 0.00041044901586358574, 'weight_decay': 2.0639921205495458e-05}. Best is trial 9 with value: 0.2688628450970329.
  [trial 25] Model build failed: hidden_dim=128 must be divisible by num_heads=40
  [trial 25] params: {'hidden_dim': 128, 'num_heads': 40, 'ffn_ratio': 2, 'num_layers': 2, 'dropout': 0.35000000000000003, 'hop_mode': 'contiguous', 'hop_window': 2, 'num_global_heads': 0, 'graph_pool': 'mean', 'lr': 0.0005174838733356421, 'weight_decay': 8.935018145180371e-05}
[I 2026-05-13 06:08:57,802] Trial 25 pruned. 
  [trial 26] Model build failed: hidden_dim=384 must be divisible by num_heads=40
  [trial 26] params: {'hidden_dim': 384, 'num_heads': 40, 'ffn_ratio': 2, 'num_layers': 3, 'dropout': 0.25, 'hop_mode': 'contiguous', 'hop_window': 4, 'num_global_heads': 1, 'graph_pool': 'mean', 'lr': 0.0003501217676875746, 'weight_decay': 0.00016076631684019672}
[I 2026-05-13 06:08:59,093] Trial 26 pruned. 
  [trial 27] Model build failed: hidden_dim=256 must be divisible by num_heads=40
  [trial 27] params: {'hidden_dim': 256, 'num_heads': 40, 'ffn_ratio': 2, 'num_layers': 5, 'dropout': 0.3, 'hop_mode': 'contiguous', 'hop_window': 2, 'num_global_heads': 2, 'graph_pool': 'mean', 'lr': 0.0009781061336720759, 'weight_decay': 0.00041500953111134277}
[I 2026-05-13 06:09:00,486] Trial 27 pruned. 
  [trial 28] epoch 00 40.2s (bs=32) | train MAE 0.5135 loss 0.5134 | val MAE 0.3854 | best 0.3854
  [trial 28] epoch 01 40.8s (bs=32) | train MAE 0.3763 loss 0.3763 | val MAE 0.3706 | best 0.3706
  [trial 28] epoch 02 40.6s (bs=32) | train MAE 0.3634 loss 0.3636 | val MAE 0.3794 | best 0.3706
  [trial 28] epoch 03 40.8s (bs=32) | train MAE 0.3594 loss 0.3593 | val MAE 0.4315 | best 0.3706
  [trial 28] epoch 04 41.2s (bs=32) | train MAE 0.3672 loss 0.3671 | val MAE 0.3799 | best 0.3706
  [trial 28] epoch 05 41.3s (bs=32) | train MAE 0.3595 loss 0.3595 | val MAE 0.3589 | best 0.3589
                                                                                         Best trial: 9. Best value: 0.268863:  56%|█████▌    | 28/50 [5:07:09<1:46:44, 291.13s/it]Best trial: 9. Best value: 0.268863:  56%|█████▌    | 28/50 [5:07:09<1:46:44, 291.13s/it]Best trial: 9. Best value: 0.268863:  58%|█████▊    | 29/50 [5:07:09<1:37:15, 277.90s/it]  [trial 28] PRUNED at epoch 5
[I 2026-05-13 06:13:07,506] Trial 28 pruned. 
  [trial 29] epoch 00 47.8s (bs=32) | train MAE 0.5231 loss 0.5230 | val MAE 0.5094 | best 0.5094
  [trial 29] epoch 01 47.5s (bs=32) | train MAE 0.3860 loss 0.3861 | val MAE 0.3873 | best 0.3873
  [trial 29] epoch 02 48.6s (bs=32) | train MAE 0.3555 loss 0.3555 | val MAE 0.3532 | best 0.3532
  [trial 29] epoch 03 47.5s (bs=32) | train MAE 0.3445 loss 0.3444 | val MAE 0.3734 | best 0.3532
  [trial 29] epoch 04 47.9s (bs=32) | train MAE 0.3367 loss 0.3366 | val MAE 0.3869 | best 0.3532
  [trial 29] epoch 05 47.7s (bs=32) | train MAE 0.3332 loss 0.3332 | val MAE 0.3651 | best 0.3532
                                                                                         Best trial: 9. Best value: 0.268863:  58%|█████▊    | 29/50 [5:11:59<1:37:15, 277.90s/it]Best trial: 9. Best value: 0.268863:  58%|█████▊    | 29/50 [5:11:59<1:37:15, 277.90s/it]Best trial: 9. Best value: 0.268863:  60%|██████    | 30/50 [5:11:59<1:33:46, 281.33s/it]  [trial 29] PRUNED at epoch 5
[I 2026-05-13 06:17:56,843] Trial 29 pruned. 
  [trial 30] epoch 00 52.3s (bs=32) | train MAE 0.4810 loss 0.4809 | val MAE 0.3745 | best 0.3745
  [trial 30] epoch 01 53.0s (bs=32) | train MAE 0.3820 loss 0.3820 | val MAE 0.3312 | best 0.3312
  [trial 30] epoch 02 52.0s (bs=32) | train MAE 0.3605 loss 0.3605 | val MAE 0.3130 | best 0.3130
  [trial 30] epoch 03 52.8s (bs=32) | train MAE 0.3412 loss 0.3412 | val MAE 0.3314 | best 0.3130
  [trial 30] epoch 04 52.2s (bs=32) | train MAE 0.3423 loss 0.3423 | val MAE 0.3191 | best 0.3130
  [trial 30] epoch 05 53.3s (bs=32) | train MAE 0.3290 loss 0.3290 | val MAE 0.3470 | best 0.3130
  [trial 30] epoch 06 52.5s (bs=32) | train MAE 0.3244 loss 0.3243 | val MAE 0.3269 | best 0.3130
                                                                                         Best trial: 9. Best value: 0.268863:  60%|██████    | 30/50 [5:18:09<1:33:46, 281.33s/it]Best trial: 9. Best value: 0.268863:  60%|██████    | 30/50 [5:18:09<1:33:46, 281.33s/it]Best trial: 9. Best value: 0.268863:  62%|██████▏   | 31/50 [5:18:09<1:37:33, 308.10s/it]  [trial 30] PRUNED at epoch 6
[I 2026-05-13 06:24:07,413] Trial 30 pruned. 
  [trial 31] epoch 00 56.8s (bs=32) | train MAE 0.4903 loss 0.4902 | val MAE 0.4139 | best 0.4139
  [trial 31] epoch 01 57.1s (bs=32) | train MAE 0.3848 loss 0.3847 | val MAE 0.3394 | best 0.3394
  [trial 31] epoch 02 57.1s (bs=32) | train MAE 0.3447 loss 0.3447 | val MAE 0.3324 | best 0.3324
  [trial 31] epoch 03 56.4s (bs=32) | train MAE 0.3303 loss 0.3303 | val MAE 0.3073 | best 0.3073
  [trial 31] epoch 04 56.7s (bs=32) | train MAE 0.3267 loss 0.3267 | val MAE 0.3153 | best 0.3073
  [trial 31] epoch 05 57.2s (bs=32) | train MAE 0.3251 loss 0.3252 | val MAE 0.3181 | best 0.3073
  [trial 31] epoch 06 57.1s (bs=32) | train MAE 0.3167 loss 0.3167 | val MAE 0.3003 | best 0.3003
  [trial 31] epoch 07 57.0s (bs=32) | train MAE 0.3128 loss 0.3128 | val MAE 0.3206 | best 0.3003
  [trial 31] epoch 08 56.8s (bs=32) | train MAE 0.3106 loss 0.3105 | val MAE 0.2984 | best 0.2984
  [trial 31] epoch 09 56.6s (bs=32) | train MAE 0.3052 loss 0.3053 | val MAE 0.2838 | best 0.2838
  [trial 31] epoch 10 58.2s (bs=32) | train MAE 0.2995 loss 0.2994 | val MAE 0.2925 | best 0.2838
  [trial 31] epoch 11 56.8s (bs=32) | train MAE 0.2971 loss 0.2972 | val MAE 0.2858 | best 0.2838
  [trial 31] epoch 12 57.8s (bs=32) | train MAE 0.2918 loss 0.2918 | val MAE 0.2854 | best 0.2838
  [trial 31] epoch 13 57.2s (bs=32) | train MAE 0.2904 loss 0.2904 | val MAE 0.2835 | best 0.2835
  [trial 31] epoch 14 56.8s (bs=32) | train MAE 0.2859 loss 0.2859 | val MAE 0.2879 | best 0.2835
  [trial 31] epoch 15 56.5s (bs=32) | train MAE 0.2840 loss 0.2841 | val MAE 0.2969 | best 0.2835
  [trial 31] epoch 16 56.2s (bs=32) | train MAE 0.2826 loss 0.2826 | val MAE 0.2792 | best 0.2792
  [trial 31] epoch 17 56.2s (bs=32) | train MAE 0.2793 loss 0.2792 | val MAE 0.2811 | best 0.2792
  [trial 31] epoch 18 55.6s (bs=32) | train MAE 0.2806 loss 0.2806 | val MAE 0.2819 | best 0.2792
  [trial 31] epoch 19 57.1s (bs=32) | train MAE 0.2786 loss 0.2785 | val MAE 0.2805 | best 0.2792
                                                                                         Best trial: 9. Best value: 0.268863:  62%|██████▏   | 31/50 [5:37:11<1:37:33, 308.10s/it]Best trial: 9. Best value: 0.268863:  62%|██████▏   | 31/50 [5:37:11<1:37:33, 308.10s/it]Best trial: 9. Best value: 0.268863:  64%|██████▍   | 32/50 [5:37:11<2:47:26, 558.13s/it][I 2026-05-13 06:43:08,929] Trial 31 finished with value: 0.2792372981245375 and parameters: {'hidden_dim': 640, 'num_heads': 40, 'ffn_ratio': 2, 'num_layers': 3, 'dropout': 0.4, 'hop_mode': 'contiguous', 'hop_window': 3, 'num_global_heads': 2, 'graph_pool': 'mean', 'lr': 0.0003787146148087669, 'weight_decay': 0.00015288090747433758}. Best is trial 9 with value: 0.2688628450970329.
  [trial 32] epoch 00 57.5s (bs=32) | train MAE 0.4954 loss 0.4953 | val MAE 0.3716 | best 0.3716
  [trial 32] epoch 01 58.0s (bs=32) | train MAE 0.3732 loss 0.3731 | val MAE 0.3792 | best 0.3716
  [trial 32] epoch 02 57.4s (bs=32) | train MAE 0.3446 loss 0.3445 | val MAE 0.3125 | best 0.3125
  [trial 32] epoch 03 56.5s (bs=32) | train MAE 0.3327 loss 0.3327 | val MAE 0.3026 | best 0.3026
  [trial 32] epoch 04 56.9s (bs=32) | train MAE 0.3304 loss 0.3303 | val MAE 0.3233 | best 0.3026
  [trial 32] epoch 05 55.6s (bs=32) | train MAE 0.3202 loss 0.3202 | val MAE 0.2938 | best 0.2938
  [trial 32] epoch 06 57.6s (bs=32) | train MAE 0.3153 loss 0.3153 | val MAE 0.2982 | best 0.2938
  [trial 32] epoch 07 57.4s (bs=32) | train MAE 0.3131 loss 0.3131 | val MAE 0.2982 | best 0.2938
  [trial 32] epoch 08 57.2s (bs=32) | train MAE 0.3083 loss 0.3083 | val MAE 0.3328 | best 0.2938
  [trial 32] epoch 09 57.1s (bs=32) | train MAE 0.3085 loss 0.3085 | val MAE 0.2991 | best 0.2938
  [trial 32] epoch 10 57.1s (bs=32) | train MAE 0.3018 loss 0.3018 | val MAE 0.3086 | best 0.2938
  [trial 32] epoch 11 56.8s (bs=32) | train MAE 0.2980 loss 0.2981 | val MAE 0.2863 | best 0.2863
  [trial 32] epoch 12 54.9s (bs=32) | train MAE 0.2979 loss 0.2979 | val MAE 0.2853 | best 0.2853
  [trial 32] epoch 13 57.2s (bs=32) | train MAE 0.2922 loss 0.2921 | val MAE 0.2785 | best 0.2785
  [trial 32] epoch 14 56.5s (bs=32) | train MAE 0.2892 loss 0.2891 | val MAE 0.2875 | best 0.2785
  [trial 32] epoch 15 57.0s (bs=32) | train MAE 0.2857 loss 0.2856 | val MAE 0.2848 | best 0.2785
  [trial 32] epoch 16 57.1s (bs=32) | train MAE 0.2853 loss 0.2854 | val MAE 0.2828 | best 0.2785
  [trial 32] epoch 17 56.9s (bs=32) | train MAE 0.2841 loss 0.2840 | val MAE 0.2807 | best 0.2785
  [trial 32] epoch 18 56.5s (bs=32) | train MAE 0.2820 loss 0.2820 | val MAE 0.2801 | best 0.2785
  [trial 32] epoch 19 56.7s (bs=32) | train MAE 0.2824 loss 0.2825 | val MAE 0.2818 | best 0.2785
