                                                                                        Best trial: 0. Best value: 0.282206:  18%|█▊        | 9/50 [1:53:40<4:33:38, 400.44s/it]Best trial: 9. Best value: 0.268863:  18%|█▊        | 9/50 [1:53:40<4:33:38, 400.44s/it]Best trial: 9. Best value: 0.268863:  20%|██        | 10/50 [1:53:40<6:47:16, 610.92s/it][I 2026-05-13 02:59:37,973] Trial 9 finished with value: 0.2688628450970329 and parameters: {'hidden_dim': 640, 'num_heads': 20, 'ffn_ratio': 2, 'num_layers': 2, 'dropout': 0.1, 'hop_mode': 'contiguous', 'hop_window': 2, 'num_global_heads': 2, 'graph_pool': 'mean', 'lr': 0.0005685255159708854, 'weight_decay': 0.0005759079044844154}. Best is trial 9 with value: 0.2688628450970329.
  [trial 10] epoch 00 53.2s (bs=32) | train MAE 0.4749 loss 0.4748 | val MAE 0.4656 | best 0.4656
  [trial 10] epoch 01 52.2s (bs=32) | train MAE 0.3772 loss 0.3771 | val MAE 0.3327 | best 0.3327
  [trial 10] epoch 02 52.2s (bs=32) | train MAE 0.3749 loss 0.3749 | val MAE 0.3522 | best 0.3327
  [trial 10] epoch 03 52.1s (bs=32) | train MAE 0.3566 loss 0.3566 | val MAE 0.3241 | best 0.3241
  [trial 10] epoch 04 52.7s (bs=32) | train MAE 0.3477 loss 0.3476 | val MAE 0.3086 | best 0.3086
  [trial 10] epoch 05 52.2s (bs=32) | train MAE 0.3427 loss 0.3427 | val MAE 0.3153 | best 0.3086
  [trial 10] epoch 06 54.6s (bs=32) | train MAE 0.3316 loss 0.3316 | val MAE 0.3085 | best 0.3085
  [trial 10] epoch 07 51.6s (bs=32) | train MAE 0.3312 loss 0.3312 | val MAE 0.3136 | best 0.3085
  [trial 10] epoch 08 54.1s (bs=32) | train MAE 0.3352 loss 0.3351 | val MAE 0.2981 | best 0.2981
  [trial 10] epoch 09 55.0s (bs=32) | train MAE 0.3319 loss 0.3319 | val MAE 0.3108 | best 0.2981
  [trial 10] epoch 10 51.2s (bs=32) | train MAE 0.3320 loss 0.3319 | val MAE 0.2983 | best 0.2981
  [trial 10] epoch 11 52.5s (bs=32) | train MAE 0.3203 loss 0.3203 | val MAE 0.2928 | best 0.2928
  [trial 10] epoch 12 52.7s (bs=32) | train MAE 0.3155 loss 0.3155 | val MAE 0.2901 | best 0.2901
  [trial 10] epoch 13 53.6s (bs=32) | train MAE 0.3060 loss 0.3060 | val MAE 0.2930 | best 0.2901
  [trial 10] epoch 14 51.9s (bs=32) | train MAE 0.3035 loss 0.3035 | val MAE 0.2896 | best 0.2896
  [trial 10] epoch 15 50.8s (bs=32) | train MAE 0.3008 loss 0.3008 | val MAE 0.2856 | best 0.2856
  [trial 10] epoch 16 53.1s (bs=32) | train MAE 0.2986 loss 0.2986 | val MAE 0.2823 | best 0.2823
  [trial 10] epoch 17 53.6s (bs=32) | train MAE 0.2962 loss 0.2962 | val MAE 0.2815 | best 0.2815
  [trial 10] epoch 18 52.1s (bs=32) | train MAE 0.2950 loss 0.2949 | val MAE 0.2802 | best 0.2802
  [trial 10] epoch 19 52.4s (bs=32) | train MAE 0.2947 loss 0.2947 | val MAE 0.2811 | best 0.2802
                                                                                         Best trial: 9. Best value: 0.268863:  20%|██        | 10/50 [2:11:18<6:47:16, 610.92s/it]Best trial: 9. Best value: 0.268863:  20%|██        | 10/50 [2:11:18<6:47:16, 610.92s/it]Best trial: 9. Best value: 0.268863:  22%|██▏       | 11/50 [2:11:18<8:06:02, 747.75s/it][I 2026-05-13 03:17:15,958] Trial 10 finished with value: 0.28015149560545216 and parameters: {'hidden_dim': 640, 'num_heads': 32, 'ffn_ratio': 2, 'num_layers': 1, 'dropout': 0.2, 'hop_mode': 'contiguous', 'hop_window': 1, 'num_global_heads': 3, 'graph_pool': 'mean', 'lr': 0.0014715487776594352, 'weight_decay': 0.0005862367211399139}. Best is trial 9 with value: 0.2688628450970329.
  [trial 11] epoch 00 53.7s (bs=32) | train MAE 0.4687 loss 0.4687 | val MAE 0.3810 | best 0.3810
  [trial 11] epoch 01 51.7s (bs=32) | train MAE 0.4014 loss 0.4013 | val MAE 0.3351 | best 0.3351
  [trial 11] epoch 02 51.5s (bs=32) | train MAE 0.3665 loss 0.3665 | val MAE 0.3493 | best 0.3351
  [trial 11] epoch 03 51.3s (bs=32) | train MAE 0.3565 loss 0.3566 | val MAE 0.3210 | best 0.3210
  [trial 11] epoch 04 52.0s (bs=32) | train MAE 0.3475 loss 0.3475 | val MAE 0.3235 | best 0.3210
  [trial 11] epoch 05 52.0s (bs=32) | train MAE 0.3540 loss 0.3540 | val MAE 0.3250 | best 0.3210
  [trial 11] epoch 06 50.0s (bs=32) | train MAE 0.3678 loss 0.3678 | val MAE 0.3340 | best 0.3210
  [trial 11] epoch 07 53.2s (bs=32) | train MAE 0.3421 loss 0.3421 | val MAE 0.3123 | best 0.3123
  [trial 11] epoch 08 54.3s (bs=32) | train MAE 0.3385 loss 0.3385 | val MAE 0.3082 | best 0.3082
  [trial 11] epoch 09 51.5s (bs=32) | train MAE 0.3370 loss 0.3370 | val MAE 0.3107 | best 0.3082
  [trial 11] epoch 10 52.3s (bs=32) | train MAE 0.3336 loss 0.3336 | val MAE 0.3024 | best 0.3024
  [trial 11] epoch 11 53.3s (bs=32) | train MAE 0.3238 loss 0.3239 | val MAE 0.3003 | best 0.3003
  [trial 11] epoch 12 55.1s (bs=32) | train MAE 0.3240 loss 0.3240 | val MAE 0.2957 | best 0.2957
  [trial 11] epoch 13 51.0s (bs=32) | train MAE 0.3205 loss 0.3205 | val MAE 0.2982 | best 0.2957
  [trial 11] epoch 14 53.0s (bs=32) | train MAE 0.3146 loss 0.3147 | val MAE 0.2851 | best 0.2851
  [trial 11] epoch 15 53.7s (bs=32) | train MAE 0.3034 loss 0.3034 | val MAE 0.2821 | best 0.2821
  [trial 11] epoch 16 49.8s (bs=32) | train MAE 0.3020 loss 0.3020 | val MAE 0.2820 | best 0.2820
  [trial 11] epoch 17 51.7s (bs=32) | train MAE 0.2998 loss 0.2997 | val MAE 0.2803 | best 0.2803
  [trial 11] epoch 18 52.4s (bs=32) | train MAE 0.2971 loss 0.2970 | val MAE 0.2802 | best 0.2802
  [trial 11] epoch 19 50.9s (bs=32) | train MAE 0.2957 loss 0.2957 | val MAE 0.2803 | best 0.2802
                                                                                         Best trial: 9. Best value: 0.268863:  22%|██▏       | 11/50 [2:28:46<8:06:02, 747.75s/it]Best trial: 9. Best value: 0.268863:  22%|██▏       | 11/50 [2:28:46<8:06:02, 747.75s/it]Best trial: 9. Best value: 0.268863:  24%|██▍       | 12/50 [2:28:46<8:51:30, 839.23s/it][I 2026-05-13 03:34:44,428] Trial 11 finished with value: 0.2802483226880248 and parameters: {'hidden_dim': 640, 'num_heads': 32, 'ffn_ratio': 2, 'num_layers': 1, 'dropout': 0.2, 'hop_mode': 'contiguous', 'hop_window': 1, 'num_global_heads': 3, 'graph_pool': 'mean', 'lr': 0.001536784399631939, 'weight_decay': 0.0005958499782273175}. Best is trial 9 with value: 0.2688628450970329.
  [trial 12] epoch 00 58.6s (bs=32) | train MAE 0.4746 loss 0.4744 | val MAE 0.3642 | best 0.3642
  [trial 12] epoch 01 59.6s (bs=32) | train MAE 0.3759 loss 0.3759 | val MAE 0.3085 | best 0.3085
  [trial 12] epoch 02 59.4s (bs=32) | train MAE 0.3697 loss 0.3697 | val MAE 0.3154 | best 0.3085
  [trial 12] epoch 03 57.9s (bs=32) | train MAE 0.3445 loss 0.3445 | val MAE 0.3181 | best 0.3085
  [trial 12] epoch 04 59.2s (bs=32) | train MAE 0.3376 loss 0.3376 | val MAE 0.3284 | best 0.3085
  [trial 12] epoch 05 59.6s (bs=32) | train MAE 0.3405 loss 0.3405 | val MAE 0.3211 | best 0.3085
  [trial 12] epoch 06 58.2s (bs=32) | train MAE 0.3310 loss 0.3310 | val MAE 0.3264 | best 0.3085
  [trial 12] epoch 07 57.5s (bs=32) | train MAE 0.3297 loss 0.3297 | val MAE 0.3178 | best 0.3085
  [trial 12] epoch 08 59.6s (bs=32) | train MAE 0.3379 loss 0.3378 | val MAE 0.3078 | best 0.3078
  [trial 12] epoch 09 59.2s (bs=32) | train MAE 0.3446 loss 0.3446 | val MAE 0.3625 | best 0.3078
  [trial 12] epoch 10 58.2s (bs=32) | train MAE 0.3563 loss 0.3563 | val MAE 0.3214 | best 0.3078
                                                                                         Best trial: 9. Best value: 0.268863:  24%|██▍       | 12/50 [2:39:36<8:51:30, 839.23s/it]Best trial: 9. Best value: 0.268863:  24%|██▍       | 12/50 [2:39:36<8:51:30, 839.23s/it]Best trial: 9. Best value: 0.268863:  26%|██▌       | 13/50 [2:39:36<8:02:09, 781.88s/it]  [trial 12] PRUNED at epoch 10
[I 2026-05-13 03:45:34,352] Trial 12 pruned. 
  [trial 13] epoch 00 47.2s (bs=32) | train MAE 0.5054 loss 0.5053 | val MAE 0.6353 | best 0.6353
  [trial 13] epoch 01 47.3s (bs=32) | train MAE 0.4936 loss 0.4937 | val MAE 0.6739 | best 0.6353
  [trial 13] epoch 02 46.4s (bs=32) | train MAE 0.4720 loss 0.4721 | val MAE 0.6150 | best 0.6150
  [trial 13] epoch 03 46.6s (bs=32) | train MAE 0.5035 loss 0.5037 | val MAE 0.4984 | best 0.4984
  [trial 13] epoch 04 47.0s (bs=32) | train MAE 0.5250 loss 0.5251 | val MAE 0.5752 | best 0.4984
  [trial 13] epoch 05 46.8s (bs=32) | train MAE 0.5113 loss 0.5114 | val MAE 0.7454 | best 0.4984
                                                                                         Best trial: 9. Best value: 0.268863:  26%|██▌       | 13/50 [2:44:20<8:02:09, 781.88s/it]Best trial: 9. Best value: 0.268863:  26%|██▌       | 13/50 [2:44:20<8:02:09, 781.88s/it]Best trial: 9. Best value: 0.268863:  28%|██▊       | 14/50 [2:44:20<6:18:52, 631.47s/it]  [trial 13] PRUNED at epoch 5
[I 2026-05-13 03:50:18,265] Trial 13 pruned. 
  [trial 14] epoch 00 59.0s (bs=32) | train MAE 0.4587 loss 0.4587 | val MAE 0.3487 | best 0.3487
  [trial 14] epoch 01 58.5s (bs=32) | train MAE 0.3680 loss 0.3681 | val MAE 0.3345 | best 0.3345
  [trial 14] epoch 02 59.9s (bs=32) | train MAE 0.3499 loss 0.3499 | val MAE 0.3223 | best 0.3223
  [trial 14] epoch 03 58.0s (bs=32) | train MAE 0.3435 loss 0.3434 | val MAE 0.3223 | best 0.3223
  [trial 14] epoch 04 60.7s (bs=32) | train MAE 0.3414 loss 0.3414 | val MAE 0.3325 | best 0.3223
  [trial 14] epoch 05 58.7s (bs=32) | train MAE 0.3387 loss 0.3387 | val MAE 0.3057 | best 0.3057
  [trial 14] epoch 06 58.2s (bs=32) | train MAE 0.3362 loss 0.3362 | val MAE 0.3303 | best 0.3057
  [trial 14] epoch 07 59.6s (bs=32) | train MAE 0.3304 loss 0.3305 | val MAE 0.3076 | best 0.3057
  [trial 14] epoch 08 57.5s (bs=32) | train MAE 0.3416 loss 0.3415 | val MAE 0.3140 | best 0.3057
  [trial 14] epoch 09 59.3s (bs=32) | train MAE 0.3329 loss 0.3329 | val MAE 0.3151 | best 0.3057
  [trial 14] epoch 10 61.3s (bs=32) | train MAE 0.3229 loss 0.3229 | val MAE 0.3024 | best 0.3024
  [trial 14] epoch 11 58.3s (bs=32) | train MAE 0.3156 loss 0.3156 | val MAE 0.2962 | best 0.2962
  [trial 14] epoch 12 57.3s (bs=32) | train MAE 0.3084 loss 0.3084 | val MAE 0.2964 | best 0.2962
  [trial 14] epoch 13 61.4s (bs=32) | train MAE 0.3058 loss 0.3059 | val MAE 0.3051 | best 0.2962
  [trial 14] epoch 14 58.5s (bs=32) | train MAE 0.3027 loss 0.3027 | val MAE 0.2853 | best 0.2853
  [trial 14] epoch 15 56.7s (bs=32) | train MAE 0.2993 loss 0.2992 | val MAE 0.2865 | best 0.2853
  [trial 14] epoch 16 59.6s (bs=32) | train MAE 0.2967 loss 0.2967 | val MAE 0.2847 | best 0.2847
                                                                                         Best trial: 9. Best value: 0.268863:  28%|██▊       | 14/50 [3:01:07<6:18:52, 631.47s/it]Best trial: 9. Best value: 0.268863:  28%|██▊       | 14/50 [3:01:07<6:18:52, 631.47s/it]Best trial: 9. Best value: 0.268863:  30%|███       | 15/50 [3:01:07<7:14:18, 744.52s/it]                                                                                         Best trial: 9. Best value: 0.268863:  30%|███       | 15/50 [3:01:08<7:14:18, 744.52s/it]Best trial: 9. Best value: 0.268863:  30%|███       | 15/50 [3:01:08<7:14:18, 744.52s/it]Best trial: 9. Best value: 0.268863:  32%|███▏      | 16/50 [3:01:08<4:55:09, 520.86s/it]  [trial 14] PRUNED at epoch 16
[I 2026-05-13 04:07:04,761] Trial 14 pruned. 
  [trial 15] Model build failed: hidden_dim=384 must be divisible by num_heads=20
  [trial 15] params: {'hidden_dim': 384, 'num_heads': 20, 'ffn_ratio': 2, 'num_layers': 1, 'dropout': 0.25, 'hop_mode': 'contiguous', 'hop_window': 1, 'num_global_heads': 1, 'graph_pool': 'mean', 'lr': 0.0004697582519072122, 'weight_decay': 0.00011771533298183531}
[I 2026-05-13 04:07:06,244] Trial 15 pruned. 
  [trial 16] epoch 00 48.9s (bs=32) | train MAE 0.5901 loss 0.5902 | val MAE 0.5208 | best 0.5208
  [trial 16] epoch 01 47.8s (bs=32) | train MAE 0.5186 loss 0.5185 | val MAE 0.4733 | best 0.4733
  [trial 16] epoch 02 45.4s (bs=32) | train MAE 0.4949 loss 0.4950 | val MAE 0.5100 | best 0.4733
  [trial 16] epoch 03 49.8s (bs=32) | train MAE 0.4943 loss 0.4943 | val MAE 0.4903 | best 0.4733
  [trial 16] epoch 04 48.1s (bs=32) | train MAE 0.4824 loss 0.4824 | val MAE 0.5096 | best 0.4733
  [trial 16] epoch 05 44.8s (bs=32) | train MAE 0.4686 loss 0.4687 | val MAE 0.6368 | best 0.4733
                                                                                         Best trial: 9. Best value: 0.268863:  32%|███▏      | 16/50 [3:05:55<4:55:09, 520.86s/it]Best trial: 9. Best value: 0.268863:  32%|███▏      | 16/50 [3:05:55<4:55:09, 520.86s/it]Best trial: 9. Best value: 0.268863:  34%|███▍      | 17/50 [3:05:55<4:07:49, 450.59s/it]  [trial 16] PRUNED at epoch 5
[I 2026-05-13 04:11:53,403] Trial 16 pruned. 
  [trial 17] epoch 00 56.1s (bs=32) | train MAE 0.4836 loss 0.4836 | val MAE 0.3684 | best 0.3684
  [trial 17] epoch 01 52.5s (bs=32) | train MAE 0.3808 loss 0.3810 | val MAE 0.3344 | best 0.3344
  [trial 17] epoch 02 54.9s (bs=32) | train MAE 0.3516 loss 0.3516 | val MAE 0.3184 | best 0.3184
  [trial 17] epoch 03 53.8s (bs=32) | train MAE 0.3450 loss 0.3450 | val MAE 0.3027 | best 0.3027
  [trial 17] epoch 04 54.2s (bs=32) | train MAE 0.3377 loss 0.3376 | val MAE 0.3079 | best 0.3027
  [trial 17] epoch 05 55.9s (bs=32) | train MAE 0.3308 loss 0.3308 | val MAE 0.3199 | best 0.3027
  [trial 17] epoch 06 53.3s (bs=32) | train MAE 0.3273 loss 0.3273 | val MAE 0.3147 | best 0.3027
  [trial 17] epoch 07 48.7s (bs=32) | train MAE 0.3209 loss 0.3209 | val MAE 0.3102 | best 0.3027
  [trial 17] epoch 08 46.3s (bs=32) | train MAE 0.3159 loss 0.3159 | val MAE 0.3204 | best 0.3027
  [trial 17] epoch 09 45.3s (bs=32) | train MAE 0.3106 loss 0.3107 | val MAE 0.2980 | best 0.2980
  [trial 17] epoch 10 45.0s (bs=32) | train MAE 0.3071 loss 0.3071 | val MAE 0.2858 | best 0.2858
  [trial 17] epoch 11 45.5s (bs=32) | train MAE 0.3012 loss 0.3013 | val MAE 0.2982 | best 0.2858
  [trial 17] epoch 12 45.2s (bs=32) | train MAE 0.2946 loss 0.2945 | val MAE 0.2839 | best 0.2839
  [trial 17] epoch 13 45.1s (bs=32) | train MAE 0.2900 loss 0.2900 | val MAE 0.2787 | best 0.2787
  [trial 17] epoch 14 45.0s (bs=32) | train MAE 0.2875 loss 0.2874 | val MAE 0.2792 | best 0.2787
  [trial 17] epoch 15 44.3s (bs=32) | train MAE 0.2838 loss 0.2838 | val MAE 0.2906 | best 0.2787
  [trial 17] epoch 16 45.6s (bs=32) | train MAE 0.2822 loss 0.2823 | val MAE 0.2770 | best 0.2770
  [trial 17] epoch 17 46.0s (bs=32) | train MAE 0.2805 loss 0.2805 | val MAE 0.2765 | best 0.2765
  [trial 17] epoch 18 46.0s (bs=32) | train MAE 0.2782 loss 0.2782 | val MAE 0.2765 | best 0.2765
  [trial 17] epoch 19 46.8s (bs=32) | train MAE 0.2785 loss 0.2784 | val MAE 0.2761 | best 0.2761
                                                                                         Best trial: 9. Best value: 0.268863:  34%|███▍      | 17/50 [3:22:15<4:07:49, 450.59s/it]Best trial: 9. Best value: 0.268863:  34%|███▍      | 17/50 [3:22:15<4:07:49, 450.59s/it]Best trial: 9. Best value: 0.268863:  36%|███▌      | 18/50 [3:22:15<5:25:10, 609.71s/it][I 2026-05-13 04:28:13,526] Trial 17 finished with value: 0.2760819792703162 and parameters: {'hidden_dim': 640, 'num_heads': 40, 'ffn_ratio': 2, 'num_layers': 1, 'dropout': 0.3, 'hop_mode': 'contiguous', 'hop_window': 3, 'num_global_heads': 3, 'graph_pool': 'mean', 'lr': 0.0006336850870251349, 'weight_decay': 0.000574912487881206}. Best is trial 9 with value: 0.2688628450970329.
  [trial 18] epoch 00 57.3s (bs=32) | train MAE 0.4827 loss 0.4826 | val MAE 0.3338 | best 0.3338
  [trial 18] epoch 01 56.9s (bs=32) | train MAE 0.3653 loss 0.3654 | val MAE 0.3948 | best 0.3338
  [trial 18] epoch 02 57.7s (bs=32) | train MAE 0.3412 loss 0.3412 | val MAE 0.3200 | best 0.3200
  [trial 18] epoch 03 57.3s (bs=32) | train MAE 0.3322 loss 0.3322 | val MAE 0.3282 | best 0.3200
  [trial 18] epoch 04 57.3s (bs=32) | train MAE 0.3338 loss 0.3338 | val MAE 0.3291 | best 0.3200
  [trial 18] epoch 05 56.7s (bs=32) | train MAE 0.3277 loss 0.3277 | val MAE 0.3065 | best 0.3065
  [trial 18] epoch 06 56.4s (bs=32) | train MAE 0.3213 loss 0.3213 | val MAE 0.2968 | best 0.2968
  [trial 18] epoch 07 56.7s (bs=32) | train MAE 0.3124 loss 0.3123 | val MAE 0.3003 | best 0.2968
  [trial 18] epoch 08 56.9s (bs=32) | train MAE 0.3076 loss 0.3077 | val MAE 0.2884 | best 0.2884
  [trial 18] epoch 09 56.6s (bs=32) | train MAE 0.3053 loss 0.3053 | val MAE 0.2890 | best 0.2884
  [trial 18] epoch 10 56.3s (bs=32) | train MAE 0.3015 loss 0.3015 | val MAE 0.2904 | best 0.2884
  [trial 18] epoch 11 56.8s (bs=32) | train MAE 0.2976 loss 0.2976 | val MAE 0.2817 | best 0.2817
  [trial 18] epoch 12 57.0s (bs=32) | train MAE 0.2917 loss 0.2917 | val MAE 0.2916 | best 0.2817
  [trial 18] epoch 13 57.2s (bs=32) | train MAE 0.2912 loss 0.2913 | val MAE 0.2916 | best 0.2817
  [trial 18] epoch 14 56.4s (bs=32) | train MAE 0.2890 loss 0.2890 | val MAE 0.2851 | best 0.2817
  [trial 18] epoch 15 55.9s (bs=32) | train MAE 0.2857 loss 0.2857 | val MAE 0.2727 | best 0.2727
  [trial 18] epoch 16 57.8s (bs=32) | train MAE 0.2817 loss 0.2817 | val MAE 0.2790 | best 0.2727
  [trial 18] epoch 17 57.5s (bs=32) | train MAE 0.2811 loss 0.2811 | val MAE 0.2746 | best 0.2727
  [trial 18] epoch 18 56.5s (bs=32) | train MAE 0.2803 loss 0.2803 | val MAE 0.2760 | best 0.2727
  [trial 18] epoch 19 56.3s (bs=32) | train MAE 0.2797 loss 0.2797 | val MAE 0.2755 | best 0.2727
                                                                                         Best trial: 9. Best value: 0.268863:  36%|███▌      | 18/50 [3:41:17<5:25:10, 609.71s/it]Best trial: 9. Best value: 0.268863:  36%|███▌      | 18/50 [3:41:17<5:25:10, 609.71s/it]Best trial: 9. Best value: 0.268863:  38%|███▊      | 19/50 [3:41:17<6:37:35, 769.52s/it][I 2026-05-13 04:47:15,341] Trial 18 finished with value: 0.272685597780695 and parameters: {'hidden_dim': 640, 'num_heads': 40, 'ffn_ratio': 2, 'num_layers': 3, 'dropout': 0.3, 'hop_mode': 'contiguous', 'hop_window': 3, 'num_global_heads': 2, 'graph_pool': 'mean', 'lr': 0.0005996401743941695, 'weight_decay': 0.00011505837820109126}. Best is trial 9 with value: 0.2688628450970329.
  [trial 19] epoch 00 57.9s (bs=32) | train MAE 0.5080 loss 0.5079 | val MAE 0.4426 | best 0.4426
  [trial 19] epoch 01 56.9s (bs=32) | train MAE 0.3734 loss 0.3733 | val MAE 0.3507 | best 0.3507
  [trial 19] epoch 02 55.7s (bs=32) | train MAE 0.3481 loss 0.3481 | val MAE 0.3278 | best 0.3278
  [trial 19] epoch 03 57.1s (bs=32) | train MAE 0.3305 loss 0.3306 | val MAE 0.3043 | best 0.3043
  [trial 19] epoch 04 57.2s (bs=32) | train MAE 0.3325 loss 0.3326 | val MAE 0.3391 | best 0.3043
  [trial 19] epoch 05 56.8s (bs=32) | train MAE 0.3191 loss 0.3190 | val MAE 0.3640 | best 0.3043
  [trial 19] epoch 06 56.8s (bs=32) | train MAE 0.3166 loss 0.3165 | val MAE 0.2899 | best 0.2899
  [trial 19] epoch 07 56.5s (bs=32) | train MAE 0.3088 loss 0.3088 | val MAE 0.3023 | best 0.2899
  [trial 19] epoch 08 55.8s (bs=32) | train MAE 0.3055 loss 0.3055 | val MAE 0.2900 | best 0.2899
  [trial 19] epoch 09 56.8s (bs=32) | train MAE 0.3042 loss 0.3042 | val MAE 0.3019 | best 0.2899
  [trial 19] epoch 10 56.2s (bs=32) | train MAE 0.3031 loss 0.3033 | val MAE 0.2992 | best 0.2899
  [trial 19] epoch 11 56.7s (bs=32) | train MAE 0.2975 loss 0.2974 | val MAE 0.2824 | best 0.2824
  [trial 19] epoch 12 56.3s (bs=32) | train MAE 0.2926 loss 0.2925 | val MAE 0.2826 | best 0.2824
  [trial 19] epoch 13 58.0s (bs=32) | train MAE 0.2896 loss 0.2896 | val MAE 0.2789 | best 0.2789
  [trial 19] epoch 14 57.3s (bs=32) | train MAE 0.2887 loss 0.2887 | val MAE 0.2763 | best 0.2763
  [trial 19] epoch 15 56.8s (bs=32) | train MAE 0.2852 loss 0.2851 | val MAE 0.2702 | best 0.2702
  [trial 19] epoch 16 57.3s (bs=32) | train MAE 0.2830 loss 0.2830 | val MAE 0.2757 | best 0.2702
  [trial 19] epoch 17 56.7s (bs=32) | train MAE 0.2805 loss 0.2805 | val MAE 0.2729 | best 0.2702
  [trial 19] epoch 18 57.2s (bs=32) | train MAE 0.2789 loss 0.2789 | val MAE 0.2741 | best 0.2702
  [trial 19] epoch 19 57.0s (bs=32) | train MAE 0.2796 loss 0.2796 | val MAE 0.2739 | best 0.2702
                                                                                         Best trial: 9. Best value: 0.268863:  38%|███▊      | 19/50 [4:00:18<6:37:35, 769.52s/it]Best trial: 9. Best value: 0.268863:  38%|███▊      | 19/50 [4:00:18<6:37:35, 769.52s/it]Best trial: 9. Best value: 0.268863:  40%|████      | 20/50 [4:00:18<7:20:31, 881.06s/it]                                                                                         Best trial: 9. Best value: 0.268863:  40%|████      | 20/50 [4:00:20<7:20:31, 881.06s/it]Best trial: 9. Best value: 0.268863:  40%|████      | 20/50 [4:00:20<7:20:31, 881.06s/it]Best trial: 9. Best value: 0.268863:  42%|████▏     | 21/50 [4:00:20<4:58:13, 617.02s/it][I 2026-05-13 05:06:16,347] Trial 19 finished with value: 0.2701598804366169 and parameters: {'hidden_dim': 640, 'num_heads': 40, 'ffn_ratio': 2, 'num_layers': 3, 'dropout': 0.4, 'hop_mode': 'contiguous', 'hop_window': 3, 'num_global_heads': 1, 'graph_pool': 'mean', 'lr': 0.0004148505379792427, 'weight_decay': 0.00010665983166589079}. Best is trial 9 with value: 0.2688628450970329.
  [trial 20] Model build failed: hidden_dim=512 must be divisible by num_heads=20
  [trial 20] params: {'hidden_dim': 512, 'num_heads': 20, 'ffn_ratio': 2, 'num_layers': 5, 'dropout': 0.35000000000000003, 'hop_mode': 'contiguous', 'hop_window': 3, 'num_global_heads': 1, 'graph_pool': 'mean', 'lr': 0.0003965149150879625, 'weight_decay': 6.535862069761747e-05}
