[Peptides-func] task=multi_label  metric=macro_ap (higher_is_better=True)
  Loading cached distance masks from ./data/Peptides-func/dist_masks/train.pkl
  Loading cached distance masks from ./data/Peptides-func/dist_masks/val.pkl
  Loading cached distance masks from ./data/Peptides-func/dist_masks/test.pkl
Subsampled train: 10873 → 5436 (50%)
Train batches: 170  Val batches: 73
Max epochs/trial: 20  Patience: 10
Optuna trials: 50  Pruning: True
========================================================================
Will run 50 new trials (target total: 50, existing: 0).
  [trial 0] epoch 00 59.9s (bs=32) | train AP 0.2174 loss 0.3681 | val AP 0.3207 | best 0.3207
  [trial 0] epoch 01 57.1s (bs=32) | train AP 0.3303 loss 0.3064 | val AP 0.3876 | best 0.3876
  [trial 0] epoch 02 57.6s (bs=32) | train AP 0.3684 loss 0.2926 | val AP 0.4021 | best 0.4021
  [trial 0] epoch 03 57.3s (bs=32) | train AP 0.3794 loss 0.2879 | val AP 0.4192 | best 0.4192
  [trial 0] epoch 04 57.9s (bs=32) | train AP 0.4031 loss 0.2784 | val AP 0.4158 | best 0.4192
  [trial 0] epoch 05 57.6s (bs=32) | train AP 0.4160 loss 0.2733 | val AP 0.4532 | best 0.4532
  [trial 0] epoch 06 57.8s (bs=32) | train AP 0.4394 loss 0.2655 | val AP 0.4684 | best 0.4684
  [trial 0] epoch 07 57.3s (bs=32) | train AP 0.4521 loss 0.2609 | val AP 0.4697 | best 0.4697
  [trial 0] epoch 08 59.2s (bs=32) | train AP 0.4721 loss 0.2544 | val AP 0.4850 | best 0.4850
  [trial 0] epoch 09 57.4s (bs=32) | train AP 0.4874 loss 0.2483 | val AP 0.4918 | best 0.4918
  [trial 0] epoch 10 59.0s (bs=32) | train AP 0.5039 loss 0.2423 | val AP 0.5097 | best 0.5097
  [trial 0] epoch 11 57.4s (bs=32) | train AP 0.5166 loss 0.2373 | val AP 0.5117 | best 0.5117
  [trial 0] epoch 12 57.9s (bs=32) | train AP 0.5317 loss 0.2319 | val AP 0.5224 | best 0.5224
  [trial 0] epoch 13 59.4s (bs=32) | train AP 0.5506 loss 0.2271 | val AP 0.5265 | best 0.5265
  [trial 0] epoch 14 58.1s (bs=32) | train AP 0.5685 loss 0.2228 | val AP 0.5315 | best 0.5315
  [trial 0] epoch 15 59.7s (bs=32) | train AP 0.5782 loss 0.2179 | val AP 0.5367 | best 0.5367
  [trial 0] epoch 16 57.8s (bs=32) | train AP 0.5848 loss 0.2151 | val AP 0.5403 | best 0.5403
  [trial 0] epoch 17 59.4s (bs=32) | train AP 0.5942 loss 0.2116 | val AP 0.5417 | best 0.5417
  [trial 0] epoch 18 58.0s (bs=32) | train AP 0.5996 loss 0.2105 | val AP 0.5418 | best 0.5418
  [trial 0] epoch 19 59.1s (bs=32) | train AP 0.6025 loss 0.2099 | val AP 0.5416 | best 0.5418
[I 2026-05-12 20:57:38,544] Trial 0 finished with value: 0.5417541395517058 and parameters: {'hidden_dim': 256, 'num_heads': 16, 'ffn_ratio': 4, 'num_layers': 1, 'dropout': 0.05, 'hop_mode': 'window', 'hop_window': 4, 'num_global_heads': 4, 'graph_pool': 'sum', 'lr': 0.0008681616889493065, 'weight_decay': 0.0021957734465394567}. Best is trial 0 with value: 0.5417541395517058.
  [trial 1] epoch 00 71.7s (bs=32) | train AP 0.2111 loss 0.3679 | val AP 0.2977 | best 0.2977
  [trial 1] epoch 01 71.9s (bs=32) | train AP 0.2929 loss 0.3206 | val AP 0.3485 | best 0.3485
  [trial 1] epoch 02 72.1s (bs=32) | train AP 0.3370 loss 0.3034 | val AP 0.3613 | best 0.3613
  [trial 1] epoch 03 71.5s (bs=32) | train AP 0.3536 loss 0.2958 | val AP 0.3908 | best 0.3908
  [trial 1] epoch 04 72.7s (bs=32) | train AP 0.3660 loss 0.2909 | val AP 0.3951 | best 0.3951
  [trial 1] epoch 05 76.5s (bs=32) | train AP 0.3531 loss 0.2965 | val AP 0.3701 | best 0.3951
  [trial 1] epoch 06 72.4s (bs=32) | train AP 0.3515 loss 0.2979 | val AP 0.3852 | best 0.3951
  [trial 1] epoch 07 71.6s (bs=32) | train AP 0.3759 loss 0.2872 | val AP 0.4023 | best 0.4023
  [trial 1] epoch 08 71.5s (bs=32) | train AP 0.3837 loss 0.2848 | val AP 0.4016 | best 0.4023
  [trial 1] epoch 09 71.4s (bs=32) | train AP 0.3937 loss 0.2826 | val AP 0.4103 | best 0.4103
  [trial 1] epoch 10 71.2s (bs=32) | train AP 0.3918 loss 0.2808 | val AP 0.4081 | best 0.4103
  [trial 1] epoch 11 71.5s (bs=32) | train AP 0.4040 loss 0.2781 | val AP 0.4231 | best 0.4231
  [trial 1] epoch 12 70.7s (bs=32) | train AP 0.4187 loss 0.2728 | val AP 0.4123 | best 0.4231
  [trial 1] epoch 13 72.2s (bs=32) | train AP 0.4335 loss 0.2693 | val AP 0.4273 | best 0.4273
  [trial 1] epoch 14 70.6s (bs=32) | train AP 0.4356 loss 0.2666 | val AP 0.4259 | best 0.4273
  [trial 1] epoch 15 71.6s (bs=32) | train AP 0.4437 loss 0.2627 | val AP 0.4395 | best 0.4395
  [trial 1] epoch 16 71.7s (bs=32) | train AP 0.4555 loss 0.2591 | val AP 0.4401 | best 0.4401
  [trial 1] epoch 17 73.1s (bs=32) | train AP 0.4566 loss 0.2583 | val AP 0.4393 | best 0.4401
  [trial 1] epoch 18 72.5s (bs=32) | train AP 0.4649 loss 0.2563 | val AP 0.4436 | best 0.4436
  [trial 1] epoch 19 71.2s (bs=32) | train AP 0.4667 loss 0.2547 | val AP 0.4421 | best 0.4436
[I 2026-05-12 21:21:40,396] Trial 1 finished with value: 0.4436072810437429 and parameters: {'hidden_dim': 384, 'num_heads': 8, 'ffn_ratio': 4, 'num_layers': 6, 'dropout': 0.3, 'hop_mode': 'window', 'hop_window': 4, 'num_global_heads': 0, 'graph_pool': 'mean', 'lr': 0.00048697180377348874, 'weight_decay': 2.436570001464197e-05}. Best is trial 0 with value: 0.5417541395517058.
  [trial 2] epoch 00 77.1s (bs=32) | train AP 0.2254 loss 0.3534 | val AP 0.3005 | best 0.3005
  [trial 2] epoch 01 76.4s (bs=32) | train AP 0.2735 loss 0.3283 | val AP 0.3048 | best 0.3048
  [trial 2] epoch 02 77.4s (bs=32) | train AP 0.2975 loss 0.3176 | val AP 0.3481 | best 0.3481
  [trial 2] epoch 03 76.9s (bs=32) | train AP 0.3212 loss 0.3088 | val AP 0.3572 | best 0.3572
  [trial 2] epoch 04 77.0s (bs=32) | train AP 0.3086 loss 0.3143 | val AP 0.3360 | best 0.3572
  [trial 2] epoch 05 77.9s (bs=32) | train AP 0.3193 loss 0.3102 | val AP 0.3560 | best 0.3572
  [trial 2] epoch 06 77.1s (bs=32) | train AP 0.3250 loss 0.3073 | val AP 0.3459 | best 0.3572
  [trial 2] epoch 07 79.4s (bs=32) | train AP 0.3208 loss 0.3090 | val AP 0.3570 | best 0.3572
  [trial 2] epoch 08 77.1s (bs=32) | train AP 0.3401 loss 0.3021 | val AP 0.3583 | best 0.3583
  [trial 2] epoch 09 77.0s (bs=32) | train AP 0.3470 loss 0.3006 | val AP 0.3687 | best 0.3687
  [trial 2] epoch 10 77.0s (bs=32) | train AP 0.3208 loss 0.3090 | val AP 0.3602 | best 0.3687
  [trial 2] epoch 11 78.1s (bs=32) | train AP 0.3307 loss 0.3039 | val AP 0.3674 | best 0.3687
  [trial 2] epoch 12 80.1s (bs=32) | train AP 0.3595 loss 0.2943 | val AP 0.3824 | best 0.3824
  [trial 2] epoch 13 77.3s (bs=32) | train AP 0.3734 loss 0.2899 | val AP 0.4004 | best 0.4004
  [trial 2] epoch 14 77.8s (bs=32) | train AP 0.3756 loss 0.2894 | val AP 0.3926 | best 0.4004
  [trial 2] epoch 15 78.6s (bs=32) | train AP 0.3780 loss 0.2870 | val AP 0.4000 | best 0.4004
  [trial 2] epoch 16 78.4s (bs=32) | train AP 0.3852 loss 0.2855 | val AP 0.4102 | best 0.4102
  [trial 2] epoch 17 79.2s (bs=32) | train AP 0.3963 loss 0.2821 | val AP 0.4107 | best 0.4107
  [trial 2] epoch 18 79.6s (bs=32) | train AP 0.4008 loss 0.2810 | val AP 0.4116 | best 0.4116
  [trial 2] epoch 19 80.3s (bs=32) | train AP 0.4020 loss 0.2804 | val AP 0.4122 | best 0.4122
[I 2026-05-12 21:47:42,456] Trial 2 finished with value: 0.4121591012595255 and parameters: {'hidden_dim': 512, 'num_heads': 16, 'ffn_ratio': 2, 'num_layers': 4, 'dropout': 0.1, 'hop_mode': 'window', 'hop_window': 5, 'num_global_heads': 0, 'graph_pool': 'sum', 'lr': 0.002841716308815722, 'weight_decay': 0.00025465581928924377}. Best is trial 0 with value: 0.5417541395517058.
  [trial 3] Model build failed: hidden_dim=128 must be divisible by num_heads=40
  [trial 3] params: {'hidden_dim': 128, 'num_heads': 40, 'ffn_ratio': 2, 'num_layers': 4, 'dropout': 0.05, 'hop_mode': 'window', 'hop_window': 2, 'num_global_heads': 3, 'graph_pool': 'mean', 'lr': 0.0005841539903042611, 'weight_decay': 3.544655931853289e-05}
[I 2026-05-12 21:47:43,475] Trial 3 pruned. 
  [trial 4] epoch 00 66.2s (bs=32) | train AP 0.1955 loss 0.3738 | val AP 0.2916 | best 0.2916
  [trial 4] epoch 01 63.9s (bs=32) | train AP 0.2670 loss 0.3310 | val AP 0.2947 | best 0.2947
  [trial 4] epoch 02 64.3s (bs=32) | train AP 0.2659 loss 0.3297 | val AP 0.3046 | best 0.3046
  [trial 4] epoch 03 61.6s (bs=32) | train AP 0.2903 loss 0.3204 | val AP 0.3190 | best 0.3190
  [trial 4] epoch 04 61.1s (bs=32) | train AP 0.2944 loss 0.3196 | val AP 0.3059 | best 0.3190
  [trial 4] epoch 05 60.8s (bs=32) | train AP 0.2778 loss 0.3250 | val AP 0.3199 | best 0.3199
  [trial 4] epoch 06 60.9s (bs=32) | train AP 0.2882 loss 0.3221 | val AP 0.2987 | best 0.3199
  [trial 4] epoch 07 60.8s (bs=32) | train AP 0.3042 loss 0.3148 | val AP 0.3060 | best 0.3199
  [trial 4] epoch 08 60.7s (bs=32) | train AP 0.3022 loss 0.3151 | val AP 0.3317 | best 0.3317
  [trial 4] epoch 09 60.6s (bs=32) | train AP 0.3151 loss 0.3102 | val AP 0.3372 | best 0.3372
  [trial 4] epoch 10 60.3s (bs=32) | train AP 0.3218 loss 0.3078 | val AP 0.3367 | best 0.3372
  [trial 4] epoch 11 60.3s (bs=32) | train AP 0.3282 loss 0.3059 | val AP 0.3402 | best 0.3402
  [trial 4] epoch 12 60.2s (bs=32) | train AP 0.3346 loss 0.3045 | val AP 0.3449 | best 0.3449
  [trial 4] epoch 13 61.1s (bs=32) | train AP 0.3452 loss 0.3010 | val AP 0.3470 | best 0.3470
  [trial 4] epoch 14 61.0s (bs=32) | train AP 0.3453 loss 0.2998 | val AP 0.3444 | best 0.3470
  [trial 4] epoch 15 60.7s (bs=32) | train AP 0.3523 loss 0.2978 | val AP 0.3552 | best 0.3552
  [trial 4] epoch 16 60.7s (bs=32) | train AP 0.3583 loss 0.2959 | val AP 0.3560 | best 0.3560
  [trial 4] epoch 17 60.9s (bs=32) | train AP 0.3601 loss 0.2956 | val AP 0.3595 | best 0.3595
  [trial 4] epoch 18 61.1s (bs=32) | train AP 0.3631 loss 0.2951 | val AP 0.3612 | best 0.3612
  [trial 4] epoch 19 60.6s (bs=32) | train AP 0.3616 loss 0.2949 | val AP 0.3603 | best 0.3612
[I 2026-05-12 22:08:13,721] Trial 4 finished with value: 0.3611825859653903 and parameters: {'hidden_dim': 320, 'num_heads': 8, 'ffn_ratio': 4, 'num_layers': 3, 'dropout': 0.35000000000000003, 'hop_mode': 'contiguous', 'hop_window': 5, 'num_global_heads': 1, 'graph_pool': 'sum', 'lr': 0.002284844331681635, 'weight_decay': 0.001195624402212888}. Best is trial 0 with value: 0.5417541395517058.
  [trial 5] epoch 00 73.5s (bs=32) | train AP 0.2085 loss 0.3683 | val AP 0.3065 | best 0.3065
  [trial 5] epoch 01 72.9s (bs=32) | train AP 0.3088 loss 0.3146 | val AP 0.3588 | best 0.3588
  [trial 5] epoch 02 75.2s (bs=32) | train AP 0.3336 loss 0.3038 | val AP 0.3876 | best 0.3876
  [trial 5] epoch 03 75.1s (bs=32) | train AP 0.3600 loss 0.2947 | val AP 0.3979 | best 0.3979
  [trial 5] epoch 04 73.9s (bs=32) | train AP 0.3768 loss 0.2883 | val AP 0.4168 | best 0.4168
  [trial 5] epoch 05 74.1s (bs=32) | train AP 0.3764 loss 0.2878 | val AP 0.4091 | best 0.4168
  [trial 5] epoch 06 76.5s (bs=32) | train AP 0.3967 loss 0.2791 | val AP 0.4329 | best 0.4329
  [trial 5] epoch 07 75.3s (bs=32) | train AP 0.4081 loss 0.2746 | val AP 0.4466 | best 0.4466
  [trial 5] epoch 08 76.2s (bs=32) | train AP 0.4222 loss 0.2682 | val AP 0.4473 | best 0.4473
  [trial 5] epoch 09 75.7s (bs=32) | train AP 0.4364 loss 0.2650 | val AP 0.4573 | best 0.4573
  [trial 5] epoch 10 75.4s (bs=32) | train AP 0.4414 loss 0.2617 | val AP 0.4549 | best 0.4573
  [trial 5] epoch 11 76.1s (bs=32) | train AP 0.4454 loss 0.2608 | val AP 0.4587 | best 0.4587
  [trial 5] epoch 12 75.6s (bs=32) | train AP 0.4630 loss 0.2552 | val AP 0.4699 | best 0.4699
  [trial 5] epoch 13 75.0s (bs=32) | train AP 0.4781 loss 0.2500 | val AP 0.4791 | best 0.4791
  [trial 5] epoch 14 74.2s (bs=32) | train AP 0.4879 loss 0.2458 | val AP 0.4830 | best 0.4830
  [trial 5] epoch 15 76.3s (bs=32) | train AP 0.4998 loss 0.2413 | val AP 0.4846 | best 0.4846
  [trial 5] epoch 16 75.7s (bs=32) | train AP 0.5147 loss 0.2376 | val AP 0.4877 | best 0.4877
  [trial 5] epoch 17 75.3s (bs=32) | train AP 0.5111 loss 0.2357 | val AP 0.4867 | best 0.4877
  [trial 5] epoch 18 75.6s (bs=32) | train AP 0.5222 loss 0.2340 | val AP 0.4890 | best 0.4890
  [trial 5] epoch 19 75.0s (bs=32) | train AP 0.5227 loss 0.2327 | val AP 0.4884 | best 0.4890
[I 2026-05-12 22:33:18,830] Trial 5 finished with value: 0.4890304062925882 and parameters: {'hidden_dim': 320, 'num_heads': 16, 'ffn_ratio': 4, 'num_layers': 4, 'dropout': 0.25, 'hop_mode': 'window', 'hop_window': 4, 'num_global_heads': 2, 'graph_pool': 'sum', 'lr': 0.0008184387435592441, 'weight_decay': 0.00473990966765613}. Best is trial 0 with value: 0.5417541395517058.
  [trial 6] epoch 00 65.1s (bs=32) | train AP 0.2291 loss 0.3598 | val AP 0.3470 | best 0.3470
  [trial 6] epoch 01 65.4s (bs=32) | train AP 0.3313 loss 0.3074 | val AP 0.3588 | best 0.3588
  [trial 6] epoch 02 64.9s (bs=32) | train AP 0.3497 loss 0.3002 | val AP 0.3888 | best 0.3888
  [trial 6] epoch 03 65.8s (bs=32) | train AP 0.3894 loss 0.2856 | val AP 0.4143 | best 0.4143
  [trial 6] epoch 04 65.7s (bs=32) | train AP 0.4022 loss 0.2792 | val AP 0.4374 | best 0.4374
  [trial 6] epoch 05 64.1s (bs=32) | train AP 0.4231 loss 0.2713 | val AP 0.4467 | best 0.4467
  [trial 6] epoch 06 65.8s (bs=32) | train AP 0.4111 loss 0.2742 | val AP 0.4414 | best 0.4467
  [trial 6] epoch 07 66.1s (bs=32) | train AP 0.4325 loss 0.2686 | val AP 0.4469 | best 0.4469
  [trial 6] epoch 08 65.3s (bs=32) | train AP 0.4475 loss 0.2614 | val AP 0.4729 | best 0.4729
  [trial 6] epoch 09 65.0s (bs=32) | train AP 0.4695 loss 0.2550 | val AP 0.4772 | best 0.4772
  [trial 6] epoch 10 65.1s (bs=32) | train AP 0.4751 loss 0.2526 | val AP 0.4891 | best 0.4891
  [trial 6] epoch 11 64.9s (bs=32) | train AP 0.4902 loss 0.2478 | val AP 0.4826 | best 0.4891
  [trial 6] epoch 12 66.1s (bs=32) | train AP 0.4953 loss 0.2453 | val AP 0.4862 | best 0.4891
  [trial 6] epoch 13 65.4s (bs=32) | train AP 0.5070 loss 0.2402 | val AP 0.5014 | best 0.5014
  [trial 6] epoch 14 64.6s (bs=32) | train AP 0.5307 loss 0.2337 | val AP 0.5081 | best 0.5081
  [trial 6] epoch 15 66.2s (bs=32) | train AP 0.5401 loss 0.2285 | val AP 0.5202 | best 0.5202
  [trial 6] epoch 16 66.2s (bs=32) | train AP 0.5587 loss 0.2246 | val AP 0.5236 | best 0.5236
  [trial 6] epoch 17 64.5s (bs=32) | train AP 0.5689 loss 0.2212 | val AP 0.5308 | best 0.5308
  [trial 6] epoch 18 65.4s (bs=32) | train AP 0.5767 loss 0.2184 | val AP 0.5310 | best 0.5310
  [trial 6] epoch 19 65.6s (bs=32) | train AP 0.5808 loss 0.2173 | val AP 0.5319 | best 0.5319
[I 2026-05-12 22:55:07,843] Trial 6 finished with value: 0.5319262357950203 and parameters: {'hidden_dim': 640, 'num_heads': 8, 'ffn_ratio': 2, 'num_layers': 3, 'dropout': 0.05, 'hop_mode': 'contiguous', 'hop_window': 4, 'num_global_heads': 4, 'graph_pool': 'sum', 'lr': 0.00030820191928839066, 'weight_decay': 0.00012020822750412476}. Best is trial 0 with value: 0.5417541395517058.
  [trial 7] Model build failed: hidden_dim=128 must be divisible by num_heads=20
  [trial 7] params: {'hidden_dim': 128, 'num_heads': 20, 'ffn_ratio': 4, 'num_layers': 4, 'dropout': 0.1, 'hop_mode': 'contiguous', 'hop_window': 3, 'num_global_heads': 2, 'graph_pool': 'sum', 'lr': 0.0007504855193605641, 'weight_decay': 4.2611934121447093e-05}
[I 2026-05-12 22:55:08,324] Trial 7 pruned. 
  [trial 8] Model build failed: hidden_dim=256 must be divisible by num_heads=20
  [trial 8] params: {'hidden_dim': 256, 'num_heads': 20, 'ffn_ratio': 4, 'num_layers': 5, 'dropout': 0.2, 'hop_mode': 'window', 'hop_window': 5, 'num_global_heads': 1, 'graph_pool': 'sum', 'lr': 0.0003146098054663126, 'weight_decay': 0.0018842388825327857}
[I 2026-05-12 22:55:09,334] Trial 8 pruned. 
  [trial 9] epoch 00 67.9s (bs=32) | train AP 0.2205 loss 0.3588 | val AP 0.3173 | best 0.3173
  [trial 9] epoch 01 67.5s (bs=32) | train AP 0.3063 loss 0.3157 | val AP 0.3684 | best 0.3684
  [trial 9] epoch 02 67.6s (bs=32) | train AP 0.3330 loss 0.3043 | val AP 0.3877 | best 0.3877
  [trial 9] epoch 03 66.8s (bs=32) | train AP 0.3647 loss 0.2905 | val AP 0.3994 | best 0.3994
  [trial 9] epoch 04 67.1s (bs=32) | train AP 0.3773 loss 0.2860 | val AP 0.4181 | best 0.4181
  [trial 9] epoch 05 67.2s (bs=32) | train AP 0.3877 loss 0.2814 | val AP 0.4297 | best 0.4297
  [trial 9] epoch 06 67.4s (bs=32) | train AP 0.3980 loss 0.2793 | val AP 0.4298 | best 0.4298
  [trial 9] epoch 07 66.8s (bs=32) | train AP 0.4166 loss 0.2748 | val AP 0.4299 | best 0.4299
  [trial 9] epoch 08 67.6s (bs=32) | train AP 0.3946 loss 0.2824 | val AP 0.4204 | best 0.4299
  [trial 9] epoch 09 68.1s (bs=32) | train AP 0.4147 loss 0.2730 | val AP 0.4412 | best 0.4412
  [trial 9] epoch 10 67.0s (bs=32) | train AP 0.4311 loss 0.2673 | val AP 0.4440 | best 0.4440
  [trial 9] epoch 11 66.7s (bs=32) | train AP 0.4495 loss 0.2610 | val AP 0.4681 | best 0.4681
  [trial 9] epoch 12 67.5s (bs=32) | train AP 0.4680 loss 0.2545 | val AP 0.4568 | best 0.4681
  [trial 9] epoch 13 66.9s (bs=32) | train AP 0.4791 loss 0.2503 | val AP 0.4824 | best 0.4824
  [trial 9] epoch 14 67.6s (bs=32) | train AP 0.4917 loss 0.2463 | val AP 0.4811 | best 0.4824
  [trial 9] epoch 15 66.4s (bs=32) | train AP 0.5091 loss 0.2409 | val AP 0.4967 | best 0.4967
  [trial 9] epoch 16 67.2s (bs=32) | train AP 0.5206 loss 0.2366 | val AP 0.4980 | best 0.4980
  [trial 9] epoch 17 66.4s (bs=32) | train AP 0.5239 loss 0.2337 | val AP 0.5018 | best 0.5018
  [trial 9] epoch 18 67.5s (bs=32) | train AP 0.5344 loss 0.2321 | val AP 0.5045 | best 0.5045
  [trial 9] epoch 19 66.4s (bs=32) | train AP 0.5369 loss 0.2305 | val AP 0.5046 | best 0.5046
[I 2026-05-12 23:17:35,107] Trial 9 finished with value: 0.5046341739775733 and parameters: {'hidden_dim': 640, 'num_heads': 20, 'ffn_ratio': 2, 'num_layers': 2, 'dropout': 0.1, 'hop_mode': 'contiguous', 'hop_window': 2, 'num_global_heads': 2, 'graph_pool': 'mean', 'lr': 0.0005685255159708854, 'weight_decay': 0.0005759079044844154}. Best is trial 0 with value: 0.5417541395517058.
  [trial 10] epoch 00 62.2s (bs=32) | train AP 0.2044 loss 0.3778 | val AP 0.3048 | best 0.3048
  [trial 10] epoch 01 63.9s (bs=32) | train AP 0.2916 loss 0.3212 | val AP 0.3639 | best 0.3639
  [trial 10] epoch 02 63.5s (bs=32) | train AP 0.3382 loss 0.3029 | val AP 0.3872 | best 0.3872
  [trial 10] epoch 03 62.5s (bs=32) | train AP 0.3587 loss 0.2938 | val AP 0.3905 | best 0.3905
  [trial 10] epoch 04 64.4s (bs=32) | train AP 0.3740 loss 0.2887 | val AP 0.4168 | best 0.4168
  [trial 10] epoch 05 63.7s (bs=32) | train AP 0.3833 loss 0.2854 | val AP 0.4148 | best 0.4168
  [trial 10] epoch 06 63.8s (bs=32) | train AP 0.3945 loss 0.2809 | val AP 0.4063 | best 0.4168
  [trial 10] PRUNED at epoch 6
[I 2026-05-12 23:25:00,400] Trial 10 pruned. 
  [trial 11] epoch 00 57.6s (bs=32) | train AP 0.1841 loss 0.3798 | val AP 0.2622 | best 0.2622
  [trial 11] epoch 01 56.6s (bs=32) | train AP 0.2486 loss 0.3396 | val AP 0.3066 | best 0.3066
  [trial 11] epoch 02 58.1s (bs=32) | train AP 0.2795 loss 0.3297 | val AP 0.2936 | best 0.3066
  [trial 11] epoch 03 58.7s (bs=32) | train AP 0.2921 loss 0.3253 | val AP 0.3244 | best 0.3244
  [trial 11] epoch 04 57.7s (bs=32) | train AP 0.3127 loss 0.3172 | val AP 0.3443 | best 0.3443
  [trial 11] epoch 05 58.9s (bs=32) | train AP 0.3284 loss 0.3095 | val AP 0.3554 | best 0.3554
  [trial 11] PRUNED at epoch 5
[I 2026-05-12 23:30:49,418] Trial 11 pruned. 
  [trial 12] epoch 00 67.1s (bs=32) | train AP 0.2260 loss 0.3555 | val AP 0.3089 | best 0.3089
  [trial 12] epoch 01 66.4s (bs=32) | train AP 0.2761 loss 0.3280 | val AP 0.3389 | best 0.3389
  [trial 12] epoch 02 67.0s (bs=32) | train AP 0.2992 loss 0.3180 | val AP 0.3367 | best 0.3389
  [trial 12] epoch 03 65.7s (bs=32) | train AP 0.3132 loss 0.3107 | val AP 0.3544 | best 0.3544
  [trial 12] epoch 04 66.7s (bs=32) | train AP 0.3359 loss 0.3047 | val AP 0.3606 | best 0.3606
  [trial 12] epoch 05 66.1s (bs=32) | train AP 0.3383 loss 0.3018 | val AP 0.3673 | best 0.3673
  [trial 12] PRUNED at epoch 5
[I 2026-05-12 23:37:29,892] Trial 12 pruned. 
  [trial 13] epoch 00 60.7s (bs=32) | train AP 0.1972 loss 0.3777 | val AP 0.3047 | best 0.3047
  [trial 13] epoch 01 62.5s (bs=32) | train AP 0.3029 loss 0.3155 | val AP 0.3619 | best 0.3619
  [trial 13] epoch 02 68.1s (bs=32) | train AP 0.3389 loss 0.3034 | val AP 0.3762 | best 0.3762
  [trial 13] epoch 03 66.6s (bs=32) | train AP 0.3436 loss 0.3013 | val AP 0.3797 | best 0.3797
  [trial 13] epoch 04 69.1s (bs=32) | train AP 0.3563 loss 0.2952 | val AP 0.3761 | best 0.3797
  [trial 13] epoch 05 68.1s (bs=32) | train AP 0.3543 loss 0.2970 | val AP 0.3877 | best 0.3877
  [trial 13] PRUNED at epoch 5
