[I 2026-05-13 16:59:46,434] Trial 36 finished with value: 0.6111699589830167 and parameters: {'hidden_dim': 384, 'num_heads': 32, 'ffn_ratio': 4, 'num_layers': 4, 'dropout': 0.05, 'hop_mode': 'window', 'hop_window': 2, 'num_global_heads': 2, 'graph_pool': 'mean', 'lr': 0.000488634246806206, 'weight_decay': 0.0008842825681313607}. Best is trial 35 with value: 0.6145012414827129.
  [trial 37] epoch 00 97.7s (bs=32) | train AP 0.2027 loss 0.3720 | val AP 0.3044 | best 0.3044
  [trial 37] epoch 01 96.9s (bs=32) | train AP 0.3016 loss 0.3151 | val AP 0.3653 | best 0.3653
  [trial 37] epoch 02 97.0s (bs=32) | train AP 0.3560 loss 0.2937 | val AP 0.4028 | best 0.4028
  [trial 37] epoch 03 93.7s (bs=32) | train AP 0.3912 loss 0.2811 | val AP 0.4151 | best 0.4151
  [trial 37] epoch 04 96.9s (bs=32) | train AP 0.4090 loss 0.2739 | val AP 0.4475 | best 0.4475
  [trial 37] epoch 05 93.4s (bs=32) | train AP 0.4346 loss 0.2635 | val AP 0.4696 | best 0.4696
  [trial 37] epoch 06 95.6s (bs=32) | train AP 0.4586 loss 0.2554 | val AP 0.4873 | best 0.4873
  [trial 37] epoch 07 100.7s (bs=32) | train AP 0.4860 loss 0.2439 | val AP 0.4929 | best 0.4929
  [trial 37] epoch 08 94.1s (bs=32) | train AP 0.5066 loss 0.2365 | val AP 0.5253 | best 0.5253
  [trial 37] epoch 09 94.9s (bs=32) | train AP 0.5399 loss 0.2237 | val AP 0.5322 | best 0.5322
  [trial 37] epoch 10 94.9s (bs=32) | train AP 0.5692 loss 0.2126 | val AP 0.5553 | best 0.5553
  [trial 37] epoch 11 95.1s (bs=32) | train AP 0.6216 loss 0.1945 | val AP 0.5548 | best 0.5553
  [trial 37] epoch 12 95.2s (bs=32) | train AP 0.6472 loss 0.1817 | val AP 0.5729 | best 0.5729
  [trial 37] epoch 13 93.4s (bs=32) | train AP 0.6940 loss 0.1636 | val AP 0.5860 | best 0.5860
  [trial 37] epoch 14 95.0s (bs=32) | train AP 0.7392 loss 0.1471 | val AP 0.6001 | best 0.6001
  [trial 37] epoch 15 93.3s (bs=32) | train AP 0.7677 loss 0.1335 | val AP 0.5936 | best 0.6001
  [trial 37] epoch 16 87.8s (bs=32) | train AP 0.7948 loss 0.1227 | val AP 0.6044 | best 0.6044
  [trial 37] epoch 17 88.1s (bs=32) | train AP 0.8173 loss 0.1145 | val AP 0.6034 | best 0.6044
  [trial 37] epoch 18 99.9s (bs=32) | train AP 0.8276 loss 0.1106 | val AP 0.6028 | best 0.6044
  [trial 37] epoch 19 94.4s (bs=32) | train AP 0.8294 loss 0.1088 | val AP 0.6026 | best 0.6044
[I 2026-05-13 17:31:40,899] Trial 37 finished with value: 0.6044068113031094 and parameters: {'hidden_dim': 384, 'num_heads': 32, 'ffn_ratio': 4, 'num_layers': 4, 'dropout': 0.05, 'hop_mode': 'window', 'hop_window': 1, 'num_global_heads': 0, 'graph_pool': 'mean', 'lr': 0.0005052126022639414, 'weight_decay': 0.0016234034701963673}. Best is trial 35 with value: 0.6145012414827129.
  [trial 38] epoch 00 91.2s (bs=32) | train AP 0.2130 loss 0.3665 | val AP 0.3066 | best 0.3066
  [trial 38] epoch 01 95.2s (bs=32) | train AP 0.3241 loss 0.3085 | val AP 0.3748 | best 0.3748
  [trial 38] epoch 02 95.6s (bs=32) | train AP 0.3607 loss 0.2932 | val AP 0.4071 | best 0.4071
  [trial 38] epoch 03 95.5s (bs=32) | train AP 0.3901 loss 0.2829 | val AP 0.4269 | best 0.4269
  [trial 38] epoch 04 94.5s (bs=32) | train AP 0.4142 loss 0.2745 | val AP 0.4392 | best 0.4392
  [trial 38] epoch 05 92.1s (bs=32) | train AP 0.4333 loss 0.2660 | val AP 0.4532 | best 0.4532
  [trial 38] epoch 06 88.1s (bs=32) | train AP 0.4558 loss 0.2571 | val AP 0.4847 | best 0.4847
  [trial 38] epoch 07 84.7s (bs=32) | train AP 0.4799 loss 0.2485 | val AP 0.5046 | best 0.5046
  [trial 38] epoch 08 86.6s (bs=32) | train AP 0.5091 loss 0.2381 | val AP 0.5026 | best 0.5046
  [trial 38] epoch 09 95.0s (bs=32) | train AP 0.5256 loss 0.2316 | val AP 0.5300 | best 0.5300
  [trial 38] epoch 10 91.3s (bs=32) | train AP 0.5496 loss 0.2218 | val AP 0.5454 | best 0.5454
  [trial 38] epoch 11 93.8s (bs=32) | train AP 0.5872 loss 0.2092 | val AP 0.5494 | best 0.5494
  [trial 38] epoch 12 94.8s (bs=32) | train AP 0.6174 loss 0.1968 | val AP 0.5468 | best 0.5494
  [trial 38] PRUNED at epoch 12
[I 2026-05-13 17:51:46,255] Trial 38 pruned. 
  [trial 39] epoch 00 112.0s (bs=32) | train AP 0.2051 loss 0.3706 | val AP 0.3089 | best 0.3089
  [trial 39] epoch 01 107.4s (bs=32) | train AP 0.3152 loss 0.3114 | val AP 0.3821 | best 0.3821
  [trial 39] epoch 02 104.0s (bs=32) | train AP 0.3658 loss 0.2929 | val AP 0.3943 | best 0.3943
  [trial 39] epoch 03 103.4s (bs=32) | train AP 0.3808 loss 0.2852 | val AP 0.4169 | best 0.4169
  [trial 39] epoch 04 104.7s (bs=32) | train AP 0.4061 loss 0.2761 | val AP 0.4485 | best 0.4485
  [trial 39] epoch 05 102.3s (bs=32) | train AP 0.4244 loss 0.2673 | val AP 0.4605 | best 0.4605
  [trial 39] epoch 06 105.4s (bs=32) | train AP 0.4411 loss 0.2604 | val AP 0.4772 | best 0.4772
  [trial 39] epoch 07 102.6s (bs=32) | train AP 0.4713 loss 0.2490 | val AP 0.4817 | best 0.4817
  [trial 39] epoch 08 104.3s (bs=32) | train AP 0.4977 loss 0.2379 | val AP 0.4985 | best 0.4985
  [trial 39] PRUNED at epoch 8
[I 2026-05-13 18:07:34,376] Trial 39 pruned. 
  [trial 40] epoch 00 76.4s (bs=32) | train AP 0.2152 loss 0.3613 | val AP 0.3092 | best 0.3092
  [trial 40] epoch 01 77.6s (bs=32) | train AP 0.3131 loss 0.3137 | val AP 0.3772 | best 0.3772
  [trial 40] epoch 02 76.5s (bs=32) | train AP 0.3514 loss 0.2969 | val AP 0.3890 | best 0.3890
  [trial 40] epoch 03 76.4s (bs=32) | train AP 0.3547 loss 0.2959 | val AP 0.3976 | best 0.3976
  [trial 40] epoch 04 76.6s (bs=32) | train AP 0.3777 loss 0.2873 | val AP 0.3931 | best 0.3976
  [trial 40] epoch 05 76.0s (bs=32) | train AP 0.3856 loss 0.2819 | val AP 0.4313 | best 0.4313
  [trial 40] PRUNED at epoch 5
[I 2026-05-13 18:15:15,364] Trial 40 pruned. 
  [trial 41] epoch 00 79.1s (bs=32) | train AP 0.2095 loss 0.3685 | val AP 0.3041 | best 0.3041
  [trial 41] epoch 01 80.2s (bs=32) | train AP 0.3121 loss 0.3112 | val AP 0.3760 | best 0.3760
  [trial 41] epoch 02 80.0s (bs=32) | train AP 0.3514 loss 0.2974 | val AP 0.3780 | best 0.3780
  [trial 41] epoch 03 79.7s (bs=32) | train AP 0.3750 loss 0.2888 | val AP 0.4185 | best 0.4185
  [trial 41] epoch 04 79.5s (bs=32) | train AP 0.4019 loss 0.2765 | val AP 0.4307 | best 0.4307
  [trial 41] epoch 05 80.7s (bs=32) | train AP 0.4172 loss 0.2709 | val AP 0.4605 | best 0.4605
  [trial 41] epoch 06 79.6s (bs=32) | train AP 0.4434 loss 0.2636 | val AP 0.4694 | best 0.4694
  [trial 41] epoch 07 78.9s (bs=32) | train AP 0.4598 loss 0.2565 | val AP 0.4836 | best 0.4836
  [trial 41] epoch 08 79.5s (bs=32) | train AP 0.4877 loss 0.2445 | val AP 0.5115 | best 0.5115
  [trial 41] epoch 09 79.7s (bs=32) | train AP 0.5115 loss 0.2360 | val AP 0.5112 | best 0.5115
  [trial 41] PRUNED at epoch 9
[I 2026-05-13 18:28:33,936] Trial 41 pruned. 
  [trial 42] epoch 00 61.2s (bs=32) | train AP 0.1703 loss 0.4362 | val AP 0.2589 | best 0.2589
  [trial 42] epoch 01 61.1s (bs=32) | train AP 0.3013 loss 0.3170 | val AP 0.3629 | best 0.3629
  [trial 42] epoch 02 60.7s (bs=32) | train AP 0.3517 loss 0.2984 | val AP 0.3899 | best 0.3899
  [trial 42] epoch 03 61.4s (bs=32) | train AP 0.3792 loss 0.2872 | val AP 0.4098 | best 0.4098
  [trial 42] epoch 04 61.2s (bs=32) | train AP 0.3914 loss 0.2801 | val AP 0.4072 | best 0.4098
  [trial 42] epoch 05 61.3s (bs=32) | train AP 0.4166 loss 0.2713 | val AP 0.4406 | best 0.4406
  [trial 42] PRUNED at epoch 5
[I 2026-05-13 18:34:42,344] Trial 42 pruned. 
  [trial 43] epoch 00 92.1s (bs=32) | train AP 0.2196 loss 0.3561 | val AP 0.2641 | best 0.2641
  [trial 43] epoch 01 92.9s (bs=32) | train AP 0.2836 loss 0.3226 | val AP 0.3456 | best 0.3456
  [trial 43] epoch 02 92.6s (bs=32) | train AP 0.3018 loss 0.3179 | val AP 0.3447 | best 0.3456
  [trial 43] epoch 03 92.7s (bs=32) | train AP 0.3070 loss 0.3151 | val AP 0.3597 | best 0.3597
  [trial 43] epoch 04 91.8s (bs=32) | train AP 0.3407 loss 0.3011 | val AP 0.3667 | best 0.3667
  [trial 43] epoch 05 91.0s (bs=32) | train AP 0.3437 loss 0.3005 | val AP 0.3838 | best 0.3838
  [trial 43] PRUNED at epoch 5
[I 2026-05-13 18:43:56,992] Trial 43 pruned. 
  [trial 44] Model build failed: hidden_dim=384 must be divisible by num_heads=20
  [trial 44] params: {'hidden_dim': 384, 'num_heads': 20, 'ffn_ratio': 4, 'num_layers': 4, 'dropout': 0.3, 'hop_mode': 'contiguous', 'hop_window': 2, 'num_global_heads': 2, 'graph_pool': 'mean', 'lr': 0.000544202693974083, 'weight_decay': 0.002584622655490367}
[I 2026-05-13 18:43:58,067] Trial 44 pruned. 
  [trial 45] epoch 00 93.9s (bs=32) | train AP 0.2124 loss 0.3650 | val AP 0.3142 | best 0.3142
  [trial 45] epoch 01 91.5s (bs=32) | train AP 0.3239 loss 0.3095 | val AP 0.3958 | best 0.3958
  [trial 45] epoch 02 91.8s (bs=32) | train AP 0.3753 loss 0.2875 | val AP 0.4157 | best 0.4157
  [trial 45] epoch 03 91.0s (bs=32) | train AP 0.4024 loss 0.2760 | val AP 0.4382 | best 0.4382
  [trial 45] epoch 04 94.0s (bs=32) | train AP 0.4176 loss 0.2690 | val AP 0.4492 | best 0.4492
  [trial 45] epoch 05 93.1s (bs=32) | train AP 0.4378 loss 0.2614 | val AP 0.4736 | best 0.4736
  [trial 45] epoch 06 93.7s (bs=32) | train AP 0.4680 loss 0.2514 | val AP 0.4888 | best 0.4888
  [trial 45] epoch 07 96.7s (bs=32) | train AP 0.4886 loss 0.2448 | val AP 0.5081 | best 0.5081
  [trial 45] epoch 08 94.0s (bs=32) | train AP 0.5185 loss 0.2325 | val AP 0.5163 | best 0.5163
  [trial 45] epoch 09 92.6s (bs=32) | train AP 0.5409 loss 0.2239 | val AP 0.5187 | best 0.5187
  [trial 45] epoch 10 92.7s (bs=32) | train AP 0.5803 loss 0.2106 | val AP 0.5647 | best 0.5647
  [trial 45] epoch 11 92.0s (bs=32) | train AP 0.6118 loss 0.1981 | val AP 0.5747 | best 0.5747
  [trial 45] epoch 12 92.6s (bs=32) | train AP 0.6444 loss 0.1846 | val AP 0.5853 | best 0.5853
  [trial 45] epoch 13 90.9s (bs=32) | train AP 0.6911 loss 0.1657 | val AP 0.5819 | best 0.5853
  [trial 45] epoch 14 94.4s (bs=32) | train AP 0.7261 loss 0.1505 | val AP 0.6015 | best 0.6015
  [trial 45] epoch 15 91.8s (bs=32) | train AP 0.7635 loss 0.1358 | val AP 0.6045 | best 0.6045
  [trial 45] epoch 16 91.6s (bs=32) | train AP 0.7913 loss 0.1236 | val AP 0.6070 | best 0.6070
  [trial 45] epoch 17 93.5s (bs=32) | train AP 0.8173 loss 0.1142 | val AP 0.6106 | best 0.6106
  [trial 45] epoch 18 93.2s (bs=32) | train AP 0.8313 loss 0.1087 | val AP 0.6097 | best 0.6106
  [trial 45] epoch 19 94.2s (bs=32) | train AP 0.8359 loss 0.1069 | val AP 0.6098 | best 0.6106
[I 2026-05-13 19:14:59,557] Trial 45 finished with value: 0.6106496737098068 and parameters: {'hidden_dim': 384, 'num_heads': 32, 'ffn_ratio': 4, 'num_layers': 4, 'dropout': 0.05, 'hop_mode': 'window', 'hop_window': 1, 'num_global_heads': 0, 'graph_pool': 'mean', 'lr': 0.0004893000057002949, 'weight_decay': 0.0018310007262777432}. Best is trial 35 with value: 0.6145012414827129.
  [trial 46] epoch 00 83.2s (bs=32) | train AP 0.2046 loss 0.3757 | val AP 0.3047 | best 0.3047
  [trial 46] epoch 01 82.7s (bs=32) | train AP 0.3106 loss 0.3122 | val AP 0.3880 | best 0.3880
  [trial 46] epoch 02 83.1s (bs=32) | train AP 0.3687 loss 0.2898 | val AP 0.3951 | best 0.3951
  [trial 46] epoch 03 83.1s (bs=32) | train AP 0.3932 loss 0.2794 | val AP 0.4281 | best 0.4281
  [trial 46] epoch 04 83.3s (bs=32) | train AP 0.4204 loss 0.2679 | val AP 0.4410 | best 0.4410
  [trial 46] epoch 05 84.4s (bs=32) | train AP 0.4448 loss 0.2610 | val AP 0.4740 | best 0.4740
  [trial 46] epoch 06 84.6s (bs=32) | train AP 0.4681 loss 0.2523 | val AP 0.4782 | best 0.4782
  [trial 46] epoch 07 83.2s (bs=32) | train AP 0.4897 loss 0.2411 | val AP 0.4918 | best 0.4918
  [trial 46] epoch 08 83.8s (bs=32) | train AP 0.5226 loss 0.2318 | val AP 0.5225 | best 0.5225
  [trial 46] epoch 09 83.8s (bs=32) | train AP 0.5467 loss 0.2216 | val AP 0.5237 | best 0.5237
  [trial 46] epoch 10 83.3s (bs=32) | train AP 0.5776 loss 0.2094 | val AP 0.5592 | best 0.5592
  [trial 46] epoch 11 83.0s (bs=32) | train AP 0.6142 loss 0.1959 | val AP 0.5639 | best 0.5639
  [trial 46] epoch 12 84.1s (bs=32) | train AP 0.6548 loss 0.1802 | val AP 0.5777 | best 0.5777
  [trial 46] epoch 13 83.5s (bs=32) | train AP 0.6936 loss 0.1650 | val AP 0.5783 | best 0.5783
  [trial 46] epoch 14 83.0s (bs=32) | train AP 0.7344 loss 0.1498 | val AP 0.5901 | best 0.5901
  [trial 46] epoch 15 82.8s (bs=32) | train AP 0.7638 loss 0.1348 | val AP 0.5889 | best 0.5901
  [trial 46] epoch 16 84.1s (bs=32) | train AP 0.7893 loss 0.1254 | val AP 0.5936 | best 0.5936
  [trial 46] epoch 17 82.8s (bs=32) | train AP 0.8108 loss 0.1169 | val AP 0.5987 | best 0.5987
  [trial 46] epoch 18 82.6s (bs=32) | train AP 0.8197 loss 0.1123 | val AP 0.5961 | best 0.5987
  [trial 46] epoch 19 83.1s (bs=32) | train AP 0.8278 loss 0.1100 | val AP 0.5960 | best 0.5987
[I 2026-05-13 19:42:49,485] Trial 46 finished with value: 0.5987291469431889 and parameters: {'hidden_dim': 384, 'num_heads': 32, 'ffn_ratio': 4, 'num_layers': 3, 'dropout': 0.05, 'hop_mode': 'window', 'hop_window': 1, 'num_global_heads': 0, 'graph_pool': 'mean', 'lr': 0.000455953165165513, 'weight_decay': 0.0015990011909130424}. Best is trial 35 with value: 0.6145012414827129.
  [trial 47] epoch 00 91.9s (bs=32) | train AP 0.2115 loss 0.3639 | val AP 0.3170 | best 0.3170
  [trial 47] epoch 01 92.7s (bs=32) | train AP 0.3217 loss 0.3096 | val AP 0.3664 | best 0.3664
  [trial 47] epoch 02 91.3s (bs=32) | train AP 0.3601 loss 0.2917 | val AP 0.4086 | best 0.4086
  [trial 47] epoch 03 92.0s (bs=32) | train AP 0.3877 loss 0.2814 | val AP 0.4211 | best 0.4211
  [trial 47] epoch 04 91.8s (bs=32) | train AP 0.4128 loss 0.2732 | val AP 0.4467 | best 0.4467
  [trial 47] epoch 05 91.3s (bs=32) | train AP 0.4308 loss 0.2644 | val AP 0.4573 | best 0.4573
  [trial 47] epoch 06 95.9s (bs=32) | train AP 0.4513 loss 0.2572 | val AP 0.4772 | best 0.4772
  [trial 47] epoch 07 96.1s (bs=32) | train AP 0.4733 loss 0.2493 | val AP 0.4868 | best 0.4868
  [trial 47] epoch 08 92.4s (bs=32) | train AP 0.5027 loss 0.2399 | val AP 0.5078 | best 0.5078
  [trial 47] PRUNED at epoch 8
[I 2026-05-13 19:56:46,389] Trial 47 pruned. 
  [trial 48] epoch 00 73.6s (bs=32) | train AP 0.1978 loss 0.3856 | val AP 0.3012 | best 0.3012
  [trial 48] epoch 01 72.7s (bs=32) | train AP 0.2968 loss 0.3183 | val AP 0.3690 | best 0.3690
  [trial 48] epoch 02 73.2s (bs=32) | train AP 0.3527 loss 0.2968 | val AP 0.3932 | best 0.3932
  [trial 48] epoch 03 73.2s (bs=32) | train AP 0.3833 loss 0.2836 | val AP 0.4119 | best 0.4119
  [trial 48] epoch 04 72.0s (bs=32) | train AP 0.4089 loss 0.2763 | val AP 0.4356 | best 0.4356
  [trial 48] epoch 05 73.8s (bs=32) | train AP 0.4268 loss 0.2675 | val AP 0.4496 | best 0.4496
  [trial 48] PRUNED at epoch 5
[I 2026-05-13 20:04:06,376] Trial 48 pruned. 
  [trial 49] epoch 00 103.5s (bs=32) | train AP 0.2124 loss 0.3660 | val AP 0.3031 | best 0.3031
  [trial 49] epoch 01 104.1s (bs=32) | train AP 0.2972 loss 0.3175 | val AP 0.3382 | best 0.3382
  [trial 49] epoch 02 106.0s (bs=32) | train AP 0.3525 loss 0.2958 | val AP 0.3928 | best 0.3928
  [trial 49] epoch 03 103.3s (bs=32) | train AP 0.3759 loss 0.2891 | val AP 0.4182 | best 0.4182
  [trial 49] epoch 04 105.6s (bs=32) | train AP 0.3847 loss 0.2835 | val AP 0.4290 | best 0.4290
  [trial 49] epoch 05 105.5s (bs=32) | train AP 0.4046 loss 0.2765 | val AP 0.4459 | best 0.4459
  [trial 49] PRUNED at epoch 5
[I 2026-05-13 20:14:35,718] Trial 49 pruned. 

========================================================================
OPTUNA SEARCH COMPLETE
========================================================================

Best trial #35
  Value (AP): 0.614501
  Params (11):
    dropout: 0.05
    ffn_ratio: 4
    graph_pool: mean
    hidden_dim: 384
    hop_mode: window
    hop_window: 2
    lr: 0.00047616159061091327
    num_global_heads: 2
    num_heads: 32
    num_layers: 3
    weight_decay: 0.0014185166601235076
  Model size: 5.691M params
  Actual batch size: 32

Saved to optuna_hop_masked_best.json

Top 5 trials:
  #35  AP=0.6145  params: {'dropout': 0.05, 'ffn_ratio': 4, 'graph_pool': 'mean', 'hidden_dim': 384, 'hop_mode': 'window', 'hop_window': 2, 'lr': 0.00047616159061091327, 'num_global_heads': 2, 'num_heads': 32, 'num_layers': 3, 'weight_decay': 0.0014185166601235076}
  #20  AP=0.6121  params: {'dropout': 0.1, 'ffn_ratio': 4, 'graph_pool': 'sum', 'hidden_dim': 384, 'hop_mode': 'window', 'hop_window': 2, 'lr': 0.0004107382016293528, 'num_global_heads': 1, 'num_heads': 32, 'num_layers': 5, 'weight_decay': 0.0007794438764598863}
  #36  AP=0.6112  params: {'dropout': 0.05, 'ffn_ratio': 4, 'graph_pool': 'mean', 'hidden_dim': 384, 'hop_mode': 'window', 'hop_window': 2, 'lr': 0.000488634246806206, 'num_global_heads': 2, 'num_heads': 32, 'num_layers': 4, 'weight_decay': 0.0008842825681313607}
  #45  AP=0.6106  params: {'dropout': 0.05, 'ffn_ratio': 4, 'graph_pool': 'mean', 'hidden_dim': 384, 'hop_mode': 'window', 'hop_window': 1, 'lr': 0.0004893000057002949, 'num_global_heads': 0, 'num_heads': 32, 'num_layers': 4, 'weight_decay': 0.0018310007262777432}
  #30  AP=0.6060  params: {'dropout': 0.1, 'ffn_ratio': 4, 'graph_pool': 'mean', 'hidden_dim': 384, 'hop_mode': 'window', 'hop_window': 2, 'lr': 0.0003504045452042765, 'num_global_heads': 2, 'num_heads': 32, 'num_layers': 4, 'weight_decay': 0.0035783482290405923}

Recommended full training command:

  python train_hop_masked_transformer.py \
    --dataset Peptides-func \
    --max_hops 40 \
    --hidden_dim 384 \
    --num_heads 32 \
    --ffn_ratio 4 \
    --num_layers 3 \
    --dropout 0.05 \
    --hop_mode window \
    --hop_window 2 \
    --num_global_heads 2 \
    --graph_pool mean \
    --lr 0.00047616159061091327 \
    --weight_decay 0.0014185166601235076 \
    --batch_size 64 \
    --max_epochs 200 \
    --patience 40 \
    --save_dir checkpoints_hop_masked_optuna_best

