[I 2026-05-13 09:11:23,663] Trial 45 pruned. 
  [trial 46] epoch 00 73.8s (bs=32) | train MAE 0.5040 loss 0.5039 | val MAE 0.3705 | best 0.3705
  [trial 46] epoch 01 73.3s (bs=32) | train MAE 0.3730 loss 0.3731 | val MAE 0.3526 | best 0.3526
  [trial 46] epoch 02 73.3s (bs=32) | train MAE 0.3489 loss 0.3489 | val MAE 0.3390 | best 0.3390
  [trial 46] epoch 03 73.0s (bs=32) | train MAE 0.3313 loss 0.3313 | val MAE 0.3920 | best 0.3390
  [trial 46] epoch 04 73.6s (bs=32) | train MAE 0.3219 loss 0.3219 | val MAE 0.3702 | best 0.3390
  [trial 46] epoch 05 72.1s (bs=32) | train MAE 0.3196 loss 0.3196 | val MAE 0.3155 | best 0.3155
  [trial 46] epoch 06 72.4s (bs=32) | train MAE 0.3150 loss 0.3149 | val MAE 0.3013 | best 0.3013
  [trial 46] epoch 07 73.5s (bs=32) | train MAE 0.3099 loss 0.3100 | val MAE 0.3017 | best 0.3013
  [trial 46] epoch 08 75.0s (bs=32) | train MAE 0.3045 loss 0.3044 | val MAE 0.2977 | best 0.2977
  [trial 46] epoch 09 71.8s (bs=32) | train MAE 0.3031 loss 0.3032 | val MAE 0.2939 | best 0.2939
  [trial 46] epoch 10 71.8s (bs=32) | train MAE 0.3003 loss 0.3003 | val MAE 0.3005 | best 0.2939
  [trial 46] epoch 11 72.5s (bs=32) | train MAE 0.2963 loss 0.2963 | val MAE 0.2910 | best 0.2910
  [trial 46] epoch 12 74.2s (bs=32) | train MAE 0.2920 loss 0.2920 | val MAE 0.2928 | best 0.2910
  [trial 46] epoch 13 74.1s (bs=32) | train MAE 0.2884 loss 0.2884 | val MAE 0.2870 | best 0.2870
  [trial 46] epoch 14 73.1s (bs=32) | train MAE 0.2842 loss 0.2842 | val MAE 0.2870 | best 0.2870
  [trial 46] epoch 15 73.1s (bs=32) | train MAE 0.2808 loss 0.2808 | val MAE 0.2785 | best 0.2785
  [trial 46] epoch 16 73.3s (bs=32) | train MAE 0.2773 loss 0.2773 | val MAE 0.2873 | best 0.2785
  [trial 46] epoch 17 72.7s (bs=32) | train MAE 0.2746 loss 0.2746 | val MAE 0.2843 | best 0.2785
  [trial 46] epoch 18 73.8s (bs=32) | train MAE 0.2724 loss 0.2724 | val MAE 0.2844 | best 0.2785
  [trial 46] epoch 19 73.3s (bs=32) | train MAE 0.2723 loss 0.2723 | val MAE 0.2824 | best 0.2785
                                                                                       Best trial: 9. Best value: 0.268863:  92%|█████████▏| 46/50 [8:29:54<39:10, 587.74s/it]Best trial: 9. Best value: 0.268863:  92%|█████████▏| 46/50 [8:29:54<39:10, 587.74s/it]Best trial: 9. Best value: 0.268863:  94%|█████████▍| 47/50 [8:29:54<42:35, 851.90s/it][I 2026-05-13 09:35:51,952] Trial 46 finished with value: 0.2785427134383471 and parameters: {'hidden_dim': 640, 'num_heads': 40, 'ffn_ratio': 2, 'num_layers': 5, 'dropout': 0.3, 'hop_mode': 'window', 'hop_window': 3, 'num_global_heads': 3, 'graph_pool': 'sum', 'lr': 0.0003003660582819861, 'weight_decay': 0.0008197456566001095}. Best is trial 9 with value: 0.2688628450970329.
  [trial 47] epoch 00 41.0s (bs=32) | train MAE 0.5166 loss 0.5165 | val MAE 0.4480 | best 0.4480
  [trial 47] epoch 01 40.8s (bs=32) | train MAE 0.3969 loss 0.3969 | val MAE 0.4360 | best 0.4360
  [trial 47] epoch 02 40.9s (bs=32) | train MAE 0.3724 loss 0.3723 | val MAE 0.4607 | best 0.4360
  [trial 47] epoch 03 40.9s (bs=32) | train MAE 0.3642 loss 0.3642 | val MAE 0.5007 | best 0.4360
  [trial 47] epoch 04 41.3s (bs=32) | train MAE 0.3586 loss 0.3586 | val MAE 0.5159 | best 0.4360
  [trial 47] epoch 05 40.8s (bs=32) | train MAE 0.3554 loss 0.3554 | val MAE 0.5957 | best 0.4360
                                                                                       Best trial: 9. Best value: 0.268863:  94%|█████████▍| 47/50 [8:34:01<42:35, 851.90s/it]Best trial: 9. Best value: 0.268863:  94%|█████████▍| 47/50 [8:34:01<42:35, 851.90s/it]Best trial: 9. Best value: 0.268863:  96%|█████████▌| 48/50 [8:34:01<22:21, 670.64s/it]  [trial 47] PRUNED at epoch 5
[I 2026-05-13 09:39:59,631] Trial 47 pruned. 
  [trial 48] epoch 00 45.4s (bs=32) | train MAE 0.5741 loss 0.5740 | val MAE 0.3781 | best 0.3781
  [trial 48] epoch 01 44.2s (bs=32) | train MAE 0.3976 loss 0.3976 | val MAE 0.3757 | best 0.3757
  [trial 48] epoch 02 45.1s (bs=32) | train MAE 0.3584 loss 0.3584 | val MAE 0.3198 | best 0.3198
  [trial 48] epoch 03 44.9s (bs=32) | train MAE 0.3460 loss 0.3460 | val MAE 0.3314 | best 0.3198
  [trial 48] epoch 04 44.3s (bs=32) | train MAE 0.3395 loss 0.3395 | val MAE 0.3613 | best 0.3198
  [trial 48] epoch 05 45.4s (bs=32) | train MAE 0.3358 loss 0.3358 | val MAE 0.3489 | best 0.3198
                                                                                       Best trial: 9. Best value: 0.268863:  96%|█████████▌| 48/50 [8:38:33<22:21, 670.64s/it]Best trial: 9. Best value: 0.268863:  96%|█████████▌| 48/50 [8:38:33<22:21, 670.64s/it]Best trial: 9. Best value: 0.268863:  98%|█████████▊| 49/50 [8:38:33<09:10, 550.88s/it]  [trial 48] PRUNED at epoch 5
[I 2026-05-13 09:44:31,069] Trial 48 pruned. 
  [trial 49] epoch 00 52.8s (bs=32) | train MAE 0.4855 loss 0.4854 | val MAE 0.3536 | best 0.3536
  [trial 49] epoch 01 54.3s (bs=32) | train MAE 0.3759 loss 0.3759 | val MAE 0.3272 | best 0.3272
  [trial 49] epoch 02 53.2s (bs=32) | train MAE 0.3380 loss 0.3380 | val MAE 0.3070 | best 0.3070
  [trial 49] epoch 03 55.0s (bs=32) | train MAE 0.3371 loss 0.3371 | val MAE 0.2987 | best 0.2987
  [trial 49] epoch 04 53.8s (bs=32) | train MAE 0.3242 loss 0.3242 | val MAE 0.2958 | best 0.2958
  [trial 49] epoch 05 53.7s (bs=32) | train MAE 0.3154 loss 0.3153 | val MAE 0.2989 | best 0.2958
  [trial 49] epoch 06 52.1s (bs=32) | train MAE 0.3077 loss 0.3077 | val MAE 0.2861 | best 0.2861
  [trial 49] epoch 07 53.8s (bs=32) | train MAE 0.3060 loss 0.3060 | val MAE 0.2844 | best 0.2844
  [trial 49] epoch 08 53.6s (bs=32) | train MAE 0.2974 loss 0.2974 | val MAE 0.2778 | best 0.2778
  [trial 49] epoch 09 53.7s (bs=32) | train MAE 0.2943 loss 0.2943 | val MAE 0.2872 | best 0.2778
  [trial 49] epoch 10 55.8s (bs=32) | train MAE 0.2907 loss 0.2907 | val MAE 0.2801 | best 0.2778
  [trial 49] epoch 11 53.3s (bs=32) | train MAE 0.2902 loss 0.2902 | val MAE 0.2789 | best 0.2778
  [trial 49] epoch 12 53.6s (bs=32) | train MAE 0.2870 loss 0.2871 | val MAE 0.2736 | best 0.2736
  [trial 49] epoch 13 53.5s (bs=32) | train MAE 0.2830 loss 0.2829 | val MAE 0.2715 | best 0.2715
  [trial 49] epoch 14 54.0s (bs=32) | train MAE 0.2805 loss 0.2805 | val MAE 0.2752 | best 0.2715
  [trial 49] epoch 15 52.3s (bs=32) | train MAE 0.2779 loss 0.2779 | val MAE 0.2735 | best 0.2715
  [trial 49] epoch 16 53.3s (bs=32) | train MAE 0.2745 loss 0.2744 | val MAE 0.2711 | best 0.2711
  [trial 49] epoch 17 54.1s (bs=32) | train MAE 0.2720 loss 0.2720 | val MAE 0.2720 | best 0.2711
  [trial 49] epoch 18 53.9s (bs=32) | train MAE 0.2724 loss 0.2724 | val MAE 0.2716 | best 0.2711
  [trial 49] epoch 19 54.9s (bs=32) | train MAE 0.2710 loss 0.2710 | val MAE 0.2712 | best 0.2711
                                                                                       Best trial: 9. Best value: 0.268863:  98%|█████████▊| 49/50 [8:56:32<09:10, 550.88s/it]Best trial: 9. Best value: 0.268863:  98%|█████████▊| 49/50 [8:56:32<09:10, 550.88s/it]Best trial: 9. Best value: 0.268863: 100%|██████████| 50/50 [8:56:32<00:00, 709.33s/it]Best trial: 9. Best value: 0.268863: 100%|██████████| 50/50 [8:56:32<00:00, 643.85s/it]
[I 2026-05-13 10:02:30,126] Trial 49 finished with value: 0.27111131212873113 and parameters: {'hidden_dim': 640, 'num_heads': 20, 'ffn_ratio': 2, 'num_layers': 4, 'dropout': 0.2, 'hop_mode': 'contiguous', 'hop_window': 3, 'num_global_heads': 3, 'graph_pool': 'mean', 'lr': 0.0003809919827316244, 'weight_decay': 0.00021787221213636298}. Best is trial 9 with value: 0.2688628450970329.

========================================================================
OPTUNA SEARCH COMPLETE
========================================================================

Best trial #9
  Value (MAE): 0.268863
  Params (11):
    dropout: 0.1
    ffn_ratio: 2
    graph_pool: mean
    hidden_dim: 640
    hop_mode: contiguous
    hop_window: 2
    lr: 0.0005685255159708854
    num_global_heads: 2
    num_heads: 20
    num_layers: 2
    weight_decay: 0.0005759079044844154
  Model size: 7.508M params
  Actual batch size: 32

Saved to optuna_hop_masked_best.json

Top 5 trials:
  #9  MAE=0.2689  params: {'dropout': 0.1, 'ffn_ratio': 2, 'graph_pool': 'mean', 'hidden_dim': 640, 'hop_mode': 'contiguous', 'hop_window': 2, 'lr': 0.0005685255159708854, 'num_global_heads': 2, 'num_heads': 20, 'num_layers': 2, 'weight_decay': 0.0005759079044844154}
  #19  MAE=0.2702  params: {'dropout': 0.4, 'ffn_ratio': 2, 'graph_pool': 'mean', 'hidden_dim': 640, 'hop_mode': 'contiguous', 'hop_window': 3, 'lr': 0.0004148505379792427, 'num_global_heads': 1, 'num_heads': 40, 'num_layers': 3, 'weight_decay': 0.00010665983166589079}
  #49  MAE=0.2711  params: {'dropout': 0.2, 'ffn_ratio': 2, 'graph_pool': 'mean', 'hidden_dim': 640, 'hop_mode': 'contiguous', 'hop_window': 3, 'lr': 0.0003809919827316244, 'num_global_heads': 3, 'num_heads': 20, 'num_layers': 4, 'weight_decay': 0.00021787221213636298}
  #18  MAE=0.2727  params: {'dropout': 0.3, 'ffn_ratio': 2, 'graph_pool': 'mean', 'hidden_dim': 640, 'hop_mode': 'contiguous', 'hop_window': 3, 'lr': 0.0005996401743941695, 'num_global_heads': 2, 'num_heads': 40, 'num_layers': 3, 'weight_decay': 0.00011505837820109126}
  #41  MAE=0.2738  params: {'dropout': 0.35000000000000003, 'ffn_ratio': 2, 'graph_pool': 'mean', 'hidden_dim': 640, 'hop_mode': 'contiguous', 'hop_window': 2, 'lr': 0.0005528022581890588, 'num_global_heads': 2, 'num_heads': 40, 'num_layers': 3, 'weight_decay': 0.0003070562773755116}

Recommended full training command:

  python train_hop_masked_transformer.py \
    --dataset Peptides-struct \
    --max_hops 40 \
    --hidden_dim 640 \
    --num_heads 20 \
    --ffn_ratio 2 \
    --num_layers 2 \
    --dropout 0.1 \
    --hop_mode contiguous \
    --hop_window 2 \
    --num_global_heads 2 \
    --graph_pool mean \
    --lr 0.0005685255159708854 \
    --weight_decay 0.0005759079044844154 \
    --batch_size 64 \
    --max_epochs 200 \
    --patience 40 \
    --save_dir checkpoints_hop_masked_optuna_best

