[I 2026-05-13 11:48:13,697] Trial 24 finished with value: 0.5824162013276071 and parameters: {'hidden_dim': 384, 'num_heads': 32, 'ffn_ratio': 4, 'num_layers': 5, 'dropout': 0.2, 'hop_mode': 'window', 'hop_window': 2, 'num_global_heads': 0, 'graph_pool': 'sum', 'lr': 0.0003753537106395991, 'weight_decay': 1.0478748933755123e-05}. Best is trial 20 with value: 0.6121116060834857.
  [trial 25] epoch 00 76.7s (bs=32) | train AP 0.1900 loss 0.3770 | val AP 0.2813 | best 0.2813
  [trial 25] epoch 01 79.0s (bs=32) | train AP 0.2814 loss 0.3256 | val AP 0.3234 | best 0.3234
  [trial 25] epoch 02 77.3s (bs=32) | train AP 0.3128 loss 0.3116 | val AP 0.3536 | best 0.3536
  [trial 25] epoch 03 77.8s (bs=32) | train AP 0.3179 loss 0.3095 | val AP 0.3509 | best 0.3536
  [trial 25] epoch 04 77.0s (bs=32) | train AP 0.3208 loss 0.3081 | val AP 0.3574 | best 0.3574
  [trial 25] epoch 05 78.3s (bs=32) | train AP 0.3370 loss 0.3013 | val AP 0.3629 | best 0.3629
  [trial 25] PRUNED at epoch 5
[I 2026-05-13 11:56:01,110] Trial 25 pruned. 
  [trial 26] epoch 00 113.3s (bs=32) | train AP 0.2100 loss 0.3663 | val AP 0.3067 | best 0.3067
  [trial 26] epoch 01 113.4s (bs=32) | train AP 0.2987 loss 0.3175 | val AP 0.3573 | best 0.3573
  [trial 26] epoch 02 111.7s (bs=32) | train AP 0.3514 loss 0.2965 | val AP 0.3956 | best 0.3956
  [trial 26] epoch 03 114.1s (bs=32) | train AP 0.3758 loss 0.2852 | val AP 0.3987 | best 0.3987
  [trial 26] epoch 04 114.4s (bs=32) | train AP 0.3967 loss 0.2794 | val AP 0.4227 | best 0.4227
  [trial 26] epoch 05 114.1s (bs=32) | train AP 0.4148 loss 0.2713 | val AP 0.4400 | best 0.4400
  [trial 26] PRUNED at epoch 5
[I 2026-05-13 12:07:23,527] Trial 26 pruned. 
  [trial 27] epoch 00 105.4s (bs=32) | train AP 0.2059 loss 0.3714 | val AP 0.3112 | best 0.3112
  [trial 27] epoch 01 106.4s (bs=32) | train AP 0.3170 loss 0.3101 | val AP 0.3851 | best 0.3851
  [trial 27] epoch 02 103.7s (bs=32) | train AP 0.3699 loss 0.2889 | val AP 0.4069 | best 0.4069
  [trial 27] epoch 03 104.9s (bs=32) | train AP 0.3911 loss 0.2797 | val AP 0.4319 | best 0.4319
  [trial 27] epoch 04 103.7s (bs=32) | train AP 0.4098 loss 0.2713 | val AP 0.4454 | best 0.4454
  [trial 27] epoch 05 104.4s (bs=32) | train AP 0.4483 loss 0.2581 | val AP 0.4669 | best 0.4669
  [trial 27] epoch 06 105.4s (bs=32) | train AP 0.4675 loss 0.2509 | val AP 0.4818 | best 0.4818
  [trial 27] epoch 07 104.5s (bs=32) | train AP 0.4908 loss 0.2422 | val AP 0.4985 | best 0.4985
  [trial 27] epoch 08 105.9s (bs=32) | train AP 0.5184 loss 0.2328 | val AP 0.5062 | best 0.5062
  [trial 27] epoch 09 105.8s (bs=32) | train AP 0.5499 loss 0.2205 | val AP 0.5466 | best 0.5466
  [trial 27] epoch 10 104.6s (bs=32) | train AP 0.5786 loss 0.2097 | val AP 0.5474 | best 0.5474
  [trial 27] epoch 11 104.0s (bs=32) | train AP 0.6120 loss 0.1971 | val AP 0.5597 | best 0.5597
  [trial 27] epoch 12 104.1s (bs=32) | train AP 0.6391 loss 0.1862 | val AP 0.5739 | best 0.5739
  [trial 27] epoch 13 105.4s (bs=32) | train AP 0.6727 loss 0.1718 | val AP 0.5779 | best 0.5779
  [trial 27] epoch 14 104.9s (bs=32) | train AP 0.7039 loss 0.1591 | val AP 0.5882 | best 0.5882
  [trial 27] epoch 15 104.5s (bs=32) | train AP 0.7280 loss 0.1486 | val AP 0.5934 | best 0.5934
  [trial 27] epoch 16 103.4s (bs=32) | train AP 0.7559 loss 0.1390 | val AP 0.5899 | best 0.5934
  [trial 27] epoch 17 103.7s (bs=32) | train AP 0.7725 loss 0.1333 | val AP 0.5924 | best 0.5934
[Peptides-func] task=multi_label  metric=macro_ap (higher_is_better=True)
  Loading cached distance masks from ./data/Peptides-func/dist_masks/train.pkl
  Loading cached distance masks from ./data/Peptides-func/dist_masks/val.pkl
  Loading cached distance masks from ./data/Peptides-func/dist_masks/test.pkl
Subsampled train: 10873 → 5436 (50%)
Train batches: 170  Val batches: 73
Max epochs/trial: 20  Patience: 10
Optuna trials: 50  Pruning: True
========================================================================
Resuming study 'hop_masked_hparam_search' — 28 existing trials found.
Will run 22 new trials (target total: 50, existing: 28).
[W 2026-05-13 14:00:59,158] Trial 28 failed with parameters: {'hidden_dim': 384, 'num_heads': 32, 'ffn_ratio': 4, 'num_layers': 4, 'dropout': 0.1} because of the following error: ValueError('CategoricalDistribution does not support dynamic value space.').
Traceback (most recent call last):
  File "/home/sajan_rg/.local/lib/python3.12/site-packages/optuna/study/_optimize.py", line 206, in _run_trial
    value_or_values = func(trial)
                      ^^^^^^^^^^^
  File "/home/sajan_rg/graphormer_eval/new_experiments/graph_exp_new/optuna_hop_masked_search.py", line 215, in objective
    hp = suggest_hparams(trial)
         ^^^^^^^^^^^^^^^^^^^^^^
  File "/home/sajan_rg/graphormer_eval/new_experiments/graph_exp_new/optuna_hop_masked_search.py", line 126, in suggest_hparams
    hp["hop_mode"] = trial.suggest_categorical(
                     ^^^^^^^^^^^^^^^^^^^^^^^^^^
  File "/home/sajan_rg/.local/lib/python3.12/site-packages/optuna/trial/_trial.py", line 414, in suggest_categorical
    return self._suggest(name, CategoricalDistribution(choices=choices))
           ^^^^^^^^^^^^^^^^^^^^^^^^^^^^^^^^^^^^^^^^^^^^^^^^^^^^^^^^^^^^^
  File "/home/sajan_rg/.local/lib/python3.12/site-packages/optuna/trial/_trial.py", line 649, in _suggest
    storage.set_trial_param(trial_id, name, param_value_in_internal_repr, distribution)
  File "/home/sajan_rg/.local/lib/python3.12/site-packages/optuna/storages/_cached_storage.py", line 167, in set_trial_param
    self._backend._set_trial_param(
  File "/home/sajan_rg/.local/lib/python3.12/site-packages/optuna/storages/_rdb/storage.py", line 597, in _set_trial_param
    self._set_trial_param_without_commit(
  File "/home/sajan_rg/.local/lib/python3.12/site-packages/optuna/storages/_rdb/storage.py", line 632, in _set_trial_param_without_commit
    distributions.check_distribution_compatibility(previous_distribution, distribution)
  File "/home/sajan_rg/.local/lib/python3.12/site-packages/optuna/distributions.py", line 656, in check_distribution_compatibility
    raise ValueError(
ValueError: CategoricalDistribution does not support dynamic value space.
[W 2026-05-13 14:00:59,234] Trial 28 failed with value None.
[Peptides-func] task=multi_label  metric=macro_ap (higher_is_better=True)
  Loading cached distance masks from ./data/Peptides-func/dist_masks/train.pkl
  Loading cached distance masks from ./data/Peptides-func/dist_masks/val.pkl
  Loading cached distance masks from ./data/Peptides-func/dist_masks/test.pkl
Subsampled train: 10873 → 5436 (50%)
Train batches: 170  Val batches: 73
Max epochs/trial: 20  Patience: 10
Optuna trials: 50  Pruning: True
========================================================================
Resuming study 'hop_masked_hparam_search' — 29 existing trials found.
Will run 21 new trials (target total: 50, existing: 29).
[W 2026-05-13 14:01:22,163] Trial 29 failed with parameters: {'hidden_dim': 384, 'num_heads': 32, 'ffn_ratio': 4, 'num_layers': 4, 'dropout': 0.1} because of the following error: ValueError('CategoricalDistribution does not support dynamic value space.').
Traceback (most recent call last):
  File "/home/sajan_rg/.local/lib/python3.12/site-packages/optuna/study/_optimize.py", line 206, in _run_trial
    value_or_values = func(trial)
                      ^^^^^^^^^^^
  File "/home/sajan_rg/graphormer_eval/new_experiments/graph_exp_new/optuna_hop_masked_search.py", line 215, in objective
    hp = suggest_hparams(trial)
         ^^^^^^^^^^^^^^^^^^^^^^
  File "/home/sajan_rg/graphormer_eval/new_experiments/graph_exp_new/optuna_hop_masked_search.py", line 126, in suggest_hparams
    hp["hop_mode"] = trial.suggest_categorical(
                     ^^^^^^^^^^^^^^^^^^^^^^^^^^
  File "/home/sajan_rg/.local/lib/python3.12/site-packages/optuna/trial/_trial.py", line 414, in suggest_categorical
    return self._suggest(name, CategoricalDistribution(choices=choices))
           ^^^^^^^^^^^^^^^^^^^^^^^^^^^^^^^^^^^^^^^^^^^^^^^^^^^^^^^^^^^^^
  File "/home/sajan_rg/.local/lib/python3.12/site-packages/optuna/trial/_trial.py", line 649, in _suggest
    storage.set_trial_param(trial_id, name, param_value_in_internal_repr, distribution)
  File "/home/sajan_rg/.local/lib/python3.12/site-packages/optuna/storages/_cached_storage.py", line 167, in set_trial_param
    self._backend._set_trial_param(
  File "/home/sajan_rg/.local/lib/python3.12/site-packages/optuna/storages/_rdb/storage.py", line 597, in _set_trial_param
    self._set_trial_param_without_commit(
  File "/home/sajan_rg/.local/lib/python3.12/site-packages/optuna/storages/_rdb/storage.py", line 632, in _set_trial_param_without_commit
    distributions.check_distribution_compatibility(previous_distribution, distribution)
  File "/home/sajan_rg/.local/lib/python3.12/site-packages/optuna/distributions.py", line 656, in check_distribution_compatibility
    raise ValueError(
ValueError: CategoricalDistribution does not support dynamic value space.
[W 2026-05-13 14:01:22,167] Trial 29 failed with value None.
[Peptides-func] task=multi_label  metric=macro_ap (higher_is_better=True)
  Loading cached distance masks from ./data/Peptides-func/dist_masks/train.pkl
  Loading cached distance masks from ./data/Peptides-func/dist_masks/val.pkl
  Loading cached distance masks from ./data/Peptides-func/dist_masks/test.pkl
Subsampled train: 10873 → 5436 (50%)
Train batches: 170  Val batches: 73
Max epochs/trial: 20  Patience: 10
Optuna trials: 50  Pruning: True
========================================================================
Resuming study 'hop_masked_hparam_search' — 30 existing trials found.
Will run 20 new trials (target total: 50, existing: 30).
  [trial 30] epoch 00 103.7s (bs=32) | train AP 0.1967 loss 0.3817 | val AP 0.3021 | best 0.3021
  [trial 30] epoch 01 103.1s (bs=32) | train AP 0.3167 loss 0.3117 | val AP 0.3767 | best 0.3767
  [trial 30] epoch 02 102.4s (bs=32) | train AP 0.3595 loss 0.2939 | val AP 0.4027 | best 0.4027
  [trial 30] epoch 03 104.8s (bs=32) | train AP 0.3842 loss 0.2825 | val AP 0.4207 | best 0.4207
  [trial 30] epoch 04 102.9s (bs=32) | train AP 0.4094 loss 0.2730 | val AP 0.4507 | best 0.4507
  [trial 30] epoch 05 102.4s (bs=32) | train AP 0.4417 loss 0.2626 | val AP 0.4769 | best 0.4769
  [trial 30] epoch 06 105.2s (bs=32) | train AP 0.4658 loss 0.2536 | val AP 0.4877 | best 0.4877
  [trial 30] epoch 07 103.7s (bs=32) | train AP 0.5042 loss 0.2409 | val AP 0.5157 | best 0.5157
  [trial 30] epoch 08 102.3s (bs=32) | train AP 0.5312 loss 0.2288 | val AP 0.5270 | best 0.5270
  [trial 30] epoch 09 103.1s (bs=32) | train AP 0.5699 loss 0.2171 | val AP 0.5509 | best 0.5509
  [trial 30] epoch 10 102.7s (bs=32) | train AP 0.5975 loss 0.2027 | val AP 0.5519 | best 0.5519
  [trial 30] epoch 11 104.5s (bs=32) | train AP 0.6360 loss 0.1908 | val AP 0.5693 | best 0.5693
  [trial 30] epoch 12 104.8s (bs=32) | train AP 0.6703 loss 0.1765 | val AP 0.5905 | best 0.5905
  [trial 30] epoch 13 104.0s (bs=32) | train AP 0.7025 loss 0.1633 | val AP 0.6004 | best 0.6004
  [trial 30] epoch 14 102.4s (bs=32) | train AP 0.7433 loss 0.1481 | val AP 0.6051 | best 0.6051
  [trial 30] epoch 15 102.4s (bs=32) | train AP 0.7663 loss 0.1386 | val AP 0.6046 | best 0.6051
  [trial 30] epoch 16 104.1s (bs=32) | train AP 0.7911 loss 0.1288 | val AP 0.6005 | best 0.6051
  [trial 30] epoch 17 101.8s (bs=32) | train AP 0.8088 loss 0.1226 | val AP 0.6047 | best 0.6051
  [trial 30] epoch 18 102.6s (bs=32) | train AP 0.8149 loss 0.1185 | val AP 0.6060 | best 0.6060
  [trial 30] epoch 19 103.4s (bs=32) | train AP 0.8187 loss 0.1171 | val AP 0.6056 | best 0.6060
[I 2026-05-13 14:37:54,463] Trial 30 finished with value: 0.606009630652658 and parameters: {'hidden_dim': 384, 'num_heads': 32, 'ffn_ratio': 4, 'num_layers': 4, 'dropout': 0.1, 'hop_mode': 'window', 'hop_window': 2, 'num_global_heads': 2, 'graph_pool': 'mean', 'lr': 0.0003504045452042765, 'weight_decay': 0.0035783482290405923}. Best is trial 20 with value: 0.6121116060834857.
  [trial 31] epoch 00 102.9s (bs=32) | train AP 0.2028 loss 0.3745 | val AP 0.3026 | best 0.3026
  [trial 31] epoch 01 103.4s (bs=32) | train AP 0.3174 loss 0.3123 | val AP 0.3836 | best 0.3836
  [trial 31] epoch 02 102.2s (bs=32) | train AP 0.3670 loss 0.2905 | val AP 0.4002 | best 0.4002
  [trial 31] epoch 03 102.5s (bs=32) | train AP 0.3981 loss 0.2789 | val AP 0.4318 | best 0.4318
  [trial 31] epoch 04 103.1s (bs=32) | train AP 0.4251 loss 0.2683 | val AP 0.4513 | best 0.4513
  [trial 31] epoch 05 103.0s (bs=32) | train AP 0.4516 loss 0.2579 | val AP 0.4742 | best 0.4742
  [trial 31] epoch 06 104.0s (bs=32) | train AP 0.4756 loss 0.2489 | val AP 0.4974 | best 0.4974
  [trial 31] epoch 07 103.6s (bs=32) | train AP 0.5033 loss 0.2368 | val AP 0.5172 | best 0.5172
  [trial 31] epoch 08 103.4s (bs=32) | train AP 0.5195 loss 0.2315 | val AP 0.5313 | best 0.5313
  [trial 31] epoch 09 104.7s (bs=32) | train AP 0.5566 loss 0.2173 | val AP 0.5452 | best 0.5452
  [trial 31] epoch 10 102.7s (bs=32) | train AP 0.5847 loss 0.2069 | val AP 0.5598 | best 0.5598
  [trial 31] epoch 11 104.3s (bs=32) | train AP 0.6214 loss 0.1939 | val AP 0.5714 | best 0.5714
  [trial 31] epoch 12 104.4s (bs=32) | train AP 0.6429 loss 0.1845 | val AP 0.5780 | best 0.5780
  [trial 31] epoch 13 102.8s (bs=32) | train AP 0.6848 loss 0.1701 | val AP 0.5920 | best 0.5920
  [trial 31] epoch 14 103.3s (bs=32) | train AP 0.7113 loss 0.1581 | val AP 0.5978 | best 0.5978
  [trial 31] epoch 15 106.3s (bs=32) | train AP 0.7479 loss 0.1454 | val AP 0.5976 | best 0.5978
  [trial 31] epoch 16 102.9s (bs=32) | train AP 0.7692 loss 0.1374 | val AP 0.5981 | best 0.5981
  [trial 31] epoch 17 102.6s (bs=32) | train AP 0.7811 loss 0.1319 | val AP 0.6011 | best 0.6011
  [trial 31] epoch 18 103.3s (bs=32) | train AP 0.7900 loss 0.1287 | val AP 0.6018 | best 0.6018
  [trial 31] epoch 19 102.5s (bs=32) | train AP 0.7933 loss 0.1266 | val AP 0.6016 | best 0.6018
[I 2026-05-13 15:12:24,904] Trial 31 finished with value: 0.6018449227746626 and parameters: {'hidden_dim': 384, 'num_heads': 32, 'ffn_ratio': 4, 'num_layers': 4, 'dropout': 0.1, 'hop_mode': 'window', 'hop_window': 2, 'num_global_heads': 2, 'graph_pool': 'mean', 'lr': 0.00037121543934056636, 'weight_decay': 0.00042105261639098924}. Best is trial 20 with value: 0.6121116060834857.
  [trial 32] epoch 00 105.2s (bs=32) | train AP 0.2130 loss 0.3657 | val AP 0.3270 | best 0.3270
  [trial 32] epoch 01 105.2s (bs=32) | train AP 0.3259 loss 0.3083 | val AP 0.3844 | best 0.3844
  [trial 32] epoch 02 104.3s (bs=32) | train AP 0.3576 loss 0.2968 | val AP 0.4066 | best 0.4066
  [trial 32] epoch 03 103.5s (bs=32) | train AP 0.3836 loss 0.2848 | val AP 0.4049 | best 0.4066
  [trial 32] epoch 04 105.3s (bs=32) | train AP 0.4037 loss 0.2759 | val AP 0.4512 | best 0.4512
  [trial 32] epoch 05 103.0s (bs=32) | train AP 0.4258 loss 0.2679 | val AP 0.4678 | best 0.4678
  [trial 32] epoch 06 105.3s (bs=32) | train AP 0.4519 loss 0.2589 | val AP 0.4888 | best 0.4888
  [trial 32] epoch 07 105.0s (bs=32) | train AP 0.4691 loss 0.2520 | val AP 0.4807 | best 0.4888
  [trial 32] epoch 08 104.1s (bs=32) | train AP 0.4894 loss 0.2452 | val AP 0.5179 | best 0.5179
  [trial 32] epoch 09 104.6s (bs=32) | train AP 0.5160 loss 0.2356 | val AP 0.5183 | best 0.5183
  [trial 32] epoch 10 104.6s (bs=32) | train AP 0.5423 loss 0.2283 | val AP 0.5363 | best 0.5363
  [trial 32] epoch 11 105.3s (bs=32) | train AP 0.5634 loss 0.2181 | val AP 0.5558 | best 0.5558
  [trial 32] epoch 12 103.7s (bs=32) | train AP 0.5930 loss 0.2088 | val AP 0.5675 | best 0.5675
  [trial 32] epoch 13 103.6s (bs=32) | train AP 0.6193 loss 0.2007 | val AP 0.5766 | best 0.5766
  [trial 32] epoch 14 103.5s (bs=32) | train AP 0.6413 loss 0.1919 | val AP 0.5899 | best 0.5899
  [trial 32] epoch 15 102.8s (bs=32) | train AP 0.6656 loss 0.1828 | val AP 0.5884 | best 0.5899
  [trial 32] epoch 16 105.9s (bs=32) | train AP 0.6883 loss 0.1754 | val AP 0.5938 | best 0.5938
  [trial 32] epoch 17 103.5s (bs=32) | train AP 0.6942 loss 0.1712 | val AP 0.5923 | best 0.5938
  [trial 32] epoch 18 106.1s (bs=32) | train AP 0.7065 loss 0.1669 | val AP 0.5955 | best 0.5955
  [trial 32] epoch 19 105.6s (bs=32) | train AP 0.7062 loss 0.1667 | val AP 0.5944 | best 0.5955
[I 2026-05-13 15:47:17,517] Trial 32 finished with value: 0.5954678182659798 and parameters: {'hidden_dim': 512, 'num_heads': 32, 'ffn_ratio': 4, 'num_layers': 4, 'dropout': 0.2, 'hop_mode': 'window', 'hop_window': 2, 'num_global_heads': 2, 'graph_pool': 'mean', 'lr': 0.00036069428330277756, 'weight_decay': 0.0003619413501640486}. Best is trial 20 with value: 0.6121116060834857.
  [trial 33] epoch 00 71.1s (bs=32) | train AP 0.1953 loss 0.3749 | val AP 0.2742 | best 0.2742
  [trial 33] epoch 01 72.0s (bs=32) | train AP 0.2808 loss 0.3256 | val AP 0.3085 | best 0.3085
  [trial 33] epoch 02 72.9s (bs=32) | train AP 0.3172 loss 0.3130 | val AP 0.2950 | best 0.3085
  [trial 33] epoch 03 70.3s (bs=32) | train AP 0.2971 loss 0.3180 | val AP 0.3116 | best 0.3116
  [trial 33] epoch 04 72.1s (bs=32) | train AP 0.3191 loss 0.3103 | val AP 0.3356 | best 0.3356
  [trial 33] epoch 05 71.2s (bs=32) | train AP 0.3321 loss 0.3064 | val AP 0.3502 | best 0.3502
  [trial 33] PRUNED at epoch 5
[I 2026-05-13 15:54:28,408] Trial 33 pruned. 
  [trial 34] Model build failed: hidden_dim=128 must be divisible by num_heads=40
  [trial 34] params: {'hidden_dim': 128, 'num_heads': 40, 'ffn_ratio': 4, 'num_layers': 6, 'dropout': 0.3, 'hop_mode': 'window', 'hop_window': 2, 'num_global_heads': 1, 'graph_pool': 'mean', 'lr': 0.0003540548480025125, 'weight_decay': 0.000505942336279798}
[I 2026-05-13 15:54:29,464] Trial 34 pruned. 
  [trial 35] epoch 00 94.0s (bs=32) | train AP 0.2145 loss 0.3705 | val AP 0.3038 | best 0.3038
  [trial 35] epoch 01 91.6s (bs=32) | train AP 0.3197 loss 0.3094 | val AP 0.3777 | best 0.3777
  [trial 35] epoch 02 93.7s (bs=32) | train AP 0.3671 loss 0.2915 | val AP 0.4029 | best 0.4029
  [trial 35] epoch 03 92.2s (bs=32) | train AP 0.3985 loss 0.2771 | val AP 0.4441 | best 0.4441
  [trial 35] epoch 04 93.0s (bs=32) | train AP 0.4199 loss 0.2697 | val AP 0.4813 | best 0.4813
  [trial 35] epoch 05 93.8s (bs=32) | train AP 0.4540 loss 0.2580 | val AP 0.4666 | best 0.4813
  [trial 35] epoch 06 93.1s (bs=32) | train AP 0.4832 loss 0.2455 | val AP 0.5091 | best 0.5091
  [trial 35] epoch 07 93.8s (bs=32) | train AP 0.5008 loss 0.2388 | val AP 0.5190 | best 0.5190
  [trial 35] epoch 08 93.0s (bs=32) | train AP 0.5430 loss 0.2227 | val AP 0.5342 | best 0.5342
  [trial 35] epoch 09 91.9s (bs=32) | train AP 0.5707 loss 0.2119 | val AP 0.5593 | best 0.5593
  [trial 35] epoch 10 93.0s (bs=32) | train AP 0.6101 loss 0.1980 | val AP 0.5833 | best 0.5833
  [trial 35] epoch 11 93.4s (bs=32) | train AP 0.6483 loss 0.1839 | val AP 0.5809 | best 0.5833
  [trial 35] epoch 12 92.9s (bs=32) | train AP 0.6897 loss 0.1669 | val AP 0.6066 | best 0.6066
  [trial 35] epoch 13 94.3s (bs=32) | train AP 0.7299 loss 0.1485 | val AP 0.6065 | best 0.6066
  [trial 35] epoch 14 93.7s (bs=32) | train AP 0.7663 loss 0.1341 | val AP 0.6052 | best 0.6066
  [trial 35] epoch 15 93.3s (bs=32) | train AP 0.7925 loss 0.1224 | val AP 0.6076 | best 0.6076
  [trial 35] epoch 16 93.8s (bs=32) | train AP 0.8198 loss 0.1116 | val AP 0.6134 | best 0.6134
  [trial 35] epoch 17 91.5s (bs=32) | train AP 0.8375 loss 0.1044 | val AP 0.6145 | best 0.6145
  [trial 35] epoch 18 93.9s (bs=32) | train AP 0.8434 loss 0.1020 | val AP 0.6128 | best 0.6145
  [trial 35] epoch 19 92.9s (bs=32) | train AP 0.8485 loss 0.0993 | val AP 0.6135 | best 0.6145
[I 2026-05-13 16:25:34,778] Trial 35 finished with value: 0.6145012414827129 and parameters: {'hidden_dim': 384, 'num_heads': 32, 'ffn_ratio': 4, 'num_layers': 3, 'dropout': 0.05, 'hop_mode': 'window', 'hop_window': 2, 'num_global_heads': 2, 'graph_pool': 'mean', 'lr': 0.00047616159061091327, 'weight_decay': 0.0014185166601235076}. Best is trial 35 with value: 0.6145012414827129.
  [trial 36] epoch 00 101.8s (bs=32) | train AP 0.2166 loss 0.3683 | val AP 0.3168 | best 0.3168
  [trial 36] epoch 01 101.9s (bs=32) | train AP 0.3262 loss 0.3072 | val AP 0.3930 | best 0.3930
  [trial 36] epoch 02 103.0s (bs=32) | train AP 0.3776 loss 0.2871 | val AP 0.4097 | best 0.4097
  [trial 36] epoch 03 102.9s (bs=32) | train AP 0.3997 loss 0.2790 | val AP 0.4409 | best 0.4409
  [trial 36] epoch 04 103.0s (bs=32) | train AP 0.4290 loss 0.2680 | val AP 0.4572 | best 0.4572
  [trial 36] epoch 05 101.4s (bs=32) | train AP 0.4598 loss 0.2579 | val AP 0.4887 | best 0.4887
  [trial 36] epoch 06 103.4s (bs=32) | train AP 0.4953 loss 0.2457 | val AP 0.5055 | best 0.5055
  [trial 36] epoch 07 101.3s (bs=32) | train AP 0.5005 loss 0.2400 | val AP 0.5036 | best 0.5055
  [trial 36] epoch 08 103.1s (bs=32) | train AP 0.5187 loss 0.2340 | val AP 0.5286 | best 0.5286
  [trial 36] epoch 09 102.0s (bs=32) | train AP 0.5606 loss 0.2204 | val AP 0.5442 | best 0.5442
  [trial 36] epoch 10 104.1s (bs=32) | train AP 0.5857 loss 0.2111 | val AP 0.5560 | best 0.5560
  [trial 36] epoch 11 102.4s (bs=32) | train AP 0.6148 loss 0.1985 | val AP 0.5828 | best 0.5828
  [trial 36] epoch 12 102.5s (bs=32) | train AP 0.6625 loss 0.1816 | val AP 0.5919 | best 0.5919
  [trial 36] epoch 13 101.9s (bs=32) | train AP 0.7104 loss 0.1629 | val AP 0.5997 | best 0.5997
  [trial 36] epoch 14 102.6s (bs=32) | train AP 0.7491 loss 0.1466 | val AP 0.6047 | best 0.6047
  [trial 36] epoch 15 103.1s (bs=32) | train AP 0.7879 loss 0.1322 | val AP 0.6067 | best 0.6067
  [trial 36] epoch 16 104.4s (bs=32) | train AP 0.8143 loss 0.1205 | val AP 0.6092 | best 0.6092
  [trial 36] epoch 17 102.7s (bs=32) | train AP 0.8337 loss 0.1117 | val AP 0.6083 | best 0.6092
  [trial 36] epoch 18 102.3s (bs=32) | train AP 0.8462 loss 0.1077 | val AP 0.6112 | best 0.6112
  [trial 36] epoch 19 99.9s (bs=32) | train AP 0.8523 loss 0.1053 | val AP 0.6104 | best 0.6112
