[I 2026-05-13 01:34:28,059] Trial 36 pruned. 
  [trial 37] epoch 00 97.6s (bs=32) | train AP 0.2112 loss 0.4060 | val AP 0.2801 | best 0.2801
  [trial 37] epoch 01 93.7s (bs=32) | train AP 0.2581 loss 0.3311 | val AP 0.2908 | best 0.2908
  [trial 37] epoch 02 93.4s (bs=32) | train AP 0.2647 loss 0.3275 | val AP 0.2931 | best 0.2931
  [trial 37] epoch 03 92.4s (bs=32) | train AP 0.2684 loss 0.3258 | val AP 0.2966 | best 0.2966
  [trial 37] epoch 04 93.0s (bs=32) | train AP 0.2820 loss 0.3205 | val AP 0.3170 | best 0.3170
  [trial 37] epoch 05 93.9s (bs=32) | train AP 0.3045 loss 0.3127 | val AP 0.3298 | best 0.3298
  [trial 37] epoch 06 93.3s (bs=32) | train AP 0.3165 loss 0.3072 | val AP 0.3395 | best 0.3395
  [trial 37] epoch 07 94.0s (bs=32) | train AP 0.3319 loss 0.3027 | val AP 0.3558 | best 0.3558
  [trial 37] epoch 08 94.3s (bs=32) | train AP 0.3411 loss 0.2986 | val AP 0.3575 | best 0.3575
  [trial 37] epoch 09 93.5s (bs=32) | train AP 0.3471 loss 0.2957 | val AP 0.3601 | best 0.3601
[I 2026-05-13 01:50:10,506] Trial 37 finished with value: 0.36008829198007813 and parameters: {'hidden_dim': 96, 'num_layers': 1, 'num_heads': 8, 'num_cross_layers': 2, 'generator': 'graph_coarsening', 'num_proxies': 256, 'score_layers': 3, 'score_heads': 8, 'gnn_layers': 9, 'decode_hidden': 64, 'decode_layers': 3, 'coarsen_reg_weight': 0.30000000000000004, 'hop_dim': 8, 'fuse_mode': 'concat_proj', 'khop_per_block': False, 'khop_num_heads': 4, 'share_blocks': True, 'use_proxy_self_attn': False, 'final_sa_layers': 0, 'dropout': 0.15000000000000002, 'aux_loss_weight': 1.0, 'lr': 0.00042051873411194586, 'weight_decay': 9.283907617294637e-05}. Best is trial 28 with value: 0.3926341547056777.
  [trial 38] epoch 00 158.8s (bs=32) | train AP 0.2109 loss 0.4091 | val AP 0.2727 | best 0.2727
  [trial 38] epoch 01 180.5s (bs=32) | train AP 0.2683 loss 0.3273 | val AP 0.2873 | best 0.2873
  [trial 38] epoch 02 173.4s (bs=32) | train AP 0.2717 loss 0.3248 | val AP 0.2975 | best 0.2975
  [trial 38] epoch 03 175.9s (bs=32) | train AP 0.2840 loss 0.3210 | val AP 0.3174 | best 0.3174
  [trial 38] epoch 04 158.4s (bs=32) | train AP 0.3033 loss 0.3143 | val AP 0.3302 | best 0.3302
  [trial 38] epoch 05 157.0s (bs=32) | train AP 0.3080 loss 0.3117 | val AP 0.3363 | best 0.3363
  [trial 38] epoch 06 157.4s (bs=32) | train AP 0.3216 loss 0.3068 | val AP 0.3369 | best 0.3369
  [trial 38] epoch 07 162.5s (bs=32) | train AP 0.3295 loss 0.3040 | val AP 0.3450 | best 0.3450
  [trial 38] epoch 08 162.6s (bs=32) | train AP 0.3365 loss 0.3014 | val AP 0.3464 | best 0.3464
  [trial 38] epoch 09 182.6s (bs=32) | train AP 0.3350 loss 0.3012 | val AP 0.3464 | best 0.3464
[I 2026-05-13 02:18:02,624] Trial 38 finished with value: 0.34641549250487796 and parameters: {'hidden_dim': 128, 'num_layers': 1, 'num_heads': 4, 'num_cross_layers': 2, 'generator': 'pma', 'num_proxies': 256, 'score_layers': 3, 'score_heads': 8, 'gnn_layers': 9, 'decode_hidden': 256, 'decode_layers': 3, 'coarsen_reg_weight': 0.30000000000000004, 'hop_dim': 8, 'fuse_mode': 'sum_proj', 'khop_per_block': True, 'khop_num_heads': 8, 'share_blocks': True, 'use_proxy_self_attn': False, 'final_sa_layers': 0, 'dropout': 0.1, 'aux_loss_weight': 0.5, 'lr': 0.0004220809765946087, 'weight_decay': 0.0001385542839414785}. Best is trial 28 with value: 0.3926341547056777.
  [trial 39] epoch 00 106.1s (bs=32) | train AP 0.2018 loss 0.4205 | val AP 0.2759 | best 0.2759
  [trial 39] epoch 01 101.7s (bs=32) | train AP 0.2538 loss 0.3299 | val AP 0.2777 | best 0.2777
  [trial 39] epoch 02 101.2s (bs=32) | train AP 0.2643 loss 0.3251 | val AP 0.2910 | best 0.2910
  [trial 39] epoch 03 101.6s (bs=32) | train AP 0.2681 loss 0.3241 | val AP 0.2925 | best 0.2925
  [trial 39] epoch 04 101.3s (bs=32) | train AP 0.2752 loss 0.3228 | val AP 0.3007 | best 0.3007
  [trial 39] epoch 05 101.5s (bs=32) | train AP 0.2835 loss 0.3190 | val AP 0.3120 | best 0.3120
  [trial 39] PRUNED at epoch 5
[I 2026-05-13 02:28:18,296] Trial 39 pruned. 
  [trial 40] epoch 00 177.6s (bs=32) | train AP 0.2255 loss 0.3753 | val AP 0.2863 | best 0.2863
  [trial 40] epoch 01 185.1s (bs=32) | train AP 0.2619 loss 0.3297 | val AP 0.2896 | best 0.2896
  [trial 40] epoch 02 179.7s (bs=32) | train AP 0.2643 loss 0.3279 | val AP 0.2863 | best 0.2896
  [trial 40] epoch 03 187.0s (bs=32) | train AP 0.2655 loss 0.3261 | val AP 0.2868 | best 0.2896
  [trial 40] epoch 04 184.5s (bs=32) | train AP 0.2704 loss 0.3245 | val AP 0.2940 | best 0.2940
  [trial 40] epoch 05 175.2s (bs=32) | train AP 0.2744 loss 0.3238 | val AP 0.3115 | best 0.3115
  [trial 40] PRUNED at epoch 5
[I 2026-05-13 02:46:29,803] Trial 40 pruned. 
  [trial 41] epoch 00 394.0s (bs=32) | train AP 0.1998 loss 0.4362 | val AP 0.2604 | best 0.2604
  [trial 41] epoch 01 393.6s (bs=32) | train AP 0.2519 loss 0.3338 | val AP 0.2817 | best 0.2817
  [trial 41] epoch 02 393.6s (bs=32) | train AP 0.2626 loss 0.3279 | val AP 0.2872 | best 0.2872
  [trial 41] epoch 03 396.2s (bs=32) | train AP 0.2682 loss 0.3253 | val AP 0.3064 | best 0.3064
  [trial 41] epoch 04 394.9s (bs=32) | train AP 0.2816 loss 0.3209 | val AP 0.3173 | best 0.3173
  [trial 41] epoch 05 396.6s (bs=32) | train AP 0.3016 loss 0.3119 | val AP 0.3331 | best 0.3331
  [trial 41] epoch 06 396.0s (bs=32) | train AP 0.3203 loss 0.3052 | val AP 0.3520 | best 0.3520
  [trial 41] epoch 07 397.5s (bs=32) | train AP 0.3455 loss 0.2965 | val AP 0.3626 | best 0.3626
  [trial 41] epoch 08 396.8s (bs=32) | train AP 0.3601 loss 0.2901 | val AP 0.3665 | best 0.3665
  [trial 41] epoch 09 395.9s (bs=32) | train AP 0.3715 loss 0.2866 | val AP 0.3678 | best 0.3678
[I 2026-05-13 03:52:27,857] Trial 41 finished with value: 0.3678380134114305 and parameters: {'hidden_dim': 64, 'num_layers': 4, 'num_heads': 4, 'num_cross_layers': 2, 'generator': 'pma', 'num_proxies': 64, 'score_layers': 3, 'score_heads': 4, 'gnn_layers': 6, 'decode_hidden': 256, 'decode_layers': 3, 'coarsen_reg_weight': 0.4, 'hop_dim': 32, 'fuse_mode': 'concat_proj', 'khop_per_block': False, 'khop_num_heads': 8, 'share_blocks': True, 'use_proxy_self_attn': False, 'final_sa_layers': 0, 'dropout': 0.1, 'aux_loss_weight': 1.0, 'lr': 0.0004063257254144834, 'weight_decay': 1.8612874983806093e-05}. Best is trial 28 with value: 0.3926341547056777.
  [trial 42] epoch 00 396.3s (bs=32) | train AP 0.2001 loss 0.4435 | val AP 0.2632 | best 0.2632
  [trial 42] epoch 01 394.1s (bs=32) | train AP 0.2499 loss 0.3329 | val AP 0.2783 | best 0.2783
  [trial 42] epoch 02 394.8s (bs=32) | train AP 0.2630 loss 0.3275 | val AP 0.2996 | best 0.2996
  [trial 42] epoch 03 392.8s (bs=32) | train AP 0.2692 loss 0.3254 | val AP 0.3040 | best 0.3040
  [trial 42] epoch 04 394.3s (bs=32) | train AP 0.2796 loss 0.3214 | val AP 0.3152 | best 0.3152
  [trial 42] epoch 05 394.0s (bs=32) | train AP 0.2993 loss 0.3136 | val AP 0.3346 | best 0.3346
  [trial 42] epoch 06 397.8s (bs=32) | train AP 0.3122 loss 0.3070 | val AP 0.3447 | best 0.3447
  [trial 42] epoch 07 399.1s (bs=32) | train AP 0.3365 loss 0.2989 | val AP 0.3590 | best 0.3590
  [trial 42] epoch 08 398.1s (bs=32) | train AP 0.3562 loss 0.2928 | val AP 0.3831 | best 0.3831
  [trial 42] epoch 09 398.6s (bs=32) | train AP 0.3652 loss 0.2882 | val AP 0.3840 | best 0.3840
[I 2026-05-13 04:58:30,685] Trial 42 finished with value: 0.38399645743424954 and parameters: {'hidden_dim': 64, 'num_layers': 4, 'num_heads': 4, 'num_cross_layers': 2, 'generator': 'pma', 'num_proxies': 64, 'score_layers': 3, 'score_heads': 4, 'gnn_layers': 6, 'decode_hidden': 256, 'decode_layers': 3, 'coarsen_reg_weight': 0.4, 'hop_dim': 32, 'fuse_mode': 'concat_proj', 'khop_per_block': False, 'khop_num_heads': 8, 'share_blocks': True, 'use_proxy_self_attn': False, 'final_sa_layers': 0, 'dropout': 0.1, 'aux_loss_weight': 1.0, 'lr': 0.00040037181555094953, 'weight_decay': 1.9317153642586336e-05}. Best is trial 28 with value: 0.3926341547056777.
  [trial 43] epoch 00 395.0s (bs=32) | train AP 0.2022 loss 0.4390 | val AP 0.2601 | best 0.2601
  [trial 43] epoch 01 395.8s (bs=32) | train AP 0.2507 loss 0.3335 | val AP 0.2825 | best 0.2825
  [trial 43] epoch 02 394.0s (bs=32) | train AP 0.2679 loss 0.3271 | val AP 0.2867 | best 0.2867
  [trial 43] epoch 03 400.3s (bs=32) | train AP 0.2653 loss 0.3255 | val AP 0.3032 | best 0.3032
  [trial 43] epoch 04 395.1s (bs=32) | train AP 0.2777 loss 0.3221 | val AP 0.3073 | best 0.3073
  [trial 43] epoch 05 394.1s (bs=32) | train AP 0.2883 loss 0.3174 | val AP 0.3218 | best 0.3218
  [trial 43] epoch 06 397.4s (bs=32) | train AP 0.3044 loss 0.3108 | val AP 0.3337 | best 0.3337
  [trial 43] epoch 07 394.1s (bs=32) | train AP 0.3184 loss 0.3064 | val AP 0.3417 | best 0.3417
  [trial 43] epoch 08 393.4s (bs=32) | train AP 0.3247 loss 0.3034 | val AP 0.3450 | best 0.3450
  [trial 43] epoch 09 392.6s (bs=32) | train AP 0.3310 loss 0.3015 | val AP 0.3455 | best 0.3455
[I 2026-05-13 06:04:25,359] Trial 43 finished with value: 0.34545207578466375 and parameters: {'hidden_dim': 64, 'num_layers': 4, 'num_heads': 4, 'num_cross_layers': 2, 'generator': 'pma', 'num_proxies': 64, 'score_layers': 3, 'score_heads': 4, 'gnn_layers': 6, 'decode_hidden': 256, 'decode_layers': 3, 'coarsen_reg_weight': 0.45, 'hop_dim': 32, 'fuse_mode': 'concat_proj', 'khop_per_block': False, 'khop_num_heads': 8, 'share_blocks': True, 'use_proxy_self_attn': False, 'final_sa_layers': 0, 'dropout': 0.1, 'aux_loss_weight': 0.75, 'lr': 0.0003337955320050492, 'weight_decay': 1.0202859106557637e-05}. Best is trial 28 with value: 0.3926341547056777.
  [trial 44] epoch 00 399.3s (bs=32) | train AP 0.1829 loss 0.4366 | val AP 0.2726 | best 0.2726
  [trial 44] epoch 01 398.6s (bs=32) | train AP 0.2562 loss 0.3308 | val AP 0.2863 | best 0.2863
  [trial 44] epoch 02 397.7s (bs=32) | train AP 0.2670 loss 0.3254 | val AP 0.2906 | best 0.2906
  [trial 44] epoch 03 392.2s (bs=32) | train AP 0.2669 loss 0.3241 | val AP 0.2972 | best 0.2972
  [trial 44] epoch 04 391.5s (bs=32) | train AP 0.2718 loss 0.3221 | val AP 0.3056 | best 0.3056
  [trial 44] epoch 05 392.5s (bs=32) | train AP 0.2877 loss 0.3167 | val AP 0.3119 | best 0.3119
  [trial 44] PRUNED at epoch 5
[I 2026-05-13 06:43:59,526] Trial 44 pruned. 
  [trial 45] epoch 00 389.8s (bs=32) | train AP 0.1864 loss 0.4012 | val AP 0.2628 | best 0.2628
  [trial 45] epoch 01 396.6s (bs=32) | train AP 0.2559 loss 0.3312 | val AP 0.2927 | best 0.2927
  [trial 45] epoch 02 389.4s (bs=32) | train AP 0.2603 loss 0.3276 | val AP 0.2832 | best 0.2927
  [trial 45] epoch 03 393.4s (bs=32) | train AP 0.2726 loss 0.3241 | val AP 0.3048 | best 0.3048
  [trial 45] epoch 04 397.5s (bs=32) | train AP 0.2867 loss 0.3185 | val AP 0.3165 | best 0.3165
  [trial 45] epoch 05 394.5s (bs=32) | train AP 0.3012 loss 0.3128 | val AP 0.3352 | best 0.3352
  [trial 45] epoch 06 390.6s (bs=32) | train AP 0.3243 loss 0.3051 | val AP 0.3523 | best 0.3523
  [trial 45] epoch 07 389.7s (bs=32) | train AP 0.3383 loss 0.2994 | val AP 0.3627 | best 0.3627
  [trial 45] epoch 08 393.6s (bs=32) | train AP 0.3527 loss 0.2941 | val AP 0.3768 | best 0.3768
  [trial 45] epoch 09 395.7s (bs=32) | train AP 0.3602 loss 0.2914 | val AP 0.3758 | best 0.3768
[I 2026-05-13 07:49:33,301] Trial 45 finished with value: 0.3767601740615813 and parameters: {'hidden_dim': 64, 'num_layers': 4, 'num_heads': 4, 'num_cross_layers': 2, 'generator': 'pma', 'num_proxies': 64, 'score_layers': 3, 'score_heads': 4, 'gnn_layers': 6, 'decode_hidden': 256, 'decode_layers': 3, 'coarsen_reg_weight': 0.4, 'hop_dim': 32, 'fuse_mode': 'concat_proj', 'khop_per_block': False, 'khop_num_heads': 8, 'share_blocks': True, 'use_proxy_self_attn': False, 'final_sa_layers': 0, 'dropout': 0.1, 'aux_loss_weight': 1.0, 'lr': 0.0004768407321818466, 'weight_decay': 1.3735117330012601e-05}. Best is trial 28 with value: 0.3926341547056777.
  [trial 46] epoch 00 398.2s (bs=32) | train AP 0.1969 loss 0.4177 | val AP 0.2727 | best 0.2727
  [trial 46] epoch 01 402.9s (bs=32) | train AP 0.2557 loss 0.3310 | val AP 0.2923 | best 0.2923
  [trial 46] epoch 02 403.2s (bs=32) | train AP 0.2642 loss 0.3272 | val AP 0.2919 | best 0.2923
  [trial 46] epoch 03 403.6s (bs=32) | train AP 0.2688 loss 0.3258 | val AP 0.2917 | best 0.2923
  [trial 46] epoch 04 410.3s (bs=32) | train AP 0.2712 loss 0.3230 | val AP 0.2981 | best 0.2981
  [trial 46] epoch 05 423.9s (bs=32) | train AP 0.2832 loss 0.3195 | val AP 0.3108 | best 0.3108
  [trial 46] PRUNED at epoch 5
[I 2026-05-13 08:30:17,514] Trial 46 pruned. 
