                                                                                         Best trial: 9. Best value: 0.268863:  64%|██████▍   | 32/50 [5:56:13<2:47:26, 558.13s/it]Best trial: 9. Best value: 0.268863:  64%|██████▍   | 32/50 [5:56:13<2:47:26, 558.13s/it]Best trial: 9. Best value: 0.268863:  66%|██████▌   | 33/50 [5:56:13<3:27:48, 733.44s/it][I 2026-05-13 07:02:11,411] Trial 32 finished with value: 0.2784664714666212 and parameters: {'hidden_dim': 640, 'num_heads': 40, 'ffn_ratio': 2, 'num_layers': 3, 'dropout': 0.4, 'hop_mode': 'contiguous', 'hop_window': 4, 'num_global_heads': 2, 'graph_pool': 'mean', 'lr': 0.00044023802253349603, 'weight_decay': 5.3497436104764686e-05}. Best is trial 9 with value: 0.2688628450970329.
  [trial 33] epoch 00 51.6s (bs=32) | train MAE 0.4903 loss 0.4901 | val MAE 0.3411 | best 0.3411
  [trial 33] epoch 01 51.1s (bs=32) | train MAE 0.3562 loss 0.3561 | val MAE 0.3076 | best 0.3076
  [trial 33] epoch 02 51.5s (bs=32) | train MAE 0.3391 loss 0.3391 | val MAE 0.3246 | best 0.3076
  [trial 33] epoch 03 51.7s (bs=32) | train MAE 0.3326 loss 0.3325 | val MAE 0.3353 | best 0.3076
  [trial 33] epoch 04 50.4s (bs=32) | train MAE 0.3374 loss 0.3374 | val MAE 0.3364 | best 0.3076
  [trial 33] epoch 05 51.6s (bs=32) | train MAE 0.3231 loss 0.3231 | val MAE 0.3009 | best 0.3009
  [trial 33] epoch 06 52.6s (bs=32) | train MAE 0.3186 loss 0.3186 | val MAE 0.3531 | best 0.3009
  [trial 33] epoch 07 51.5s (bs=32) | train MAE 0.3116 loss 0.3116 | val MAE 0.3031 | best 0.3009
  [trial 33] epoch 08 51.3s (bs=32) | train MAE 0.3065 loss 0.3065 | val MAE 0.3026 | best 0.3009
  [trial 33] epoch 09 50.4s (bs=32) | train MAE 0.3010 loss 0.3010 | val MAE 0.2962 | best 0.2962
  [trial 33] epoch 10 51.5s (bs=32) | train MAE 0.2986 loss 0.2986 | val MAE 0.3062 | best 0.2962
  [trial 33] epoch 11 51.5s (bs=32) | train MAE 0.2981 loss 0.2982 | val MAE 0.2899 | best 0.2899
  [trial 33] epoch 12 51.5s (bs=32) | train MAE 0.2909 loss 0.2909 | val MAE 0.2920 | best 0.2899
  [trial 33] epoch 13 51.5s (bs=32) | train MAE 0.2900 loss 0.2901 | val MAE 0.3092 | best 0.2899
  [trial 33] epoch 14 51.7s (bs=32) | train MAE 0.2870 loss 0.2870 | val MAE 0.2917 | best 0.2899
                                                                                         Best trial: 9. Best value: 0.268863:  66%|██████▌   | 33/50 [6:09:08<3:27:48, 733.44s/it]Best trial: 9. Best value: 0.268863:  66%|██████▌   | 33/50 [6:09:08<3:27:48, 733.44s/it]Best trial: 9. Best value: 0.268863:  68%|██████▊   | 34/50 [6:09:08<3:18:54, 745.89s/it]                                                                                         Best trial: 9. Best value: 0.268863:  68%|██████▊   | 34/50 [6:09:10<3:18:54, 745.89s/it]Best trial: 9. Best value: 0.268863:  68%|██████▊   | 34/50 [6:09:10<3:18:54, 745.89s/it]Best trial: 9. Best value: 0.268863:  70%|███████   | 35/50 [6:09:10<2:10:38, 522.54s/it]  [trial 33] PRUNED at epoch 14
[I 2026-05-13 07:15:06,343] Trial 33 pruned. 
  [trial 34] Model build failed: hidden_dim=384 must be divisible by num_heads=40
  [trial 34] params: {'hidden_dim': 384, 'num_heads': 40, 'ffn_ratio': 2, 'num_layers': 4, 'dropout': 0.35000000000000003, 'hop_mode': 'window', 'hop_window': 2, 'num_global_heads': 2, 'graph_pool': 'mean', 'lr': 0.00035335661374299223, 'weight_decay': 9.021090643367376e-05}
[I 2026-05-13 07:15:07,751] Trial 34 pruned. 
  [trial 35] epoch 00 45.4s (bs=32) | train MAE 0.4883 loss 0.4884 | val MAE 0.6597 | best 0.6597
  [trial 35] epoch 01 45.8s (bs=32) | train MAE 0.3898 loss 0.3897 | val MAE 0.3690 | best 0.3690
  [trial 35] epoch 02 46.6s (bs=32) | train MAE 0.3630 loss 0.3630 | val MAE 0.3646 | best 0.3646
  [trial 35] epoch 03 45.9s (bs=32) | train MAE 0.3547 loss 0.3547 | val MAE 0.3550 | best 0.3550
  [trial 35] epoch 04 46.9s (bs=32) | train MAE 0.3503 loss 0.3503 | val MAE 0.3726 | best 0.3550
  [trial 35] epoch 05 46.1s (bs=32) | train MAE 0.3440 loss 0.3440 | val MAE 0.3562 | best 0.3550
                                                                                         Best trial: 9. Best value: 0.268863:  70%|███████   | 35/50 [6:13:48<2:10:38, 522.54s/it]Best trial: 9. Best value: 0.268863:  70%|███████   | 35/50 [6:13:48<2:10:38, 522.54s/it]Best trial: 9. Best value: 0.268863:  72%|███████▏  | 36/50 [6:13:48<1:44:52, 449.45s/it]                                                                                         Best trial: 9. Best value: 0.268863:  72%|███████▏  | 36/50 [6:13:50<1:44:52, 449.45s/it]Best trial: 9. Best value: 0.268863:  72%|███████▏  | 36/50 [6:13:50<1:44:52, 449.45s/it]Best trial: 9. Best value: 0.268863:  74%|███████▍  | 37/50 [6:13:50<1:08:15, 315.04s/it]  [trial 35] PRUNED at epoch 5
[I 2026-05-13 07:19:46,647] Trial 35 pruned. 
  [trial 36] Model build failed: hidden_dim=512 must be divisible by num_heads=40
  [trial 36] params: {'hidden_dim': 512, 'num_heads': 40, 'ffn_ratio': 2, 'num_layers': 6, 'dropout': 0.05, 'hop_mode': 'window', 'hop_window': 2, 'num_global_heads': 3, 'graph_pool': 'sum', 'lr': 0.0006100776096936257, 'weight_decay': 0.0009728772842966102}
[I 2026-05-13 07:19:48,066] Trial 36 pruned. 
  [trial 37] epoch 00 48.8s (bs=32) | train MAE 0.5058 loss 0.5057 | val MAE 0.3439 | best 0.3439
  [trial 37] epoch 01 50.0s (bs=32) | train MAE 0.3807 loss 0.3807 | val MAE 0.3241 | best 0.3241
  [trial 37] epoch 02 48.8s (bs=32) | train MAE 0.3464 loss 0.3463 | val MAE 0.3097 | best 0.3097
  [trial 37] epoch 03 49.1s (bs=32) | train MAE 0.3329 loss 0.3330 | val MAE 0.3431 | best 0.3097
  [trial 37] epoch 04 48.4s (bs=32) | train MAE 0.3281 loss 0.3280 | val MAE 0.3011 | best 0.3011
  [trial 37] epoch 05 50.1s (bs=32) | train MAE 0.3190 loss 0.3190 | val MAE 0.2935 | best 0.2935
  [trial 37] epoch 06 49.3s (bs=32) | train MAE 0.3198 loss 0.3198 | val MAE 0.3230 | best 0.2935
  [trial 37] epoch 07 48.8s (bs=32) | train MAE 0.3188 loss 0.3188 | val MAE 0.2987 | best 0.2935
  [trial 37] epoch 08 49.7s (bs=32) | train MAE 0.3123 loss 0.3123 | val MAE 0.3065 | best 0.2935
  [trial 37] epoch 09 48.9s (bs=32) | train MAE 0.3058 loss 0.3058 | val MAE 0.2997 | best 0.2935
  [trial 37] epoch 10 49.6s (bs=32) | train MAE 0.3011 loss 0.3013 | val MAE 0.2885 | best 0.2885
  [trial 37] epoch 11 49.7s (bs=32) | train MAE 0.2973 loss 0.2973 | val MAE 0.2930 | best 0.2885
  [trial 37] epoch 12 49.5s (bs=32) | train MAE 0.2957 loss 0.2956 | val MAE 0.2823 | best 0.2823
  [trial 37] epoch 13 49.6s (bs=32) | train MAE 0.2919 loss 0.2920 | val MAE 0.2890 | best 0.2823
  [trial 37] epoch 14 48.9s (bs=32) | train MAE 0.2905 loss 0.2907 | val MAE 0.2833 | best 0.2823
  [trial 37] epoch 15 49.2s (bs=32) | train MAE 0.2890 loss 0.2890 | val MAE 0.2947 | best 0.2823
  [trial 37] epoch 16 48.6s (bs=32) | train MAE 0.2862 loss 0.2862 | val MAE 0.2916 | best 0.2823
                                                                                         Best trial: 9. Best value: 0.268863:  74%|███████▍  | 37/50 [6:27:50<1:08:15, 315.04s/it]Best trial: 9. Best value: 0.268863:  74%|███████▍  | 37/50 [6:27:50<1:08:15, 315.04s/it]Best trial: 9. Best value: 0.268863:  76%|███████▌  | 38/50 [6:27:50<1:34:32, 472.71s/it]  [trial 37] PRUNED at epoch 16
[I 2026-05-13 07:33:48,684] Trial 37 pruned. 
  [trial 38] epoch 00 42.5s (bs=32) | train MAE 0.5534 loss 0.5533 | val MAE 0.7047 | best 0.7047
  [trial 38] epoch 01 45.7s (bs=32) | train MAE 0.3798 loss 0.3798 | val MAE 0.6478 | best 0.6478
  [trial 38] epoch 02 43.5s (bs=32) | train MAE 0.3551 loss 0.3551 | val MAE 0.4469 | best 0.4469
  [trial 38] epoch 03 43.9s (bs=32) | train MAE 0.3417 loss 0.3417 | val MAE 0.4670 | best 0.4469
  [trial 38] epoch 04 43.4s (bs=32) | train MAE 0.3376 loss 0.3376 | val MAE 0.4085 | best 0.4085
  [trial 38] epoch 05 42.7s (bs=32) | train MAE 0.3297 loss 0.3297 | val MAE 0.3342 | best 0.3342
                                                                                         Best trial: 9. Best value: 0.268863:  76%|███████▌  | 38/50 [6:32:14<1:34:32, 472.71s/it]Best trial: 9. Best value: 0.268863:  76%|███████▌  | 38/50 [6:32:14<1:34:32, 472.71s/it]Best trial: 9. Best value: 0.268863:  78%|███████▊  | 39/50 [6:32:14<1:15:10, 410.03s/it]  [trial 38] PRUNED at epoch 5
[I 2026-05-13 07:38:12,452] Trial 38 pruned. 
  [trial 39] epoch 00 63.2s (bs=32) | train MAE 0.4982 loss 0.4981 | val MAE 0.4010 | best 0.4010
  [trial 39] epoch 01 63.0s (bs=32) | train MAE 0.3751 loss 0.3752 | val MAE 0.3472 | best 0.3472
  [trial 39] epoch 02 62.1s (bs=32) | train MAE 0.3542 loss 0.3542 | val MAE 0.3426 | best 0.3426
  [trial 39] epoch 03 62.8s (bs=32) | train MAE 0.3338 loss 0.3337 | val MAE 0.2996 | best 0.2996
  [trial 39] epoch 04 62.8s (bs=32) | train MAE 0.3238 loss 0.3237 | val MAE 0.3258 | best 0.2996
  [trial 39] epoch 05 63.5s (bs=32) | train MAE 0.3200 loss 0.3200 | val MAE 0.3188 | best 0.2996
  [trial 39] epoch 06 62.8s (bs=32) | train MAE 0.3143 loss 0.3142 | val MAE 0.3017 | best 0.2996
  [trial 39] epoch 07 61.9s (bs=32) | train MAE 0.3110 loss 0.3110 | val MAE 0.2949 | best 0.2949
  [trial 39] epoch 08 63.2s (bs=32) | train MAE 0.3113 loss 0.3113 | val MAE 0.2971 | best 0.2949
  [trial 39] epoch 09 62.2s (bs=32) | train MAE 0.3026 loss 0.3026 | val MAE 0.3114 | best 0.2949
  [trial 39] epoch 10 62.8s (bs=32) | train MAE 0.2966 loss 0.2967 | val MAE 0.2777 | best 0.2777
  [trial 39] epoch 11 62.9s (bs=32) | train MAE 0.2952 loss 0.2952 | val MAE 0.2905 | best 0.2777
  [trial 39] epoch 12 61.9s (bs=32) | train MAE 0.2928 loss 0.2928 | val MAE 0.3187 | best 0.2777
  [trial 39] epoch 13 62.3s (bs=32) | train MAE 0.2905 loss 0.2905 | val MAE 0.2839 | best 0.2777
  [trial 39] epoch 14 63.1s (bs=32) | train MAE 0.2866 loss 0.2866 | val MAE 0.2879 | best 0.2777
  [trial 39] epoch 15 62.5s (bs=32) | train MAE 0.2831 loss 0.2832 | val MAE 0.2815 | best 0.2777
  [trial 39] epoch 16 63.3s (bs=32) | train MAE 0.2827 loss 0.2827 | val MAE 0.2825 | best 0.2777
  [trial 39] epoch 17 62.4s (bs=32) | train MAE 0.2804 loss 0.2804 | val MAE 0.2847 | best 0.2777
  [trial 39] epoch 18 62.1s (bs=32) | train MAE 0.2794 loss 0.2794 | val MAE 0.2819 | best 0.2777
  [trial 39] epoch 19 62.2s (bs=32) | train MAE 0.2799 loss 0.2799 | val MAE 0.2836 | best 0.2777
                                                                                         Best trial: 9. Best value: 0.268863:  78%|███████▊  | 39/50 [6:53:11<1:15:10, 410.03s/it]Best trial: 9. Best value: 0.268863:  78%|███████▊  | 39/50 [6:53:11<1:15:10, 410.03s/it]Best trial: 9. Best value: 0.268863:  80%|████████  | 40/50 [6:53:11<1:50:41, 664.15s/it][I 2026-05-13 07:59:09,567] Trial 39 finished with value: 0.27774340201051206 and parameters: {'hidden_dim': 640, 'num_heads': 40, 'ffn_ratio': 2, 'num_layers': 4, 'dropout': 0.4, 'hop_mode': 'contiguous', 'hop_window': 4, 'num_global_heads': 3, 'graph_pool': 'sum', 'lr': 0.0003416613571979069, 'weight_decay': 3.661248028573301e-05}. Best is trial 9 with value: 0.2688628450970329.
  [trial 40] epoch 00 47.5s (bs=32) | train MAE 0.4863 loss 0.4862 | val MAE 0.3735 | best 0.3735
  [trial 40] epoch 01 46.6s (bs=32) | train MAE 0.3694 loss 0.3695 | val MAE 0.3199 | best 0.3199
  [trial 40] epoch 02 46.6s (bs=32) | train MAE 0.3431 loss 0.3432 | val MAE 0.3793 | best 0.3199
  [trial 40] epoch 03 46.1s (bs=32) | train MAE 0.3319 loss 0.3318 | val MAE 0.3475 | best 0.3199
  [trial 40] epoch 04 47.1s (bs=32) | train MAE 0.3223 loss 0.3223 | val MAE 0.3167 | best 0.3167
  [trial 40] epoch 05 47.0s (bs=32) | train MAE 0.3269 loss 0.3269 | val MAE 0.3066 | best 0.3066
  [trial 40] epoch 06 47.2s (bs=32) | train MAE 0.3216 loss 0.3216 | val MAE 0.3033 | best 0.3033
  [trial 40] epoch 07 47.6s (bs=32) | train MAE 0.3138 loss 0.3138 | val MAE 0.2953 | best 0.2953
  [trial 40] epoch 08 49.3s (bs=32) | train MAE 0.3071 loss 0.3070 | val MAE 0.2868 | best 0.2868
  [trial 40] epoch 09 46.4s (bs=32) | train MAE 0.3047 loss 0.3047 | val MAE 0.2975 | best 0.2868
  [trial 40] epoch 10 47.0s (bs=32) | train MAE 0.2993 loss 0.2993 | val MAE 0.2976 | best 0.2868
  [trial 40] epoch 11 47.3s (bs=32) | train MAE 0.2961 loss 0.2961 | val MAE 0.3048 | best 0.2868
  [trial 40] epoch 12 46.6s (bs=32) | train MAE 0.2949 loss 0.2951 | val MAE 0.2996 | best 0.2868
  [trial 40] epoch 13 46.6s (bs=32) | train MAE 0.2921 loss 0.2921 | val MAE 0.2786 | best 0.2786
  [trial 40] epoch 14 46.0s (bs=32) | train MAE 0.2879 loss 0.2878 | val MAE 0.2773 | best 0.2773
  [trial 40] epoch 15 47.8s (bs=32) | train MAE 0.2844 loss 0.2844 | val MAE 0.2812 | best 0.2773
  [trial 40] epoch 16 46.3s (bs=32) | train MAE 0.2820 loss 0.2819 | val MAE 0.2798 | best 0.2773
  [trial 40] epoch 17 45.6s (bs=32) | train MAE 0.2805 loss 0.2806 | val MAE 0.2761 | best 0.2761
  [trial 40] epoch 18 45.5s (bs=32) | train MAE 0.2791 loss 0.2791 | val MAE 0.2766 | best 0.2761
  [trial 40] epoch 19 46.5s (bs=32) | train MAE 0.2778 loss 0.2778 | val MAE 0.2763 | best 0.2761
                                                                                         Best trial: 9. Best value: 0.268863:  80%|████████  | 40/50 [7:08:52<1:50:41, 664.15s/it]Best trial: 9. Best value: 0.268863:  80%|████████  | 40/50 [7:08:52<1:50:41, 664.15s/it]Best trial: 9. Best value: 0.268863:  82%|████████▏ | 41/50 [7:08:52<1:52:03, 747.09s/it][I 2026-05-13 08:14:50,169] Trial 40 finished with value: 0.27608371157669676 and parameters: {'hidden_dim': 640, 'num_heads': 20, 'ffn_ratio': 4, 'num_layers': 2, 'dropout': 0.3, 'hop_mode': 'contiguous', 'hop_window': 5, 'num_global_heads': 4, 'graph_pool': 'mean', 'lr': 0.0004195016478770809, 'weight_decay': 0.00019450175407442045}. Best is trial 9 with value: 0.2688628450970329.
  [trial 41] epoch 00 56.9s (bs=32) | train MAE 0.4822 loss 0.4821 | val MAE 0.3684 | best 0.3684
  [trial 41] epoch 01 56.8s (bs=32) | train MAE 0.3687 loss 0.3687 | val MAE 0.3486 | best 0.3486
  [trial 41] epoch 02 56.1s (bs=32) | train MAE 0.3419 loss 0.3419 | val MAE 0.3185 | best 0.3185
  [trial 41] epoch 03 55.9s (bs=32) | train MAE 0.3283 loss 0.3283 | val MAE 0.3260 | best 0.3185
  [trial 41] epoch 04 56.2s (bs=32) | train MAE 0.3251 loss 0.3251 | val MAE 0.3864 | best 0.3185
  [trial 41] epoch 05 56.9s (bs=32) | train MAE 0.3188 loss 0.3188 | val MAE 0.3115 | best 0.3115
  [trial 41] epoch 06 57.5s (bs=32) | train MAE 0.3240 loss 0.3239 | val MAE 0.3038 | best 0.3038
  [trial 41] epoch 07 56.6s (bs=32) | train MAE 0.3167 loss 0.3167 | val MAE 0.3066 | best 0.3038
  [trial 41] epoch 08 58.0s (bs=32) | train MAE 0.3097 loss 0.3097 | val MAE 0.2921 | best 0.2921
  [trial 41] epoch 09 56.8s (bs=32) | train MAE 0.3068 loss 0.3067 | val MAE 0.2993 | best 0.2921
  [trial 41] epoch 10 56.4s (bs=32) | train MAE 0.3047 loss 0.3047 | val MAE 0.2956 | best 0.2921
  [trial 41] epoch 11 58.6s (bs=32) | train MAE 0.2978 loss 0.2978 | val MAE 0.2835 | best 0.2835
  [trial 41] epoch 12 56.3s (bs=32) | train MAE 0.2970 loss 0.2970 | val MAE 0.2863 | best 0.2835
  [trial 41] epoch 13 57.3s (bs=32) | train MAE 0.2942 loss 0.2942 | val MAE 0.2766 | best 0.2766
  [trial 41] epoch 14 57.0s (bs=32) | train MAE 0.2906 loss 0.2906 | val MAE 0.2890 | best 0.2766
  [trial 41] epoch 15 57.2s (bs=32) | train MAE 0.2874 loss 0.2874 | val MAE 0.2774 | best 0.2766
  [trial 41] epoch 16 57.3s (bs=32) | train MAE 0.2862 loss 0.2862 | val MAE 0.2795 | best 0.2766
  [trial 41] epoch 17 57.6s (bs=32) | train MAE 0.2847 loss 0.2847 | val MAE 0.2767 | best 0.2766
  [trial 41] epoch 18 56.2s (bs=32) | train MAE 0.2849 loss 0.2849 | val MAE 0.2738 | best 0.2738
  [trial 41] epoch 19 56.4s (bs=32) | train MAE 0.2838 loss 0.2838 | val MAE 0.2739 | best 0.2738
                                                                                         Best trial: 9. Best value: 0.268863:  82%|████████▏ | 41/50 [7:27:54<1:52:03, 747.09s/it]Best trial: 9. Best value: 0.268863:  82%|████████▏ | 41/50 [7:27:54<1:52:03, 747.09s/it]Best trial: 9. Best value: 0.268863:  84%|████████▍ | 42/50 [7:27:54<1:55:24, 865.55s/it][I 2026-05-13 08:33:52,126] Trial 41 finished with value: 0.2737761654376253 and parameters: {'hidden_dim': 640, 'num_heads': 40, 'ffn_ratio': 2, 'num_layers': 3, 'dropout': 0.35000000000000003, 'hop_mode': 'contiguous', 'hop_window': 2, 'num_global_heads': 2, 'graph_pool': 'mean', 'lr': 0.0005528022581890588, 'weight_decay': 0.0003070562773755116}. Best is trial 9 with value: 0.2688628450970329.
  [trial 42] epoch 00 57.1s (bs=32) | train MAE 0.4878 loss 0.4878 | val MAE 0.4735 | best 0.4735
  [trial 42] epoch 01 56.5s (bs=32) | train MAE 0.3712 loss 0.3712 | val MAE 0.3636 | best 0.3636
  [trial 42] epoch 02 57.4s (bs=32) | train MAE 0.3451 loss 0.3451 | val MAE 0.3418 | best 0.3418
  [trial 42] epoch 03 56.1s (bs=32) | train MAE 0.3343 loss 0.3343 | val MAE 0.3048 | best 0.3048
  [trial 42] epoch 04 56.4s (bs=32) | train MAE 0.3251 loss 0.3252 | val MAE 0.3083 | best 0.3048
  [trial 42] epoch 05 56.3s (bs=32) | train MAE 0.3270 loss 0.3270 | val MAE 0.3361 | best 0.3048
  [trial 42] epoch 06 56.6s (bs=32) | train MAE 0.3174 loss 0.3174 | val MAE 0.2952 | best 0.2952
  [trial 42] epoch 07 56.4s (bs=32) | train MAE 0.3099 loss 0.3099 | val MAE 0.2945 | best 0.2945
  [trial 42] epoch 08 54.8s (bs=32) | train MAE 0.3081 loss 0.3080 | val MAE 0.2960 | best 0.2945
  [trial 42] epoch 09 55.7s (bs=32) | train MAE 0.3042 loss 0.3042 | val MAE 0.2965 | best 0.2945
  [trial 42] epoch 10 55.7s (bs=32) | train MAE 0.2995 loss 0.2994 | val MAE 0.2840 | best 0.2840
  [trial 42] epoch 11 57.1s (bs=32) | train MAE 0.2963 loss 0.2963 | val MAE 0.2957 | best 0.2840
  [trial 42] epoch 12 56.4s (bs=32) | train MAE 0.2945 loss 0.2945 | val MAE 0.2916 | best 0.2840
  [trial 42] epoch 13 55.0s (bs=32) | train MAE 0.2923 loss 0.2923 | val MAE 0.2908 | best 0.2840
  [trial 42] epoch 14 58.9s (bs=32) | train MAE 0.2894 loss 0.2894 | val MAE 0.3006 | best 0.2840
  [trial 42] epoch 15 56.4s (bs=32) | train MAE 0.2860 loss 0.2861 | val MAE 0.2868 | best 0.2840
                                                                                         Best trial: 9. Best value: 0.268863:  84%|████████▍ | 42/50 [7:43:00<1:55:24, 865.55s/it]Best trial: 9. Best value: 0.268863:  84%|████████▍ | 42/50 [7:43:00<1:55:24, 865.55s/it]Best trial: 9. Best value: 0.268863:  86%|████████▌ | 43/50 [7:43:00<1:42:24, 877.83s/it]  [trial 42] PRUNED at epoch 15
[I 2026-05-13 08:48:58,622] Trial 42 pruned. 
  [trial 43] epoch 00 58.6s (bs=32) | train MAE 0.4922 loss 0.4921 | val MAE 0.5215 | best 0.5215
  [trial 43] epoch 01 58.5s (bs=32) | train MAE 0.3784 loss 0.3783 | val MAE 0.3818 | best 0.3818
  [trial 43] epoch 02 57.7s (bs=32) | train MAE 0.3465 loss 0.3465 | val MAE 0.3202 | best 0.3202
  [trial 43] epoch 03 59.9s (bs=32) | train MAE 0.3461 loss 0.3461 | val MAE 0.3543 | best 0.3202
  [trial 43] epoch 04 57.4s (bs=32) | train MAE 0.3298 loss 0.3298 | val MAE 0.3119 | best 0.3119
  [trial 43] epoch 05 58.5s (bs=32) | train MAE 0.3284 loss 0.3284 | val MAE 0.3054 | best 0.3054
  [trial 43] epoch 06 59.1s (bs=32) | train MAE 0.3284 loss 0.3284 | val MAE 0.3251 | best 0.3054
                                                                                         Best trial: 9. Best value: 0.268863:  86%|████████▌ | 43/50 [7:49:53<1:42:24, 877.83s/it]Best trial: 9. Best value: 0.268863:  86%|████████▌ | 43/50 [7:49:53<1:42:24, 877.83s/it]Best trial: 9. Best value: 0.268863:  88%|████████▊ | 44/50 [7:49:53<1:13:48, 738.14s/it]  [trial 43] PRUNED at epoch 6
[I 2026-05-13 08:55:50,822] Trial 43 pruned. 
  [trial 44] epoch 00 65.2s (bs=32) | train MAE 0.4811 loss 0.4811 | val MAE 0.3447 | best 0.3447
  [trial 44] epoch 01 67.3s (bs=32) | train MAE 0.3803 loss 0.3803 | val MAE 0.3294 | best 0.3294
  [trial 44] epoch 02 66.5s (bs=32) | train MAE 0.3566 loss 0.3565 | val MAE 0.3586 | best 0.3294
  [trial 44] epoch 03 65.2s (bs=32) | train MAE 0.3538 loss 0.3538 | val MAE 0.3291 | best 0.3291
  [trial 44] epoch 04 66.1s (bs=32) | train MAE 0.3405 loss 0.3405 | val MAE 0.3431 | best 0.3291
  [trial 44] epoch 05 67.0s (bs=32) | train MAE 0.3334 loss 0.3334 | val MAE 0.3041 | best 0.3041
  [trial 44] epoch 06 65.2s (bs=32) | train MAE 0.3396 loss 0.3396 | val MAE 0.3768 | best 0.3041
  [trial 44] epoch 07 66.6s (bs=32) | train MAE 0.3402 loss 0.3402 | val MAE 0.3165 | best 0.3041
  [trial 44] epoch 08 66.0s (bs=32) | train MAE 0.3421 loss 0.3422 | val MAE 0.3229 | best 0.3041
                                                                                         Best trial: 9. Best value: 0.268863:  88%|████████▊ | 44/50 [7:59:50<1:13:48, 738.14s/it]Best trial: 9. Best value: 0.268863:  88%|████████▊ | 44/50 [7:59:50<1:13:48, 738.14s/it]Best trial: 9. Best value: 0.268863:  90%|█████████ | 45/50 [7:59:50<58:00, 696.04s/it]    [trial 44] PRUNED at epoch 8
[I 2026-05-13 09:05:48,635] Trial 44 pruned. 
  [trial 45] epoch 00 47.4s (bs=32) | train MAE 0.4749 loss 0.4748 | val MAE 0.3498 | best 0.3498
  [trial 45] epoch 01 47.5s (bs=32) | train MAE 0.3629 loss 0.3628 | val MAE 0.3360 | best 0.3360
  [trial 45] epoch 02 46.4s (bs=32) | train MAE 0.3581 loss 0.3581 | val MAE 0.3709 | best 0.3360
  [trial 45] epoch 03 47.7s (bs=32) | train MAE 0.3501 loss 0.3501 | val MAE 0.3326 | best 0.3326
  [trial 45] epoch 04 47.8s (bs=32) | train MAE 0.3360 loss 0.3360 | val MAE 0.3268 | best 0.3268
  [trial 45] epoch 05 48.1s (bs=32) | train MAE 0.3467 loss 0.3467 | val MAE 0.3132 | best 0.3132
  [trial 45] epoch 06 47.6s (bs=32) | train MAE 0.3292 loss 0.3292 | val MAE 0.3109 | best 0.3109
                                                                                       Best trial: 9. Best value: 0.268863:  90%|█████████ | 45/50 [8:05:25<58:00, 696.04s/it]Best trial: 9. Best value: 0.268863:  90%|█████████ | 45/50 [8:05:25<58:00, 696.04s/it]Best trial: 9. Best value: 0.268863:  92%|█████████▏| 46/50 [8:05:25<39:10, 587.74s/it]  [trial 45] PRUNED at epoch 6
